"No.","Time","Source","Destination","Protocol","Length","Info","Packet payload length","TCP source port","TCP destination port","TCP flags","HTTP request"
"1","0.000000","192.168.1.18","255.255.255.255","DHCP","328","DHCP Inform   - Transaction ID 0xeb0251cc","","","","",""
"2","3.993607","192.168.1.18","255.255.255.255","DHCP","328","DHCP Inform   - Transaction ID 0xeb0251cc","","","","",""
"3","82.820545","192.168.1.18","255.255.255.255","DHCP","328","DHCP Inform   - Transaction ID 0xe7487ad9","","","","",""
"4","83.709747","127.0.0.1","127.0.0.1","TCP","52","49798  >  3306 [SYN] Seq=0 Win=8192 Len=0 MSS=65495 WS=256 SACK_PERM=1","0","49798","3306","0x002",""
"5","83.709747","127.0.0.1","127.0.0.1","TCP","52","3306  >  49798 [SYN, ACK] Seq=0 Ack=1 Win=8192 Len=0 MSS=65495 WS=256 SACK_PERM=1","0","3306","49798","0x012",""
"6","83.709747","127.0.0.1","127.0.0.1","TCP","40","49798  >  3306 [ACK] Seq=1 Ack=1 Win=8192 Len=0","0","49798","3306","0x010",""
"7","83.709747","127.0.0.1","127.0.0.1","MySQL","118","Server Greeting proto=10 version=5.6.20","78","3306","49798","0x018",""
"8","83.709747","127.0.0.1","127.0.0.1","TCP","40","49798  >  3306 [ACK] Seq=1 Ack=79 Win=7936 Len=0","0","49798","3306","0x010",""
"9","83.709747","127.0.0.1","127.0.0.1","MySQL","127","Login Request user=root","87","49798","3306","0x018",""
"10","83.709747","127.0.0.1","127.0.0.1","TCP","40","3306  >  49798 [ACK] Seq=79 Ack=88 Win=7936 Len=0","0","3306","49798","0x010",""
"11","83.709747","127.0.0.1","127.0.0.1","MySQL","88","Auth Switch Request","48","3306","49798","0x018",""
"12","83.709747","127.0.0.1","127.0.0.1","TCP","40","49798  >  3306 [ACK] Seq=88 Ack=127 Win=7936 Len=0","0","49798","3306","0x010",""
"13","83.709747","127.0.0.1","127.0.0.1","MySQL","44","Auth Switch Response","4","49798","3306","0x018",""
"14","83.709747","127.0.0.1","127.0.0.1","TCP","40","3306  >  49798 [ACK] Seq=127 Ack=92 Win=7936 Len=0","0","3306","49798","0x010",""
"15","83.709747","127.0.0.1","127.0.0.1","MySQL","51","Response OK","11","3306","49798","0x018",""
"16","83.709747","127.0.0.1","127.0.0.1","TCP","40","49798  >  3306 [ACK] Seq=92 Ack=138 Win=7936 Len=0","0","49798","3306","0x010",""
"17","83.709747","127.0.0.1","127.0.0.1","MySQL","47","Request Set Option","7","49798","3306","0x018",""
"18","83.709747","127.0.0.1","127.0.0.1","TCP","40","3306  >  49798 [ACK] Seq=138 Ack=99 Win=7936 Len=0","0","3306","49798","0x010",""
"19","83.709747","127.0.0.1","127.0.0.1","MySQL","49","Response","9","3306","49798","0x018",""
"20","83.709747","127.0.0.1","127.0.0.1","TCP","40","49798  >  3306 [ACK] Seq=99 Ack=147 Win=7936 Len=0","0","49798","3306","0x010",""
"21","83.709747","127.0.0.1","127.0.0.1","MySQL","87","Request Query","47","49798","3306","0x018",""
"22","83.709747","127.0.0.1","127.0.0.1","TCP","40","3306  >  49798 [ACK] Seq=147 Ack=146 Win=7936 Len=0","0","3306","49798","0x010",""
"23","83.709747","127.0.0.1","127.0.0.1","MySQL","51","Response OK","11","3306","49798","0x018",""
"24","83.709747","127.0.0.1","127.0.0.1","TCP","40","49798  >  3306 [ACK] Seq=146 Ack=158 Win=7936 Len=0","0","49798","3306","0x010",""
"25","83.709747","127.0.0.1","127.0.0.1","MySQL","49","Request Use Database","9","49798","3306","0x018",""
"26","83.709747","127.0.0.1","127.0.0.1","TCP","40","3306  >  49798 [ACK] Seq=158 Ack=155 Win=7936 Len=0","0","3306","49798","0x010",""
"27","83.709747","127.0.0.1","127.0.0.1","MySQL","51","Response OK","11","3306","49798","0x018",""
"28","83.709747","127.0.0.1","127.0.0.1","TCP","40","49798  >  3306 [ACK] Seq=155 Ack=169 Win=7936 Len=0","0","49798","3306","0x010",""
"29","83.709747","127.0.0.1","127.0.0.1","MySQL","106","Request Query","66","49798","3306","0x018",""
"30","83.709747","127.0.0.1","127.0.0.1","TCP","40","3306  >  49798 [ACK] Seq=169 Ack=221 Win=7936 Len=0","0","3306","49798","0x010",""
"31","84.084147","127.0.0.1","127.0.0.1","MySQL","109","Response","69","3306","49798","0x018",""
"32","84.084147","127.0.0.1","127.0.0.1","TCP","40","49798  >  3306 [ACK] Seq=221 Ack=238 Win=7936 Len=0","0","49798","3306","0x010",""
"33","84.146548","127.0.0.1","127.0.0.1","MySQL","620","Request Query","580","49798","3306","0x018",""
"34","84.146548","127.0.0.1","127.0.0.1","TCP","40","3306  >  49798 [ACK] Seq=238 Ack=801 Win=7168 Len=0","0","3306","49798","0x010",""
"35","84.146548","127.0.0.1","127.0.0.1","MySQL","101","Response Error 1146","61","3306","49798","0x018",""
"36","84.146548","127.0.0.1","127.0.0.1","TCP","40","49798  >  3306 [ACK] Seq=801 Ack=299 Win=7680 Len=0","0","49798","3306","0x010",""
"37","84.146548","127.0.0.1","127.0.0.1","MySQL","117","Request Query","77","49798","3306","0x018",""
"38","84.146548","127.0.0.1","127.0.0.1","TCP","40","3306  >  49798 [ACK] Seq=299 Ack=878 Win=7168 Len=0","0","3306","49798","0x010",""
"39","84.676948","127.0.0.1","127.0.0.1","MySQL","51","Response OK","11","3306","49798","0x018",""
"40","84.676948","127.0.0.1","127.0.0.1","TCP","40","49798  >  3306 [ACK] Seq=878 Ack=310 Win=7680 Len=0","0","49798","3306","0x010",""
"41","84.676948","127.0.0.1","127.0.0.1","MySQL","620","Request Query","580","49798","3306","0x018",""
"42","84.676948","127.0.0.1","127.0.0.1","TCP","40","3306  >  49798 [ACK] Seq=310 Ack=1458 Win=6656 Len=0","0","3306","49798","0x010",""
"43","84.676948","127.0.0.1","127.0.0.1","MySQL","51","Response OK","11","3306","49798","0x018",""
"44","84.676948","127.0.0.1","127.0.0.1","TCP","40","49798  >  3306 [ACK] Seq=1458 Ack=321 Win=7680 Len=0","0","49798","3306","0x010",""
"45","85.020149","127.0.0.1","127.0.0.1","MySQL","45","Request Quit","5","49798","3306","0x018",""
"46","85.020149","127.0.0.1","127.0.0.1","TCP","40","3306  >  49798 [ACK] Seq=321 Ack=1463 Win=8192 Len=0","0","3306","49798","0x010",""
"47","85.020149","127.0.0.1","127.0.0.1","TCP","40","3306  >  49798 [FIN, ACK] Seq=321 Ack=1463 Win=8192 Len=0","0","3306","49798","0x011",""
"48","85.020149","127.0.0.1","127.0.0.1","TCP","40","49798  >  3306 [ACK] Seq=1463 Ack=322 Win=7680 Len=0","0","49798","3306","0x010",""
"49","85.020149","127.0.0.1","127.0.0.1","TCP","40","49798  >  3306 [FIN, ACK] Seq=1463 Ack=322 Win=7680 Len=0","0","49798","3306","0x011",""
"50","85.020149","127.0.0.1","127.0.0.1","TCP","40","3306  >  49798 [ACK] Seq=322 Ack=1464 Win=8192 Len=0","0","3306","49798","0x010",""
"51","85.831351","192.168.1.18","255.255.255.255","DHCP","328","DHCP Inform   - Transaction ID 0xe7487ad9","","","","",""
"52","145.403333","127.0.0.1","127.0.0.1","TCP","52","50029  >  3306 [SYN] Seq=0 Win=8192 Len=0 MSS=65495 WS=256 SACK_PERM=1","0","50029","3306","0x002",""
"53","145.403333","127.0.0.1","127.0.0.1","TCP","52","3306  >  50029 [SYN, ACK] Seq=0 Ack=1 Win=8192 Len=0 MSS=65495 WS=256 SACK_PERM=1","0","3306","50029","0x012",""
"54","145.403333","127.0.0.1","127.0.0.1","TCP","40","50029  >  3306 [ACK] Seq=1 Ack=1 Win=8192 Len=0","0","50029","3306","0x010",""
"55","145.465733","127.0.0.1","127.0.0.1","MySQL","118","Server Greeting proto=10 version=5.6.20","78","3306","50029","0x018",""
"56","145.465733","127.0.0.1","127.0.0.1","TCP","40","50029  >  3306 [ACK] Seq=1 Ack=79 Win=7936 Len=0","0","50029","3306","0x010",""
"57","145.465733","127.0.0.1","127.0.0.1","MySQL","127","Login Request user=root","87","50029","3306","0x018",""
"58","145.465733","127.0.0.1","127.0.0.1","TCP","40","3306  >  50029 [ACK] Seq=79 Ack=88 Win=7936 Len=0","0","3306","50029","0x010",""
"59","145.465733","127.0.0.1","127.0.0.1","MySQL","88","Auth Switch Request","48","3306","50029","0x018",""
"60","145.465733","127.0.0.1","127.0.0.1","TCP","40","50029  >  3306 [ACK] Seq=88 Ack=127 Win=7936 Len=0","0","50029","3306","0x010",""
"61","145.465733","127.0.0.1","127.0.0.1","MySQL","44","Auth Switch Response","4","50029","3306","0x018",""
"62","145.465733","127.0.0.1","127.0.0.1","TCP","40","3306  >  50029 [ACK] Seq=127 Ack=92 Win=7936 Len=0","0","3306","50029","0x010",""
"63","145.465733","127.0.0.1","127.0.0.1","MySQL","51","Response OK","11","3306","50029","0x018",""
"64","145.465733","127.0.0.1","127.0.0.1","TCP","40","50029  >  3306 [ACK] Seq=92 Ack=138 Win=7936 Len=0","0","50029","3306","0x010",""
"65","145.465733","127.0.0.1","127.0.0.1","MySQL","47","Request Set Option","7","50029","3306","0x018",""
"66","145.465733","127.0.0.1","127.0.0.1","TCP","40","3306  >  50029 [ACK] Seq=138 Ack=99 Win=7936 Len=0","0","3306","50029","0x010",""
"67","145.465733","127.0.0.1","127.0.0.1","MySQL","49","Response","9","3306","50029","0x018",""
"68","145.465733","127.0.0.1","127.0.0.1","TCP","40","50029  >  3306 [ACK] Seq=99 Ack=147 Win=7936 Len=0","0","50029","3306","0x010",""
"69","145.465733","127.0.0.1","127.0.0.1","MySQL","87","Request Query","47","50029","3306","0x018",""
"70","145.465733","127.0.0.1","127.0.0.1","TCP","40","3306  >  50029 [ACK] Seq=147 Ack=146 Win=7936 Len=0","0","3306","50029","0x010",""
"71","145.481333","127.0.0.1","127.0.0.1","MySQL","51","Response OK","11","3306","50029","0x018",""
"72","145.481333","127.0.0.1","127.0.0.1","TCP","40","50029  >  3306 [ACK] Seq=146 Ack=158 Win=7936 Len=0","0","50029","3306","0x010",""
"73","145.481333","127.0.0.1","127.0.0.1","MySQL","49","Request Use Database","9","50029","3306","0x018",""
"74","145.481333","127.0.0.1","127.0.0.1","TCP","40","3306  >  50029 [ACK] Seq=158 Ack=155 Win=7936 Len=0","0","3306","50029","0x010",""
"75","145.496933","127.0.0.1","127.0.0.1","MySQL","51","Response OK","11","3306","50029","0x018",""
"76","145.496933","127.0.0.1","127.0.0.1","TCP","40","50029  >  3306 [ACK] Seq=155 Ack=169 Win=7936 Len=0","0","50029","3306","0x010",""
"77","145.496933","127.0.0.1","127.0.0.1","MySQL","106","Request Query","66","50029","3306","0x018",""
"78","145.496933","127.0.0.1","127.0.0.1","TCP","40","3306  >  50029 [ACK] Seq=169 Ack=221 Win=7936 Len=0","0","3306","50029","0x010",""
"79","145.528133","127.0.0.1","127.0.0.1","MySQL","109","Response","69","3306","50029","0x018",""
"80","145.528133","127.0.0.1","127.0.0.1","TCP","40","50029  >  3306 [ACK] Seq=221 Ack=238 Win=7936 Len=0","0","50029","3306","0x010",""
"81","145.528133","127.0.0.1","127.0.0.1","MySQL","682","Request Query","642","50029","3306","0x018",""
"82","145.528133","127.0.0.1","127.0.0.1","TCP","40","3306  >  50029 [ACK] Seq=238 Ack=863 Win=7168 Len=0","0","3306","50029","0x010",""
"83","145.543733","127.0.0.1","127.0.0.1","MySQL","51","Response OK","11","3306","50029","0x018",""
"84","145.543733","127.0.0.1","127.0.0.1","TCP","40","50029  >  3306 [ACK] Seq=863 Ack=249 Win=7936 Len=0","0","50029","3306","0x010",""
"85","145.543733","127.0.0.1","127.0.0.1","MySQL","45","Request Quit","5","50029","3306","0x018",""
"86","145.543733","127.0.0.1","127.0.0.1","TCP","40","3306  >  50029 [ACK] Seq=249 Ack=868 Win=7168 Len=0","0","3306","50029","0x010",""
"87","145.543733","127.0.0.1","127.0.0.1","TCP","40","3306  >  50029 [FIN, ACK] Seq=249 Ack=868 Win=7168 Len=0","0","3306","50029","0x011",""
"88","145.543733","127.0.0.1","127.0.0.1","TCP","40","50029  >  3306 [FIN, ACK] Seq=868 Ack=250 Win=7936 Len=0","0","50029","3306","0x011",""
"89","145.543733","127.0.0.1","127.0.0.1","TCP","40","3306  >  50029 [ACK] Seq=250 Ack=869 Win=7168 Len=0","0","3306","50029","0x010",""
"90","145.668533","127.0.0.1","127.0.0.1","TCP","52","50030  >  3306 [SYN] Seq=0 Win=8192 Len=0 MSS=65495 WS=256 SACK_PERM=1","0","50030","3306","0x002",""
"91","145.668533","127.0.0.1","127.0.0.1","TCP","52","3306  >  50030 [SYN, ACK] Seq=0 Ack=1 Win=8192 Len=0 MSS=65495 WS=256 SACK_PERM=1","0","3306","50030","0x012",""
"92","145.668533","127.0.0.1","127.0.0.1","TCP","40","50030  >  3306 [ACK] Seq=1 Ack=1 Win=8192 Len=0","0","50030","3306","0x010",""
"93","145.684133","127.0.0.1","127.0.0.1","MySQL","118","Server Greeting proto=10 version=5.6.20","78","3306","50030","0x018",""
"94","145.684133","127.0.0.1","127.0.0.1","TCP","40","50030  >  3306 [ACK] Seq=1 Ack=79 Win=7936 Len=0","0","50030","3306","0x010",""
"95","145.684133","127.0.0.1","127.0.0.1","MySQL","127","Login Request user=root","87","50030","3306","0x018",""
"96","145.684133","127.0.0.1","127.0.0.1","TCP","40","3306  >  50030 [ACK] Seq=79 Ack=88 Win=7936 Len=0","0","3306","50030","0x010",""
"97","145.684133","127.0.0.1","127.0.0.1","MySQL","88","Auth Switch Request","48","3306","50030","0x018",""
"98","145.684133","127.0.0.1","127.0.0.1","TCP","40","50030  >  3306 [ACK] Seq=88 Ack=127 Win=7936 Len=0","0","50030","3306","0x010",""
"99","145.684133","127.0.0.1","127.0.0.1","MySQL","44","Auth Switch Response","4","50030","3306","0x018",""
"100","145.684133","127.0.0.1","127.0.0.1","TCP","40","3306  >  50030 [ACK] Seq=127 Ack=92 Win=7936 Len=0","0","3306","50030","0x010",""
"101","145.684133","127.0.0.1","127.0.0.1","MySQL","51","Response OK","11","3306","50030","0x018",""
"102","145.684133","127.0.0.1","127.0.0.1","TCP","40","50030  >  3306 [ACK] Seq=92 Ack=138 Win=7936 Len=0","0","50030","3306","0x010",""
"103","145.684133","127.0.0.1","127.0.0.1","MySQL","47","Request Set Option","7","50030","3306","0x018",""
"104","145.684133","127.0.0.1","127.0.0.1","TCP","40","3306  >  50030 [ACK] Seq=138 Ack=99 Win=7936 Len=0","0","3306","50030","0x010",""
"105","145.684133","127.0.0.1","127.0.0.1","MySQL","49","Response","9","3306","50030","0x018",""
"106","145.684133","127.0.0.1","127.0.0.1","TCP","40","50030  >  3306 [ACK] Seq=99 Ack=147 Win=7936 Len=0","0","50030","3306","0x010",""
"107","145.684133","127.0.0.1","127.0.0.1","MySQL","87","Request Query","47","50030","3306","0x018",""
"108","145.684133","127.0.0.1","127.0.0.1","TCP","40","3306  >  50030 [ACK] Seq=147 Ack=146 Win=7936 Len=0","0","3306","50030","0x010",""
"109","145.684133","127.0.0.1","127.0.0.1","MySQL","51","Response OK","11","3306","50030","0x018",""
"110","145.684133","127.0.0.1","127.0.0.1","TCP","40","50030  >  3306 [ACK] Seq=146 Ack=158 Win=7936 Len=0","0","50030","3306","0x010",""
"111","145.684133","127.0.0.1","127.0.0.1","MySQL","49","Request Use Database","9","50030","3306","0x018",""
"112","145.684133","127.0.0.1","127.0.0.1","TCP","40","3306  >  50030 [ACK] Seq=158 Ack=155 Win=7936 Len=0","0","3306","50030","0x010",""
"113","145.684133","127.0.0.1","127.0.0.1","MySQL","51","Response OK","11","3306","50030","0x018",""
"114","145.684133","127.0.0.1","127.0.0.1","TCP","40","50030  >  3306 [ACK] Seq=155 Ack=169 Win=7936 Len=0","0","50030","3306","0x010",""
"115","145.684133","127.0.0.1","127.0.0.1","MySQL","106","Request Query","66","50030","3306","0x018",""
"116","145.684133","127.0.0.1","127.0.0.1","TCP","40","3306  >  50030 [ACK] Seq=169 Ack=221 Win=7936 Len=0","0","3306","50030","0x010",""
"117","145.715333","127.0.0.1","127.0.0.1","MySQL","109","Response","69","3306","50030","0x018",""
"118","145.715333","127.0.0.1","127.0.0.1","TCP","40","50030  >  3306 [ACK] Seq=221 Ack=238 Win=7936 Len=0","0","50030","3306","0x010",""
"119","145.715333","127.0.0.1","127.0.0.1","MySQL","682","Request Query","642","50030","3306","0x018",""
"120","145.715333","127.0.0.1","127.0.0.1","TCP","40","3306  >  50030 [ACK] Seq=238 Ack=863 Win=7168 Len=0","0","3306","50030","0x010",""
"121","145.715333","127.0.0.1","127.0.0.1","MySQL","51","Response OK","11","3306","50030","0x018",""
"122","145.715333","127.0.0.1","127.0.0.1","TCP","40","50030  >  3306 [ACK] Seq=863 Ack=249 Win=7936 Len=0","0","50030","3306","0x010",""
"123","145.715333","127.0.0.1","127.0.0.1","MySQL","45","Request Quit","5","50030","3306","0x018",""
"124","145.715333","127.0.0.1","127.0.0.1","TCP","40","3306  >  50030 [ACK] Seq=249 Ack=868 Win=7168 Len=0","0","3306","50030","0x010",""
"125","145.715333","127.0.0.1","127.0.0.1","TCP","40","3306  >  50030 [FIN, ACK] Seq=249 Ack=868 Win=7168 Len=0","0","3306","50030","0x011",""
"126","145.715333","127.0.0.1","127.0.0.1","TCP","40","50030  >  3306 [FIN, ACK] Seq=868 Ack=250 Win=7936 Len=0","0","50030","3306","0x011",""
"127","145.715333","127.0.0.1","127.0.0.1","TCP","40","3306  >  50030 [ACK] Seq=250 Ack=869 Win=7168 Len=0","0","3306","50030","0x010",""
"128","145.746533","127.0.0.1","127.0.0.1","TCP","52","50031  >  3306 [SYN] Seq=0 Win=8192 Len=0 MSS=65495 WS=256 SACK_PERM=1","0","50031","3306","0x002",""
"129","145.746533","127.0.0.1","127.0.0.1","TCP","52","3306  >  50031 [SYN, ACK] Seq=0 Ack=1 Win=8192 Len=0 MSS=65495 WS=256 SACK_PERM=1","0","3306","50031","0x012",""
"130","145.746533","127.0.0.1","127.0.0.1","TCP","40","50031  >  3306 [ACK] Seq=1 Ack=1 Win=8192 Len=0","0","50031","3306","0x010",""
"131","145.762133","127.0.0.1","127.0.0.1","MySQL","118","Server Greeting proto=10 version=5.6.20","78","3306","50031","0x018",""
"132","145.762133","127.0.0.1","127.0.0.1","TCP","40","50031  >  3306 [ACK] Seq=1 Ack=79 Win=7936 Len=0","0","50031","3306","0x010",""
"133","145.762133","127.0.0.1","127.0.0.1","MySQL","127","Login Request user=root","87","50031","3306","0x018",""
"134","145.762133","127.0.0.1","127.0.0.1","TCP","40","3306  >  50031 [ACK] Seq=79 Ack=88 Win=7936 Len=0","0","3306","50031","0x010",""
"135","145.762133","127.0.0.1","127.0.0.1","MySQL","88","Auth Switch Request","48","3306","50031","0x018",""
"136","145.762133","127.0.0.1","127.0.0.1","TCP","40","50031  >  3306 [ACK] Seq=88 Ack=127 Win=7936 Len=0","0","50031","3306","0x010",""
"137","145.762133","127.0.0.1","127.0.0.1","MySQL","44","Auth Switch Response","4","50031","3306","0x018",""
"138","145.762133","127.0.0.1","127.0.0.1","TCP","40","3306  >  50031 [ACK] Seq=127 Ack=92 Win=7936 Len=0","0","3306","50031","0x010",""
"139","145.762133","127.0.0.1","127.0.0.1","MySQL","51","Response OK","11","3306","50031","0x018",""
"140","145.762133","127.0.0.1","127.0.0.1","TCP","40","50031  >  3306 [ACK] Seq=92 Ack=138 Win=7936 Len=0","0","50031","3306","0x010",""
"141","145.762133","127.0.0.1","127.0.0.1","MySQL","47","Request Set Option","7","50031","3306","0x018",""
"142","145.762133","127.0.0.1","127.0.0.1","TCP","40","3306  >  50031 [ACK] Seq=138 Ack=99 Win=7936 Len=0","0","3306","50031","0x010",""
"143","145.762133","127.0.0.1","127.0.0.1","MySQL","49","Response","9","3306","50031","0x018",""
"144","145.762133","127.0.0.1","127.0.0.1","TCP","40","50031  >  3306 [ACK] Seq=99 Ack=147 Win=7936 Len=0","0","50031","3306","0x010",""
"145","145.762133","127.0.0.1","127.0.0.1","MySQL","87","Request Query","47","50031","3306","0x018",""
"146","145.762133","127.0.0.1","127.0.0.1","TCP","40","3306  >  50031 [ACK] Seq=147 Ack=146 Win=7936 Len=0","0","3306","50031","0x010",""
"147","145.762133","127.0.0.1","127.0.0.1","MySQL","51","Response OK","11","3306","50031","0x018",""
"148","145.762133","127.0.0.1","127.0.0.1","TCP","40","50031  >  3306 [ACK] Seq=146 Ack=158 Win=7936 Len=0","0","50031","3306","0x010",""
"149","145.762133","127.0.0.1","127.0.0.1","MySQL","49","Request Use Database","9","50031","3306","0x018",""
"150","145.762133","127.0.0.1","127.0.0.1","TCP","40","3306  >  50031 [ACK] Seq=158 Ack=155 Win=7936 Len=0","0","3306","50031","0x010",""
"151","145.762133","127.0.0.1","127.0.0.1","MySQL","51","Response OK","11","3306","50031","0x018",""
"152","145.762133","127.0.0.1","127.0.0.1","TCP","40","50031  >  3306 [ACK] Seq=155 Ack=169 Win=7936 Len=0","0","50031","3306","0x010",""
"153","145.762133","127.0.0.1","127.0.0.1","MySQL","106","Request Query","66","50031","3306","0x018",""
"154","145.762133","127.0.0.1","127.0.0.1","TCP","40","3306  >  50031 [ACK] Seq=169 Ack=221 Win=7936 Len=0","0","3306","50031","0x010",""
"155","145.793333","127.0.0.1","127.0.0.1","MySQL","109","Response","69","3306","50031","0x018",""
"156","145.793333","127.0.0.1","127.0.0.1","TCP","40","50031  >  3306 [ACK] Seq=221 Ack=238 Win=7936 Len=0","0","50031","3306","0x010",""
"157","145.793333","127.0.0.1","127.0.0.1","MySQL","662","Request Query","622","50031","3306","0x018",""
"158","145.793333","127.0.0.1","127.0.0.1","TCP","40","3306  >  50031 [ACK] Seq=238 Ack=843 Win=7168 Len=0","0","3306","50031","0x010",""
"159","145.793333","127.0.0.1","127.0.0.1","MySQL","51","Response OK","11","3306","50031","0x018",""
"160","145.793333","127.0.0.1","127.0.0.1","TCP","40","50031  >  3306 [ACK] Seq=843 Ack=249 Win=7936 Len=0","0","50031","3306","0x010",""
"161","145.793333","127.0.0.1","127.0.0.1","MySQL","45","Request Quit","5","50031","3306","0x018",""
"162","145.793333","127.0.0.1","127.0.0.1","TCP","40","3306  >  50031 [ACK] Seq=249 Ack=848 Win=7168 Len=0","0","3306","50031","0x010",""
"163","145.793333","127.0.0.1","127.0.0.1","TCP","40","3306  >  50031 [FIN, ACK] Seq=249 Ack=848 Win=7168 Len=0","0","3306","50031","0x011",""
"164","145.793333","127.0.0.1","127.0.0.1","TCP","40","50031  >  3306 [FIN, ACK] Seq=848 Ack=250 Win=7936 Len=0","0","50031","3306","0x011",""
"165","145.793333","127.0.0.1","127.0.0.1","TCP","40","3306  >  50031 [ACK] Seq=250 Ack=849 Win=7168 Len=0","0","3306","50031","0x010",""
"166","173.138446","192.168.1.18","255.255.255.255","DHCP","328","DHCP Inform   - Transaction ID 0xa0bfff7e","","","","",""
"167","178.157128","192.168.1.18","255.255.255.255","DHCP","328","DHCP Inform   - Transaction ID 0xa0bfff7e","","","","",""
"168","248.025737","192.168.1.18","255.255.255.255","DHCP","328","DHCP Inform   - Transaction ID 0xea3698d3","","","","",""
"169","251.028242","192.168.1.18","255.255.255.255","DHCP","328","DHCP Inform   - Transaction ID 0xea3698d3","","","","",""
"170","292.683309","127.0.0.1","239.255.255.250","SSDP","459","NOTIFY * HTTP/1.1 ","","","","","NOTIFY"
"171","292.683309","127.0.0.1","239.255.255.250","SSDP","459","NOTIFY * HTTP/1.1 ","","","","","NOTIFY"
"172","292.683309","127.0.0.1","239.255.255.250","SSDP","468","NOTIFY * HTTP/1.1 ","","","","","NOTIFY"
"173","292.683309","127.0.0.1","239.255.255.250","SSDP","468","NOTIFY * HTTP/1.1 ","","","","","NOTIFY"
"174","292.683309","127.0.0.1","239.255.255.250","SSDP","511","NOTIFY * HTTP/1.1 ","","","","","NOTIFY"
"175","292.683309","127.0.0.1","239.255.255.250","SSDP","511","NOTIFY * HTTP/1.1 ","","","","","NOTIFY"
"176","292.703309","127.0.0.1","239.255.255.250","SSDP","525","NOTIFY * HTTP/1.1 ","","","","","NOTIFY"
"177","292.703309","127.0.0.1","239.255.255.250","SSDP","525","NOTIFY * HTTP/1.1 ","","","","","NOTIFY"
"178","292.703309","127.0.0.1","239.255.255.250","SSDP","523","NOTIFY * HTTP/1.1 ","","","","","NOTIFY"
"179","292.703309","127.0.0.1","239.255.255.250","SSDP","523","NOTIFY * HTTP/1.1 ","","","","","NOTIFY"
"180","292.703309","127.0.0.1","239.255.255.250","SSDP","539","NOTIFY * HTTP/1.1 ","","","","","NOTIFY"
"181","292.703309","127.0.0.1","239.255.255.250","SSDP","539","NOTIFY * HTTP/1.1 ","","","","","NOTIFY"
"182","295.683314","127.0.0.1","239.255.255.250","SSDP","511","NOTIFY * HTTP/1.1 ","","","","","NOTIFY"
"183","295.683314","127.0.0.1","239.255.255.250","SSDP","511","NOTIFY * HTTP/1.1 ","","","","","NOTIFY"
"184","295.683314","127.0.0.1","239.255.255.250","SSDP","468","NOTIFY * HTTP/1.1 ","","","","","NOTIFY"
"185","295.683314","127.0.0.1","239.255.255.250","SSDP","468","NOTIFY * HTTP/1.1 ","","","","","NOTIFY"
"186","295.683314","127.0.0.1","239.255.255.250","SSDP","459","NOTIFY * HTTP/1.1 ","","","","","NOTIFY"
"187","295.683314","127.0.0.1","239.255.255.250","SSDP","459","NOTIFY * HTTP/1.1 ","","","","","NOTIFY"
"188","295.703314","127.0.0.1","239.255.255.250","SSDP","539","NOTIFY * HTTP/1.1 ","","","","","NOTIFY"
"189","295.703314","127.0.0.1","239.255.255.250","SSDP","539","NOTIFY * HTTP/1.1 ","","","","","NOTIFY"
"190","295.703314","127.0.0.1","239.255.255.250","SSDP","525","NOTIFY * HTTP/1.1 ","","","","","NOTIFY"
"191","295.703314","127.0.0.1","239.255.255.250","SSDP","525","NOTIFY * HTTP/1.1 ","","","","","NOTIFY"
"192","295.703314","127.0.0.1","239.255.255.250","SSDP","523","NOTIFY * HTTP/1.1 ","","","","","NOTIFY"
"193","295.703314","127.0.0.1","239.255.255.250","SSDP","523","NOTIFY * HTTP/1.1 ","","","","","NOTIFY"
"194","298.688318","127.0.0.1","239.255.255.250","SSDP","459","NOTIFY * HTTP/1.1 ","","","","","NOTIFY"
"195","298.688318","127.0.0.1","239.255.255.250","SSDP","459","NOTIFY * HTTP/1.1 ","","","","","NOTIFY"
"196","298.688318","127.0.0.1","239.255.255.250","SSDP","468","NOTIFY * HTTP/1.1 ","","","","","NOTIFY"
"197","298.688318","127.0.0.1","239.255.255.250","SSDP","468","NOTIFY * HTTP/1.1 ","","","","","NOTIFY"
"198","298.688318","127.0.0.1","239.255.255.250","SSDP","511","NOTIFY * HTTP/1.1 ","","","","","NOTIFY"
"199","298.688318","127.0.0.1","239.255.255.250","SSDP","511","NOTIFY * HTTP/1.1 ","","","","","NOTIFY"
"200","298.708318","127.0.0.1","239.255.255.250","SSDP","539","NOTIFY * HTTP/1.1 ","","","","","NOTIFY"
"201","298.708318","127.0.0.1","239.255.255.250","SSDP","539","NOTIFY * HTTP/1.1 ","","","","","NOTIFY"
"202","298.708318","127.0.0.1","239.255.255.250","SSDP","523","NOTIFY * HTTP/1.1 ","","","","","NOTIFY"
"203","298.708318","127.0.0.1","239.255.255.250","SSDP","523","NOTIFY * HTTP/1.1 ","","","","","NOTIFY"
"204","298.708318","127.0.0.1","239.255.255.250","SSDP","525","NOTIFY * HTTP/1.1 ","","","","","NOTIFY"
"205","298.708318","127.0.0.1","239.255.255.250","SSDP","525","NOTIFY * HTTP/1.1 ","","","","","NOTIFY"
"206","412.532538","192.168.1.18","255.255.255.255","DHCP","328","DHCP Inform   - Transaction ID 0x60777b11","","","","",""
"207","415.537543","192.168.1.18","255.255.255.255","DHCP","328","DHCP Inform   - Transaction ID 0x60777b11","","","","",""
"208","670.364605","192.168.1.18","255.255.255.255","DHCP","328","DHCP Inform   - Transaction ID 0xda262ba4","","","","",""
"209","673.426150","192.168.1.18","255.255.255.255","DHCP","328","DHCP Inform   - Transaction ID 0xda262ba4","","","","",""
"210","736.691438","127.0.0.1","239.255.255.250","SSDP","511","NOTIFY * HTTP/1.1 ","","","","","NOTIFY"
"211","736.691438","127.0.0.1","239.255.255.250","SSDP","511","NOTIFY * HTTP/1.1 ","","","","","NOTIFY"
"212","736.691438","127.0.0.1","239.255.255.250","SSDP","468","NOTIFY * HTTP/1.1 ","","","","","NOTIFY"
"213","736.691438","127.0.0.1","239.255.255.250","SSDP","468","NOTIFY * HTTP/1.1 ","","","","","NOTIFY"
"214","736.691438","127.0.0.1","239.255.255.250","SSDP","459","NOTIFY * HTTP/1.1 ","","","","","NOTIFY"
"215","736.691438","127.0.0.1","239.255.255.250","SSDP","459","NOTIFY * HTTP/1.1 ","","","","","NOTIFY"
"216","736.711438","127.0.0.1","239.255.255.250","SSDP","525","NOTIFY * HTTP/1.1 ","","","","","NOTIFY"
"217","736.711438","127.0.0.1","239.255.255.250","SSDP","525","NOTIFY * HTTP/1.1 ","","","","","NOTIFY"
"218","736.711438","127.0.0.1","239.255.255.250","SSDP","523","NOTIFY * HTTP/1.1 ","","","","","NOTIFY"
"219","736.711438","127.0.0.1","239.255.255.250","SSDP","523","NOTIFY * HTTP/1.1 ","","","","","NOTIFY"
"220","736.711438","127.0.0.1","239.255.255.250","SSDP","539","NOTIFY * HTTP/1.1 ","","","","","NOTIFY"
"221","736.711438","127.0.0.1","239.255.255.250","SSDP","539","NOTIFY * HTTP/1.1 ","","","","","NOTIFY"
"222","739.695957","127.0.0.1","239.255.255.250","SSDP","459","NOTIFY * HTTP/1.1 ","","","","","NOTIFY"
"223","739.695957","127.0.0.1","239.255.255.250","SSDP","459","NOTIFY * HTTP/1.1 ","","","","","NOTIFY"
"224","739.695957","127.0.0.1","239.255.255.250","SSDP","468","NOTIFY * HTTP/1.1 ","","","","","NOTIFY"
"225","739.695957","127.0.0.1","239.255.255.250","SSDP","468","NOTIFY * HTTP/1.1 ","","","","","NOTIFY"
"226","739.695957","127.0.0.1","239.255.255.250","SSDP","511","NOTIFY * HTTP/1.1 ","","","","","NOTIFY"
"227","739.695957","127.0.0.1","239.255.255.250","SSDP","511","NOTIFY * HTTP/1.1 ","","","","","NOTIFY"
"228","739.760957","127.0.0.1","239.255.255.250","SSDP","539","NOTIFY * HTTP/1.1 ","","","","","NOTIFY"
"229","739.760957","127.0.0.1","239.255.255.250","SSDP","539","NOTIFY * HTTP/1.1 ","","","","","NOTIFY"
"230","739.761958","127.0.0.1","239.255.255.250","SSDP","525","NOTIFY * HTTP/1.1 ","","","","","NOTIFY"
"231","739.762958","127.0.0.1","239.255.255.250","SSDP","525","NOTIFY * HTTP/1.1 ","","","","","NOTIFY"
"232","739.762958","127.0.0.1","239.255.255.250","SSDP","523","NOTIFY * HTTP/1.1 ","","","","","NOTIFY"
"233","739.763958","127.0.0.1","239.255.255.250","SSDP","523","NOTIFY * HTTP/1.1 ","","","","","NOTIFY"
"234","742.699983","127.0.0.1","239.255.255.250","SSDP","468","NOTIFY * HTTP/1.1 ","","","","","NOTIFY"
"235","742.699983","127.0.0.1","239.255.255.250","SSDP","468","NOTIFY * HTTP/1.1 ","","","","","NOTIFY"
"236","742.699983","127.0.0.1","239.255.255.250","SSDP","459","NOTIFY * HTTP/1.1 ","","","","","NOTIFY"
"237","742.699983","127.0.0.1","239.255.255.250","SSDP","459","NOTIFY * HTTP/1.1 ","","","","","NOTIFY"
"238","742.699983","127.0.0.1","239.255.255.250","SSDP","511","NOTIFY * HTTP/1.1 ","","","","","NOTIFY"
"239","742.699983","127.0.0.1","239.255.255.250","SSDP","511","NOTIFY * HTTP/1.1 ","","","","","NOTIFY"
"240","742.767484","127.0.0.1","239.255.255.250","SSDP","539","NOTIFY * HTTP/1.1 ","","","","","NOTIFY"
"241","742.768484","127.0.0.1","239.255.255.250","SSDP","539","NOTIFY * HTTP/1.1 ","","","","","NOTIFY"
"242","742.769484","127.0.0.1","239.255.255.250","SSDP","525","NOTIFY * HTTP/1.1 ","","","","","NOTIFY"
"243","742.769484","127.0.0.1","239.255.255.250","SSDP","525","NOTIFY * HTTP/1.1 ","","","","","NOTIFY"
"244","742.769484","127.0.0.1","239.255.255.250","SSDP","523","NOTIFY * HTTP/1.1 ","","","","","NOTIFY"
"245","742.769484","127.0.0.1","239.255.255.250","SSDP","523","NOTIFY * HTTP/1.1 ","","","","","NOTIFY"
"246","768.293921","192.168.1.18","255.255.255.255","DHCP","328","DHCP Inform   - Transaction ID 0xe1d88957","","","","",""
"247","771.294009","192.168.1.18","255.255.255.255","DHCP","328","DHCP Inform   - Transaction ID 0xe1d88957","","","","",""
"248","1032.294854","127.0.0.1","127.0.0.1","TCP","52","50461  >  3306 [SYN] Seq=0 Win=8192 Len=0 MSS=65495 WS=256 SACK_PERM=1","0","50461","3306","0x002",""
"249","1032.294854","127.0.0.1","127.0.0.1","TCP","52","3306  >  50461 [SYN, ACK] Seq=0 Ack=1 Win=8192 Len=0 MSS=65495 WS=256 SACK_PERM=1","0","3306","50461","0x012",""
"250","1032.294854","127.0.0.1","127.0.0.1","TCP","40","50461  >  3306 [ACK] Seq=1 Ack=1 Win=8192 Len=0","0","50461","3306","0x010",""
"251","1032.329854","127.0.0.1","127.0.0.1","MySQL","118","Server Greeting proto=10 version=5.6.20","78","3306","50461","0x018",""
"252","1032.329854","127.0.0.1","127.0.0.1","TCP","40","50461  >  3306 [ACK] Seq=1 Ack=79 Win=7936 Len=0","0","50461","3306","0x010",""
"253","1032.329854","127.0.0.1","127.0.0.1","MySQL","127","Login Request user=root","87","50461","3306","0x018",""
"254","1032.329854","127.0.0.1","127.0.0.1","TCP","40","3306  >  50461 [ACK] Seq=79 Ack=88 Win=7936 Len=0","0","3306","50461","0x010",""
"255","1032.329854","127.0.0.1","127.0.0.1","MySQL","88","Auth Switch Request","48","3306","50461","0x018",""
"256","1032.329854","127.0.0.1","127.0.0.1","TCP","40","50461  >  3306 [ACK] Seq=88 Ack=127 Win=7936 Len=0","0","50461","3306","0x010",""
"257","1032.329854","127.0.0.1","127.0.0.1","MySQL","44","Auth Switch Response","4","50461","3306","0x018",""
"258","1032.329854","127.0.0.1","127.0.0.1","TCP","40","3306  >  50461 [ACK] Seq=127 Ack=92 Win=7936 Len=0","0","3306","50461","0x010",""
"259","1032.329854","127.0.0.1","127.0.0.1","MySQL","51","Response OK","11","3306","50461","0x018",""
"260","1032.329854","127.0.0.1","127.0.0.1","TCP","40","50461  >  3306 [ACK] Seq=92 Ack=138 Win=7936 Len=0","0","50461","3306","0x010",""
"261","1032.329854","127.0.0.1","127.0.0.1","MySQL","47","Request Set Option","7","50461","3306","0x018",""
"262","1032.329854","127.0.0.1","127.0.0.1","TCP","40","3306  >  50461 [ACK] Seq=138 Ack=99 Win=7936 Len=0","0","3306","50461","0x010",""
"263","1032.329854","127.0.0.1","127.0.0.1","MySQL","49","Response","9","3306","50461","0x018",""
"264","1032.329854","127.0.0.1","127.0.0.1","TCP","40","50461  >  3306 [ACK] Seq=99 Ack=147 Win=7936 Len=0","0","50461","3306","0x010",""
"265","1032.329854","127.0.0.1","127.0.0.1","MySQL","87","Request Query","47","50461","3306","0x018",""
"266","1032.329854","127.0.0.1","127.0.0.1","TCP","40","3306  >  50461 [ACK] Seq=147 Ack=146 Win=7936 Len=0","0","3306","50461","0x010",""
"267","1032.329854","127.0.0.1","127.0.0.1","MySQL","51","Response OK","11","3306","50461","0x018",""
"268","1032.329854","127.0.0.1","127.0.0.1","TCP","40","50461  >  3306 [ACK] Seq=146 Ack=158 Win=7936 Len=0","0","50461","3306","0x010",""
"269","1032.329854","127.0.0.1","127.0.0.1","MySQL","49","Request Use Database","9","50461","3306","0x018",""
"270","1032.329854","127.0.0.1","127.0.0.1","TCP","40","3306  >  50461 [ACK] Seq=158 Ack=155 Win=7936 Len=0","0","3306","50461","0x010",""
"271","1032.329854","127.0.0.1","127.0.0.1","MySQL","51","Response OK","11","3306","50461","0x018",""
"272","1032.329854","127.0.0.1","127.0.0.1","TCP","40","50461  >  3306 [ACK] Seq=155 Ack=169 Win=7936 Len=0","0","50461","3306","0x010",""
"273","1032.329854","127.0.0.1","127.0.0.1","MySQL","106","Request Query","66","50461","3306","0x018",""
"274","1032.329854","127.0.0.1","127.0.0.1","TCP","40","3306  >  50461 [ACK] Seq=169 Ack=221 Win=7936 Len=0","0","3306","50461","0x010",""
"275","1032.404855","127.0.0.1","127.0.0.1","MySQL","109","Response","69","3306","50461","0x018",""
"276","1032.404855","127.0.0.1","127.0.0.1","TCP","40","50461  >  3306 [ACK] Seq=221 Ack=238 Win=7936 Len=0","0","50461","3306","0x010",""
"277","1032.404855","127.0.0.1","127.0.0.1","MySQL","946","Request Query","906","50461","3306","0x018",""
"278","1032.404855","127.0.0.1","127.0.0.1","TCP","40","3306  >  50461 [ACK] Seq=238 Ack=1127 Win=6912 Len=0","0","3306","50461","0x010",""
"279","1032.491858","127.0.0.1","127.0.0.1","MySQL","51","Response OK","11","3306","50461","0x018",""
"280","1032.491858","127.0.0.1","127.0.0.1","TCP","40","50461  >  3306 [ACK] Seq=1127 Ack=249 Win=7936 Len=0","0","50461","3306","0x010",""
"281","1032.491858","127.0.0.1","127.0.0.1","MySQL","537","Request Query","497","50461","3306","0x018",""
"282","1032.491858","127.0.0.1","127.0.0.1","TCP","40","3306  >  50461 [ACK] Seq=249 Ack=1624 Win=8192 Len=0","0","3306","50461","0x010",""
"283","1032.506858","127.0.0.1","127.0.0.1","MySQL","357","Response","317","3306","50461","0x018",""
"284","1032.506858","127.0.0.1","127.0.0.1","TCP","40","50461  >  3306 [ACK] Seq=1624 Ack=566 Win=7424 Len=0","0","50461","3306","0x010",""
"285","1032.506858","127.0.0.1","127.0.0.1","MySQL","45","Request Quit","5","50461","3306","0x018",""
"286","1032.506858","127.0.0.1","127.0.0.1","TCP","40","3306  >  50461 [ACK] Seq=566 Ack=1629 Win=7936 Len=0","0","3306","50461","0x010",""
"287","1032.506858","127.0.0.1","127.0.0.1","TCP","40","50461  >  3306 [FIN, ACK] Seq=1629 Ack=566 Win=7424 Len=0","0","50461","3306","0x011",""
"288","1032.506858","127.0.0.1","127.0.0.1","TCP","40","3306  >  50461 [ACK] Seq=566 Ack=1630 Win=7936 Len=0","0","3306","50461","0x010",""
"289","1032.506858","127.0.0.1","127.0.0.1","TCP","40","3306  >  50461 [FIN, ACK] Seq=566 Ack=1630 Win=7936 Len=0","0","3306","50461","0x011",""
"290","1032.506858","127.0.0.1","127.0.0.1","TCP","40","50461  >  3306 [ACK] Seq=1630 Ack=567 Win=7424 Len=0","0","50461","3306","0x010",""
"291","1050.113061","127.0.0.1","239.255.255.250","SSDP","153","M-SEARCH * HTTP/1.1 ","","","","","M-SEARCH"
"292","1050.113061","127.0.0.1","239.255.255.250","SSDP","153","M-SEARCH * HTTP/1.1 ","","","","","M-SEARCH"
"293","1050.113061","127.0.0.1","239.255.255.250","SSDP","151","M-SEARCH * HTTP/1.1 ","","","","","M-SEARCH"
"294","1050.113061","127.0.0.1","239.255.255.250","SSDP","151","M-SEARCH * HTTP/1.1 ","","","","","M-SEARCH"
"295","1050.223062","127.0.0.1","127.0.0.1","TCP","52","50525  >  2869 [SYN] Seq=0 Win=8192 Len=0 MSS=65495 WS=256 SACK_PERM=1","0","50525","2869","0x002",""
"296","1050.223062","127.0.0.1","127.0.0.1","TCP","52","2869  >  50525 [SYN, ACK] Seq=0 Ack=1 Win=8192 Len=0 MSS=65495 WS=256 SACK_PERM=1","0","2869","50525","0x012",""
"297","1050.223062","127.0.0.1","127.0.0.1","TCP","40","50525  >  2869 [ACK] Seq=1 Ack=1 Win=8192 Len=0","0","50525","2869","0x010",""
"298","1050.223062","127.0.0.1","127.0.0.1","HTTP","346","GET /upnphost/udhisapi.dll?content=uuid:6c36724b-3939-4997-aeae-d10c8f681de2 HTTP/1.1 ","306","50525","2869","0x018","GET"
"299","1050.223062","127.0.0.1","127.0.0.1","TCP","40","2869  >  50525 [ACK] Seq=1 Ack=307 Win=7680 Len=0","0","2869","50525","0x010",""
"300","1050.323062","127.0.0.1","127.0.0.1","TCP","264","2869  >  50525 [PSH, ACK] Seq=1 Ack=307 Win=7680 Len=224 [TCP segment of a reassembled PDU]","224","2869","50525","0x018",""
"301","1050.323062","127.0.0.1","127.0.0.1","TCP","40","50525  >  2869 [ACK] Seq=307 Ack=225 Win=7936 Len=0","0","50525","2869","0x010",""
"302","1050.323062","127.0.0.1","127.0.0.1","TCP","1500","2869  >  50525 [ACK] Seq=225 Ack=307 Win=7680 Len=1460 [TCP segment of a reassembled PDU]","1460","2869","50525","0x010",""
"303","1050.323062","127.0.0.1","127.0.0.1","TCP","1500","2869  >  50525 [ACK] Seq=1685 Ack=307 Win=7680 Len=1460 [TCP segment of a reassembled PDU]","1460","2869","50525","0x010",""
"304","1050.323062","127.0.0.1","127.0.0.1","TCP","40","50525  >  2869 [ACK] Seq=307 Ack=3145 Win=8192 Len=0","0","50525","2869","0x010",""
"305","1050.323062","127.0.0.1","127.0.0.1","TCP","1500","2869  >  50525 [ACK] Seq=3145 Ack=307 Win=7680 Len=1460 [TCP segment of a reassembled PDU]","1460","2869","50525","0x010",""
"306","1050.323062","127.0.0.1","127.0.0.1","HTTP/XML","1476","HTTP/1.1 200 OK ","1436","2869","50525","0x019",""
"307","1050.323062","127.0.0.1","127.0.0.1","TCP","40","50525  >  2869 [ACK] Seq=307 Ack=6042 Win=8192 Len=0","0","50525","2869","0x010",""
"308","1050.323062","127.0.0.1","127.0.0.1","TCP","40","50525  >  2869 [FIN, ACK] Seq=307 Ack=6042 Win=8192 Len=0","0","50525","2869","0x011",""
"309","1050.323062","127.0.0.1","127.0.0.1","TCP","40","2869  >  50525 [ACK] Seq=6042 Ack=308 Win=7680 Len=0","0","2869","50525","0x010",""
"310","1050.545562","127.0.0.1","127.0.0.1","SSDP","472","HTTP/1.1 200 OK ","","","","",""
"311","1050.555562","127.0.0.1","127.0.0.1","TCP","52","50526  >  2869 [SYN] Seq=0 Win=8192 Len=0 MSS=65495 WS=256 SACK_PERM=1","0","50526","2869","0x002",""
"312","1050.555562","127.0.0.1","127.0.0.1","TCP","52","2869  >  50526 [SYN, ACK] Seq=0 Ack=1 Win=8192 Len=0 MSS=65495 WS=256 SACK_PERM=1","0","2869","50526","0x012",""
"313","1050.555562","127.0.0.1","127.0.0.1","TCP","40","50526  >  2869 [ACK] Seq=1 Ack=1 Win=8192 Len=0","0","50526","2869","0x010",""
"314","1050.555562","127.0.0.1","127.0.0.1","HTTP","229","GET /upnphost/udhisapi.dll?content=uuid:6d71f298-523d-421a-83b6-49c192adfa93 HTTP/1.1 ","189","50526","2869","0x018","GET"
"315","1050.555562","127.0.0.1","127.0.0.1","TCP","40","2869  >  50526 [ACK] Seq=1 Ack=190 Win=7936 Len=0","0","2869","50526","0x010",""
"316","1050.595562","127.0.0.1","127.0.0.1","TCP","229","2869  >  50526 [PSH, ACK] Seq=1 Ack=190 Win=7936 Len=189 [TCP segment of a reassembled PDU]","189","2869","50526","0x018",""
"317","1050.595562","127.0.0.1","127.0.0.1","TCP","40","50526  >  2869 [ACK] Seq=190 Ack=190 Win=7936 Len=0","0","50526","2869","0x010",""
"318","1050.595562","127.0.0.1","127.0.0.1","TCP","1500","2869  >  50526 [ACK] Seq=190 Ack=190 Win=7936 Len=1460 [TCP segment of a reassembled PDU]","1460","2869","50526","0x010",""
"319","1050.595562","127.0.0.1","127.0.0.1","TCP","1500","2869  >  50526 [ACK] Seq=1650 Ack=190 Win=7936 Len=1460 [TCP segment of a reassembled PDU]","1460","2869","50526","0x010",""
"320","1050.595562","127.0.0.1","127.0.0.1","TCP","40","50526  >  2869 [ACK] Seq=190 Ack=3110 Win=8192 Len=0","0","50526","2869","0x010",""
"321","1050.595562","127.0.0.1","127.0.0.1","TCP","1500","2869  >  50526 [ACK] Seq=3110 Ack=190 Win=7936 Len=1460 [TCP segment of a reassembled PDU]","1460","2869","50526","0x010",""
"322","1050.595562","127.0.0.1","127.0.0.1","HTTP","1086","HTTP/1.1 200 OK  (PNG)","1046","2869","50526","0x018",""
