"No.","Time","Source","Destination","Protocol","Length","Info","Packet payload length","TCP source port","TCP destination port","TCP flags","HTTP request"
"1","0.000000","192.168.1.16","255.255.255.255","DHCP","328","DHCP Inform   - Transaction ID 0xa1b63c97","","","","",""
"2","2.932805","192.168.1.16","255.255.255.255","DHCP","328","DHCP Inform   - Transaction ID 0xa1b63c97","","","","",""
"3","113.122461","192.168.1.16","255.255.255.255","DHCP","328","DHCP Inform   - Transaction ID 0x1fb58f38","","","","",""
"4","116.124002","192.168.1.16","255.255.255.255","DHCP","328","DHCP Inform   - Transaction ID 0x1fb58f38","","","","",""
"5","185.736596","127.0.0.1","239.255.255.250","SSDP","125","M-SEARCH * HTTP/1.1 ","","","","","M-SEARCH"
"6","185.754597","127.0.0.1","239.255.255.250","SSDP","125","M-SEARCH * HTTP/1.1 ","","","","","M-SEARCH"
"7","185.765597","127.0.0.1","239.255.255.250","SSDP","523","NOTIFY * HTTP/1.1 ","","","","","NOTIFY"
"8","185.765597","127.0.0.1","239.255.255.250","SSDP","523","NOTIFY * HTTP/1.1 ","","","","","NOTIFY"
"9","185.765597","127.0.0.1","239.255.255.250","SSDP","468","NOTIFY * HTTP/1.1 ","","","","","NOTIFY"
"10","185.765597","127.0.0.1","239.255.255.250","SSDP","468","NOTIFY * HTTP/1.1 ","","","","","NOTIFY"
"11","185.765597","127.0.0.1","239.255.255.250","SSDP","539","NOTIFY * HTTP/1.1 ","","","","","NOTIFY"
"12","185.765597","127.0.0.1","239.255.255.250","SSDP","539","NOTIFY * HTTP/1.1 ","","","","","NOTIFY"
"13","185.765597","127.0.0.1","239.255.255.250","SSDP","459","NOTIFY * HTTP/1.1 ","","","","","NOTIFY"
"14","185.765597","127.0.0.1","239.255.255.250","SSDP","459","NOTIFY * HTTP/1.1 ","","","","","NOTIFY"
"15","185.765597","127.0.0.1","239.255.255.250","SSDP","525","NOTIFY * HTTP/1.1 ","","","","","NOTIFY"
"16","185.765597","127.0.0.1","239.255.255.250","SSDP","525","NOTIFY * HTTP/1.1 ","","","","","NOTIFY"
"17","185.765597","127.0.0.1","239.255.255.250","SSDP","511","NOTIFY * HTTP/1.1 ","","","","","NOTIFY"
"18","185.765597","127.0.0.1","239.255.255.250","SSDP","511","NOTIFY * HTTP/1.1 ","","","","","NOTIFY"
"19","186.263599","127.0.0.1","239.255.255.250","UDP","652","59729  >  3702 Len=624","","","","",""
"20","186.263599","127.0.0.1","239.255.255.250","UDP","652","59729  >  3702 Len=624","","","","",""
"21","186.431099","127.0.0.1","239.255.255.250","UDP","652","59729  >  3702 Len=624","","","","",""
"22","186.431099","127.0.0.1","239.255.255.250","UDP","652","59729  >  3702 Len=624","","","","",""
"23","187.088107","127.0.0.1","239.255.255.250","SSDP","157","M-SEARCH * HTTP/1.1 ","","","","","M-SEARCH"
"24","187.088107","127.0.0.1","239.255.255.250","SSDP","157","M-SEARCH * HTTP/1.1 ","","","","","M-SEARCH"
"25","188.117111","127.0.0.1","127.0.0.1","SSDP","420","HTTP/1.1 200 OK ","","","","",""
"26","188.742632","127.0.0.1","239.255.255.250","SSDP","125","M-SEARCH * HTTP/1.1 ","","","","","M-SEARCH"
"27","188.742632","127.0.0.1","239.255.255.250","SSDP","125","M-SEARCH * HTTP/1.1 ","","","","","M-SEARCH"
"28","188.761633","127.0.0.1","239.255.255.250","SSDP","523","NOTIFY * HTTP/1.1 ","","","","","NOTIFY"
"29","188.761633","127.0.0.1","239.255.255.250","SSDP","523","NOTIFY * HTTP/1.1 ","","","","","NOTIFY"
"30","188.762633","127.0.0.1","239.255.255.250","SSDP","539","NOTIFY * HTTP/1.1 ","","","","","NOTIFY"
"31","188.762633","127.0.0.1","239.255.255.250","SSDP","539","NOTIFY * HTTP/1.1 ","","","","","NOTIFY"
"32","188.762633","127.0.0.1","239.255.255.250","SSDP","468","NOTIFY * HTTP/1.1 ","","","","","NOTIFY"
"33","188.762633","127.0.0.1","239.255.255.250","SSDP","468","NOTIFY * HTTP/1.1 ","","","","","NOTIFY"
"34","188.763633","127.0.0.1","239.255.255.250","SSDP","459","NOTIFY * HTTP/1.1 ","","","","","NOTIFY"
"35","188.763633","127.0.0.1","239.255.255.250","SSDP","459","NOTIFY * HTTP/1.1 ","","","","","NOTIFY"
"36","188.764633","127.0.0.1","239.255.255.250","SSDP","511","NOTIFY * HTTP/1.1 ","","","","","NOTIFY"
"37","188.764633","127.0.0.1","239.255.255.250","SSDP","511","NOTIFY * HTTP/1.1 ","","","","","NOTIFY"
"38","188.764633","127.0.0.1","239.255.255.250","SSDP","525","NOTIFY * HTTP/1.1 ","","","","","NOTIFY"
"39","188.764633","127.0.0.1","239.255.255.250","SSDP","525","NOTIFY * HTTP/1.1 ","","","","","NOTIFY"
"40","189.606639","127.0.0.1","127.0.0.1","SSDP","420","HTTP/1.1 200 OK ","","","","",""
"41","190.093154","127.0.0.1","239.255.255.250","SSDP","157","M-SEARCH * HTTP/1.1 ","","","","","M-SEARCH"
"42","190.093154","127.0.0.1","239.255.255.250","SSDP","157","M-SEARCH * HTTP/1.1 ","","","","","M-SEARCH"
"43","191.742670","127.0.0.1","239.255.255.250","SSDP","125","M-SEARCH * HTTP/1.1 ","","","","","M-SEARCH"
"44","191.742670","127.0.0.1","239.255.255.250","SSDP","125","M-SEARCH * HTTP/1.1 ","","","","","M-SEARCH"
"45","191.765170","127.0.0.1","239.255.255.250","SSDP","523","NOTIFY * HTTP/1.1 ","","","","","NOTIFY"
"46","191.765170","127.0.0.1","239.255.255.250","SSDP","523","NOTIFY * HTTP/1.1 ","","","","","NOTIFY"
"47","191.765170","127.0.0.1","239.255.255.250","SSDP","539","NOTIFY * HTTP/1.1 ","","","","","NOTIFY"
"48","191.765170","127.0.0.1","239.255.255.250","SSDP","539","NOTIFY * HTTP/1.1 ","","","","","NOTIFY"
"49","191.765170","127.0.0.1","239.255.255.250","SSDP","468","NOTIFY * HTTP/1.1 ","","","","","NOTIFY"
"50","191.765170","127.0.0.1","239.255.255.250","SSDP","468","NOTIFY * HTTP/1.1 ","","","","","NOTIFY"
"51","191.767670","127.0.0.1","239.255.255.250","SSDP","459","NOTIFY * HTTP/1.1 ","","","","","NOTIFY"
"52","191.767670","127.0.0.1","239.255.255.250","SSDP","459","NOTIFY * HTTP/1.1 ","","","","","NOTIFY"
"53","191.767670","127.0.0.1","239.255.255.250","SSDP","511","NOTIFY * HTTP/1.1 ","","","","","NOTIFY"
"54","191.767670","127.0.0.1","239.255.255.250","SSDP","511","NOTIFY * HTTP/1.1 ","","","","","NOTIFY"
"55","191.770170","127.0.0.1","239.255.255.250","SSDP","525","NOTIFY * HTTP/1.1 ","","","","","NOTIFY"
"56","191.770170","127.0.0.1","239.255.255.250","SSDP","525","NOTIFY * HTTP/1.1 ","","","","","NOTIFY"
"57","193.096695","127.0.0.1","239.255.255.250","SSDP","157","M-SEARCH * HTTP/1.1 ","","","","","M-SEARCH"
"58","193.096695","127.0.0.1","239.255.255.250","SSDP","157","M-SEARCH * HTTP/1.1 ","","","","","M-SEARCH"
"59","193.860709","127.0.0.1","127.0.0.1","SSDP","420","HTTP/1.1 200 OK ","","","","",""
"60","241.050233","192.168.1.16","255.255.255.255","DHCP","328","DHCP Inform   - Transaction ID 0x1055124b","","","","",""
"61","244.062358","192.168.1.16","255.255.255.255","DHCP","328","DHCP Inform   - Transaction ID 0x1055124b","","","","",""
"62","315.875972","192.168.1.16","255.255.255.255","DHCP","328","DHCP Inform   - Transaction ID 0xe5cfc88f","","","","",""
"63","318.877004","192.168.1.16","255.255.255.255","DHCP","328","DHCP Inform   - Transaction ID 0xe5cfc88f","","","","",""
"64","416.542577","192.168.1.16","255.255.255.255","DHCP","328","DHCP Inform   - Transaction ID 0xee3ad49b","","","","",""
"65","419.562704","192.168.1.16","255.255.255.255","DHCP","328","DHCP Inform   - Transaction ID 0xee3ad49b","","","","",""
"66","539.146062","127.0.0.1","127.0.0.1","TCP","52","50510  >  3306 [SYN] Seq=0 Win=8192 Len=0 MSS=65495 WS=256 SACK_PERM=1","0","50510","3306","0x002",""
"67","539.146062","127.0.0.1","127.0.0.1","TCP","52","3306  >  50510 [SYN, ACK] Seq=0 Ack=1 Win=8192 Len=0 MSS=65495 WS=256 SACK_PERM=1","0","3306","50510","0x012",""
"68","539.146062","127.0.0.1","127.0.0.1","TCP","40","50510  >  3306 [ACK] Seq=1 Ack=1 Win=8192 Len=0","0","50510","3306","0x010",""
"69","539.176062","127.0.0.1","127.0.0.1","MySQL","118","Server Greeting proto=10 version=5.6.20","78","3306","50510","0x018",""
"70","539.176062","127.0.0.1","127.0.0.1","TCP","40","50510  >  3306 [ACK] Seq=1 Ack=79 Win=7936 Len=0","0","50510","3306","0x010",""
"71","539.176062","127.0.0.1","127.0.0.1","MySQL","127","Login Request user=root","87","50510","3306","0x018",""
"72","539.176062","127.0.0.1","127.0.0.1","TCP","40","3306  >  50510 [ACK] Seq=79 Ack=88 Win=7936 Len=0","0","3306","50510","0x010",""
"73","539.176062","127.0.0.1","127.0.0.1","MySQL","88","Auth Switch Request","48","3306","50510","0x018",""
"74","539.176062","127.0.0.1","127.0.0.1","TCP","40","50510  >  3306 [ACK] Seq=88 Ack=127 Win=7936 Len=0","0","50510","3306","0x010",""
"75","539.176062","127.0.0.1","127.0.0.1","MySQL","44","Auth Switch Response","4","50510","3306","0x018",""
"76","539.176062","127.0.0.1","127.0.0.1","TCP","40","3306  >  50510 [ACK] Seq=127 Ack=92 Win=7936 Len=0","0","3306","50510","0x010",""
"77","539.176062","127.0.0.1","127.0.0.1","MySQL","51","Response OK","11","3306","50510","0x018",""
"78","539.176062","127.0.0.1","127.0.0.1","TCP","40","50510  >  3306 [ACK] Seq=92 Ack=138 Win=7936 Len=0","0","50510","3306","0x010",""
"79","539.176062","127.0.0.1","127.0.0.1","MySQL","47","Request Set Option","7","50510","3306","0x018",""
"80","539.176062","127.0.0.1","127.0.0.1","TCP","40","3306  >  50510 [ACK] Seq=138 Ack=99 Win=7936 Len=0","0","3306","50510","0x010",""
"81","539.176062","127.0.0.1","127.0.0.1","MySQL","49","Response","9","3306","50510","0x018",""
"82","539.176062","127.0.0.1","127.0.0.1","TCP","40","50510  >  3306 [ACK] Seq=99 Ack=147 Win=7936 Len=0","0","50510","3306","0x010",""
"83","539.176062","127.0.0.1","127.0.0.1","MySQL","87","Request Query","47","50510","3306","0x018",""
"84","539.176062","127.0.0.1","127.0.0.1","TCP","40","3306  >  50510 [ACK] Seq=147 Ack=146 Win=7936 Len=0","0","3306","50510","0x010",""
"85","539.176062","127.0.0.1","127.0.0.1","MySQL","51","Response OK","11","3306","50510","0x018",""
"86","539.176062","127.0.0.1","127.0.0.1","TCP","40","50510  >  3306 [ACK] Seq=146 Ack=158 Win=7936 Len=0","0","50510","3306","0x010",""
"87","539.176062","127.0.0.1","127.0.0.1","MySQL","49","Request Use Database","9","50510","3306","0x018",""
"88","539.176062","127.0.0.1","127.0.0.1","TCP","40","3306  >  50510 [ACK] Seq=158 Ack=155 Win=7936 Len=0","0","3306","50510","0x010",""
"89","539.186062","127.0.0.1","127.0.0.1","MySQL","51","Response OK","11","3306","50510","0x018",""
"90","539.186062","127.0.0.1","127.0.0.1","TCP","40","50510  >  3306 [ACK] Seq=155 Ack=169 Win=7936 Len=0","0","50510","3306","0x010",""
"91","539.186062","127.0.0.1","127.0.0.1","MySQL","106","Request Query","66","50510","3306","0x018",""
"92","539.186062","127.0.0.1","127.0.0.1","TCP","40","3306  >  50510 [ACK] Seq=169 Ack=221 Win=7936 Len=0","0","3306","50510","0x010",""
"93","539.256062","127.0.0.1","127.0.0.1","MySQL","109","Response","69","3306","50510","0x018",""
"94","539.256062","127.0.0.1","127.0.0.1","TCP","40","50510  >  3306 [ACK] Seq=221 Ack=238 Win=7936 Len=0","0","50510","3306","0x010",""
"95","539.256062","127.0.0.1","127.0.0.1","TCP","1500","50510  >  3306 [ACK] Seq=221 Ack=238 Win=7936 Len=1460 [TCP segment of a reassembled PDU]","1460","50510","3306","0x010",""
"96","539.256062","127.0.0.1","127.0.0.1","TCP","1500","50510  >  3306 [ACK] Seq=1681 Ack=238 Win=7936 Len=1460 [TCP segment of a reassembled PDU]","1460","50510","3306","0x010",""
"97","539.256062","127.0.0.1","127.0.0.1","TCP","40","3306  >  50510 [ACK] Seq=238 Ack=3141 Win=8192 Len=0","0","3306","50510","0x010",""
"98","539.256062","127.0.0.1","127.0.0.1","MySQL","429","Request Query","389","50510","3306","0x018",""
"99","539.256062","127.0.0.1","127.0.0.1","TCP","40","3306  >  50510 [ACK] Seq=238 Ack=3530 Win=7680 Len=0","0","3306","50510","0x010",""
"100","539.266062","127.0.0.1","127.0.0.1","MySQL","51","Response OK","11","3306","50510","0x018",""
"101","539.266062","127.0.0.1","127.0.0.1","TCP","40","50510  >  3306 [ACK] Seq=3530 Ack=249 Win=7936 Len=0","0","50510","3306","0x010",""
"102","539.276062","127.0.0.1","127.0.0.1","MySQL","45","Request Quit","5","50510","3306","0x018",""
"103","539.276062","127.0.0.1","127.0.0.1","TCP","40","3306  >  50510 [ACK] Seq=249 Ack=3535 Win=7680 Len=0","0","3306","50510","0x010",""
"104","539.276062","127.0.0.1","127.0.0.1","TCP","40","50510  >  3306 [FIN, ACK] Seq=3535 Ack=249 Win=7936 Len=0","0","50510","3306","0x011",""
"105","539.276062","127.0.0.1","127.0.0.1","TCP","40","3306  >  50510 [ACK] Seq=249 Ack=3536 Win=7680 Len=0","0","3306","50510","0x010",""
"106","539.276062","127.0.0.1","127.0.0.1","TCP","40","3306  >  50510 [FIN, ACK] Seq=249 Ack=3536 Win=7680 Len=0","0","3306","50510","0x011",""
"107","539.276062","127.0.0.1","127.0.0.1","TCP","40","50510  >  3306 [ACK] Seq=3536 Ack=250 Win=7936 Len=0","0","50510","3306","0x010",""
"108","599.358345","127.0.0.1","127.0.0.1","TCP","52","50669  >  3306 [SYN] Seq=0 Win=8192 Len=0 MSS=65495 WS=256 SACK_PERM=1","0","50669","3306","0x002",""
"109","599.358345","127.0.0.1","127.0.0.1","TCP","52","3306  >  50669 [SYN, ACK] Seq=0 Ack=1 Win=8192 Len=0 MSS=65495 WS=256 SACK_PERM=1","0","3306","50669","0x012",""
"110","599.358345","127.0.0.1","127.0.0.1","TCP","40","50669  >  3306 [ACK] Seq=1 Ack=1 Win=8192 Len=0","0","50669","3306","0x010",""
"111","599.368345","127.0.0.1","127.0.0.1","MySQL","118","Server Greeting proto=10 version=5.6.20","78","3306","50669","0x018",""
"112","599.368345","127.0.0.1","127.0.0.1","TCP","40","50669  >  3306 [ACK] Seq=1 Ack=79 Win=7936 Len=0","0","50669","3306","0x010",""
"113","599.368345","127.0.0.1","127.0.0.1","MySQL","127","Login Request user=root","87","50669","3306","0x018",""
"114","599.368345","127.0.0.1","127.0.0.1","TCP","40","3306  >  50669 [ACK] Seq=79 Ack=88 Win=7936 Len=0","0","3306","50669","0x010",""
"115","599.368345","127.0.0.1","127.0.0.1","MySQL","88","Auth Switch Request","48","3306","50669","0x018",""
"116","599.368345","127.0.0.1","127.0.0.1","TCP","40","50669  >  3306 [ACK] Seq=88 Ack=127 Win=7936 Len=0","0","50669","3306","0x010",""
"117","599.368345","127.0.0.1","127.0.0.1","MySQL","44","Auth Switch Response","4","50669","3306","0x018",""
"118","599.368345","127.0.0.1","127.0.0.1","TCP","40","3306  >  50669 [ACK] Seq=127 Ack=92 Win=7936 Len=0","0","3306","50669","0x010",""
"119","599.368345","127.0.0.1","127.0.0.1","MySQL","51","Response OK","11","3306","50669","0x018",""
"120","599.368345","127.0.0.1","127.0.0.1","TCP","40","50669  >  3306 [ACK] Seq=92 Ack=138 Win=7936 Len=0","0","50669","3306","0x010",""
"121","599.368345","127.0.0.1","127.0.0.1","MySQL","47","Request Set Option","7","50669","3306","0x018",""
"122","599.368345","127.0.0.1","127.0.0.1","TCP","40","3306  >  50669 [ACK] Seq=138 Ack=99 Win=7936 Len=0","0","3306","50669","0x010",""
"123","599.368345","127.0.0.1","127.0.0.1","MySQL","49","Response","9","3306","50669","0x018",""
"124","599.368345","127.0.0.1","127.0.0.1","TCP","40","50669  >  3306 [ACK] Seq=99 Ack=147 Win=7936 Len=0","0","50669","3306","0x010",""
"125","599.369346","127.0.0.1","127.0.0.1","MySQL","87","Request Query","47","50669","3306","0x018",""
"126","599.369346","127.0.0.1","127.0.0.1","TCP","40","3306  >  50669 [ACK] Seq=147 Ack=146 Win=7936 Len=0","0","3306","50669","0x010",""
"127","599.369346","127.0.0.1","127.0.0.1","MySQL","51","Response OK","11","3306","50669","0x018",""
"128","599.369346","127.0.0.1","127.0.0.1","TCP","40","50669  >  3306 [ACK] Seq=146 Ack=158 Win=7936 Len=0","0","50669","3306","0x010",""
"129","599.369346","127.0.0.1","127.0.0.1","MySQL","49","Request Use Database","9","50669","3306","0x018",""
"130","599.369346","127.0.0.1","127.0.0.1","TCP","40","3306  >  50669 [ACK] Seq=158 Ack=155 Win=7936 Len=0","0","3306","50669","0x010",""
"131","599.369346","127.0.0.1","127.0.0.1","MySQL","51","Response OK","11","3306","50669","0x018",""
"132","599.369346","127.0.0.1","127.0.0.1","TCP","40","50669  >  3306 [ACK] Seq=155 Ack=169 Win=7936 Len=0","0","50669","3306","0x010",""
"133","599.369346","127.0.0.1","127.0.0.1","MySQL","106","Request Query","66","50669","3306","0x018",""
"134","599.369346","127.0.0.1","127.0.0.1","TCP","40","3306  >  50669 [ACK] Seq=169 Ack=221 Win=7936 Len=0","0","3306","50669","0x010",""
"135","599.402846","127.0.0.1","127.0.0.1","MySQL","109","Response","69","3306","50669","0x018",""
"136","599.402846","127.0.0.1","127.0.0.1","TCP","40","50669  >  3306 [ACK] Seq=221 Ack=238 Win=7936 Len=0","0","50669","3306","0x010",""
"137","599.402846","127.0.0.1","127.0.0.1","TCP","1500","50669  >  3306 [ACK] Seq=221 Ack=238 Win=7936 Len=1460 [TCP segment of a reassembled PDU]","1460","50669","3306","0x010",""
"138","599.402846","127.0.0.1","127.0.0.1","MySQL","1416","Request Query","1376","50669","3306","0x018",""
"139","599.402846","127.0.0.1","127.0.0.1","TCP","40","3306  >  50669 [ACK] Seq=238 Ack=3057 Win=8192 Len=0","0","3306","50669","0x010",""
"140","599.402846","127.0.0.1","127.0.0.1","MySQL","51","Response OK","11","3306","50669","0x018",""
"141","599.402846","127.0.0.1","127.0.0.1","TCP","40","50669  >  3306 [ACK] Seq=3057 Ack=249 Win=7936 Len=0","0","50669","3306","0x010",""
"142","599.412846","127.0.0.1","127.0.0.1","MySQL","45","Request Quit","5","50669","3306","0x018",""
"143","599.412846","127.0.0.1","127.0.0.1","TCP","40","3306  >  50669 [ACK] Seq=249 Ack=3062 Win=7936 Len=0","0","3306","50669","0x010",""
"144","599.412846","127.0.0.1","127.0.0.1","TCP","40","3306  >  50669 [FIN, ACK] Seq=249 Ack=3062 Win=7936 Len=0","0","3306","50669","0x011",""
"145","599.412846","127.0.0.1","127.0.0.1","TCP","40","50669  >  3306 [FIN, ACK] Seq=3062 Ack=250 Win=7936 Len=0","0","50669","3306","0x011",""
"146","599.412846","127.0.0.1","127.0.0.1","TCP","40","3306  >  50669 [ACK] Seq=250 Ack=3063 Win=7936 Len=0","0","3306","50669","0x010",""
"147","599.452846","127.0.0.1","127.0.0.1","TCP","52","50670  >  3306 [SYN] Seq=0 Win=8192 Len=0 MSS=65495 WS=256 SACK_PERM=1","0","50670","3306","0x002",""
"148","599.452846","127.0.0.1","127.0.0.1","TCP","52","3306  >  50670 [SYN, ACK] Seq=0 Ack=1 Win=8192 Len=0 MSS=65495 WS=256 SACK_PERM=1","0","3306","50670","0x012",""
"149","599.452846","127.0.0.1","127.0.0.1","TCP","40","50670  >  3306 [ACK] Seq=1 Ack=1 Win=8192 Len=0","0","50670","3306","0x010",""
"150","599.462846","127.0.0.1","127.0.0.1","MySQL","118","Server Greeting proto=10 version=5.6.20","78","3306","50670","0x018",""
"151","599.462846","127.0.0.1","127.0.0.1","TCP","40","50670  >  3306 [ACK] Seq=1 Ack=79 Win=7936 Len=0","0","50670","3306","0x010",""
"152","599.462846","127.0.0.1","127.0.0.1","MySQL","127","Login Request user=root","87","50670","3306","0x018",""
"153","599.462846","127.0.0.1","127.0.0.1","TCP","40","3306  >  50670 [ACK] Seq=79 Ack=88 Win=7936 Len=0","0","3306","50670","0x010",""
"154","599.462846","127.0.0.1","127.0.0.1","MySQL","88","Auth Switch Request","48","3306","50670","0x018",""
"155","599.462846","127.0.0.1","127.0.0.1","TCP","40","50670  >  3306 [ACK] Seq=88 Ack=127 Win=7936 Len=0","0","50670","3306","0x010",""
"156","599.462846","127.0.0.1","127.0.0.1","MySQL","44","Auth Switch Response","4","50670","3306","0x018",""
"157","599.462846","127.0.0.1","127.0.0.1","TCP","40","3306  >  50670 [ACK] Seq=127 Ack=92 Win=7936 Len=0","0","3306","50670","0x010",""
"158","599.462846","127.0.0.1","127.0.0.1","MySQL","51","Response OK","11","3306","50670","0x018",""
"159","599.462846","127.0.0.1","127.0.0.1","TCP","40","50670  >  3306 [ACK] Seq=92 Ack=138 Win=7936 Len=0","0","50670","3306","0x010",""
"160","599.462846","127.0.0.1","127.0.0.1","MySQL","47","Request Set Option","7","50670","3306","0x018",""
"161","599.462846","127.0.0.1","127.0.0.1","TCP","40","3306  >  50670 [ACK] Seq=138 Ack=99 Win=7936 Len=0","0","3306","50670","0x010",""
"162","599.462846","127.0.0.1","127.0.0.1","MySQL","49","Response","9","3306","50670","0x018",""
"163","599.462846","127.0.0.1","127.0.0.1","TCP","40","50670  >  3306 [ACK] Seq=99 Ack=147 Win=7936 Len=0","0","50670","3306","0x010",""
"164","599.462846","127.0.0.1","127.0.0.1","MySQL","87","Request Query","47","50670","3306","0x018",""
"165","599.462846","127.0.0.1","127.0.0.1","TCP","40","3306  >  50670 [ACK] Seq=147 Ack=146 Win=7936 Len=0","0","3306","50670","0x010",""
"166","599.462846","127.0.0.1","127.0.0.1","MySQL","51","Response OK","11","3306","50670","0x018",""
"167","599.462846","127.0.0.1","127.0.0.1","TCP","40","50670  >  3306 [ACK] Seq=146 Ack=158 Win=7936 Len=0","0","50670","3306","0x010",""
"168","599.462846","127.0.0.1","127.0.0.1","MySQL","49","Request Use Database","9","50670","3306","0x018",""
"169","599.462846","127.0.0.1","127.0.0.1","TCP","40","3306  >  50670 [ACK] Seq=158 Ack=155 Win=7936 Len=0","0","3306","50670","0x010",""
"170","599.462846","127.0.0.1","127.0.0.1","MySQL","51","Response OK","11","3306","50670","0x018",""
"171","599.462846","127.0.0.1","127.0.0.1","TCP","40","50670  >  3306 [ACK] Seq=155 Ack=169 Win=7936 Len=0","0","50670","3306","0x010",""
"172","599.462846","127.0.0.1","127.0.0.1","MySQL","106","Request Query","66","50670","3306","0x018",""
"173","599.462846","127.0.0.1","127.0.0.1","TCP","40","3306  >  50670 [ACK] Seq=169 Ack=221 Win=7936 Len=0","0","3306","50670","0x010",""
"174","599.502847","127.0.0.1","127.0.0.1","MySQL","109","Response","69","3306","50670","0x018",""
"175","599.502847","127.0.0.1","127.0.0.1","TCP","40","50670  >  3306 [ACK] Seq=221 Ack=238 Win=7936 Len=0","0","50670","3306","0x010",""
"176","599.502847","127.0.0.1","127.0.0.1","TCP","1500","50670  >  3306 [ACK] Seq=221 Ack=238 Win=7936 Len=1460 [TCP segment of a reassembled PDU]","1460","50670","3306","0x010",""
"177","599.502847","127.0.0.1","127.0.0.1","TCP","1500","50670  >  3306 [ACK] Seq=1681 Ack=238 Win=7936 Len=1460 [TCP segment of a reassembled PDU]","1460","50670","3306","0x010",""
"178","599.502847","127.0.0.1","127.0.0.1","TCP","40","3306  >  50670 [ACK] Seq=238 Ack=3141 Win=8192 Len=0","0","3306","50670","0x010",""
"179","599.502847","127.0.0.1","127.0.0.1","MySQL","297","Request Query","257","50670","3306","0x018",""
"180","599.502847","127.0.0.1","127.0.0.1","TCP","40","3306  >  50670 [ACK] Seq=238 Ack=3398 Win=7680 Len=0","0","3306","50670","0x010",""
"181","599.502847","127.0.0.1","127.0.0.1","MySQL","51","Response OK","11","3306","50670","0x018",""
"182","599.502847","127.0.0.1","127.0.0.1","TCP","40","50670  >  3306 [ACK] Seq=3398 Ack=249 Win=7936 Len=0","0","50670","3306","0x010",""
"183","599.502847","127.0.0.1","127.0.0.1","MySQL","45","Request Quit","5","50670","3306","0x018",""
"184","599.502847","127.0.0.1","127.0.0.1","TCP","40","3306  >  50670 [ACK] Seq=249 Ack=3403 Win=7680 Len=0","0","3306","50670","0x010",""
"185","599.502847","127.0.0.1","127.0.0.1","TCP","40","50670  >  3306 [FIN, ACK] Seq=3403 Ack=249 Win=7936 Len=0","0","50670","3306","0x011",""
"186","599.502847","127.0.0.1","127.0.0.1","TCP","40","3306  >  50670 [ACK] Seq=249 Ack=3404 Win=7680 Len=0","0","3306","50670","0x010",""
"187","599.512847","127.0.0.1","127.0.0.1","TCP","40","3306  >  50670 [FIN, ACK] Seq=249 Ack=3404 Win=7680 Len=0","0","3306","50670","0x011",""
"188","599.512847","127.0.0.1","127.0.0.1","TCP","40","50670  >  3306 [ACK] Seq=3404 Ack=250 Win=7936 Len=0","0","50670","3306","0x010",""
"189","609.717443","192.168.1.16","255.255.255.255","DHCP","328","DHCP Inform   - Transaction ID 0x7b5f1fc5","","","","",""
"190","612.720465","192.168.1.16","255.255.255.255","DHCP","328","DHCP Inform   - Transaction ID 0x7b5f1fc5","","","","",""
"191","629.792318","127.0.0.1","239.255.255.250","SSDP","539","NOTIFY * HTTP/1.1 ","","","","","NOTIFY"
"192","629.792318","127.0.0.1","239.255.255.250","SSDP","539","NOTIFY * HTTP/1.1 ","","","","","NOTIFY"
"193","629.792318","127.0.0.1","239.255.255.250","SSDP","523","NOTIFY * HTTP/1.1 ","","","","","NOTIFY"
"194","629.792318","127.0.0.1","239.255.255.250","SSDP","523","NOTIFY * HTTP/1.1 ","","","","","NOTIFY"
"195","629.792318","127.0.0.1","239.255.255.250","SSDP","459","NOTIFY * HTTP/1.1 ","","","","","NOTIFY"
"196","629.792318","127.0.0.1","239.255.255.250","SSDP","459","NOTIFY * HTTP/1.1 ","","","","","NOTIFY"
"197","629.792318","127.0.0.1","239.255.255.250","SSDP","468","NOTIFY * HTTP/1.1 ","","","","","NOTIFY"
"198","629.792318","127.0.0.1","239.255.255.250","SSDP","468","NOTIFY * HTTP/1.1 ","","","","","NOTIFY"
"199","629.792318","127.0.0.1","239.255.255.250","SSDP","525","NOTIFY * HTTP/1.1 ","","","","","NOTIFY"
"200","629.792318","127.0.0.1","239.255.255.250","SSDP","525","NOTIFY * HTTP/1.1 ","","","","","NOTIFY"
"201","629.792318","127.0.0.1","239.255.255.250","SSDP","511","NOTIFY * HTTP/1.1 ","","","","","NOTIFY"
"202","629.792318","127.0.0.1","239.255.255.250","SSDP","511","NOTIFY * HTTP/1.1 ","","","","","NOTIFY"
"203","632.791339","127.0.0.1","239.255.255.250","SSDP","539","NOTIFY * HTTP/1.1 ","","","","","NOTIFY"
"204","632.791339","127.0.0.1","239.255.255.250","SSDP","539","NOTIFY * HTTP/1.1 ","","","","","NOTIFY"
"205","632.791339","127.0.0.1","239.255.255.250","SSDP","523","NOTIFY * HTTP/1.1 ","","","","","NOTIFY"
"206","632.791339","127.0.0.1","239.255.255.250","SSDP","523","NOTIFY * HTTP/1.1 ","","","","","NOTIFY"
"207","632.791339","127.0.0.1","239.255.255.250","SSDP","468","NOTIFY * HTTP/1.1 ","","","","","NOTIFY"
"208","632.791339","127.0.0.1","239.255.255.250","SSDP","468","NOTIFY * HTTP/1.1 ","","","","","NOTIFY"
"209","632.791339","127.0.0.1","239.255.255.250","SSDP","459","NOTIFY * HTTP/1.1 ","","","","","NOTIFY"
"210","632.791339","127.0.0.1","239.255.255.250","SSDP","459","NOTIFY * HTTP/1.1 ","","","","","NOTIFY"
"211","632.791339","127.0.0.1","239.255.255.250","SSDP","525","NOTIFY * HTTP/1.1 ","","","","","NOTIFY"
"212","632.791339","127.0.0.1","239.255.255.250","SSDP","525","NOTIFY * HTTP/1.1 ","","","","","NOTIFY"
"213","632.791339","127.0.0.1","239.255.255.250","SSDP","511","NOTIFY * HTTP/1.1 ","","","","","NOTIFY"
"214","632.791339","127.0.0.1","239.255.255.250","SSDP","511","NOTIFY * HTTP/1.1 ","","","","","NOTIFY"
"215","635.793845","127.0.0.1","239.255.255.250","SSDP","511","NOTIFY * HTTP/1.1 ","","","","","NOTIFY"
"216","635.793845","127.0.0.1","239.255.255.250","SSDP","511","NOTIFY * HTTP/1.1 ","","","","","NOTIFY"
"217","635.793845","127.0.0.1","239.255.255.250","SSDP","525","NOTIFY * HTTP/1.1 ","","","","","NOTIFY"
"218","635.793845","127.0.0.1","239.255.255.250","SSDP","525","NOTIFY * HTTP/1.1 ","","","","","NOTIFY"
"219","635.793845","127.0.0.1","239.255.255.250","SSDP","459","NOTIFY * HTTP/1.1 ","","","","","NOTIFY"
"220","635.793845","127.0.0.1","239.255.255.250","SSDP","459","NOTIFY * HTTP/1.1 ","","","","","NOTIFY"
"221","635.793845","127.0.0.1","239.255.255.250","SSDP","523","NOTIFY * HTTP/1.1 ","","","","","NOTIFY"
"222","635.793845","127.0.0.1","239.255.255.250","SSDP","523","NOTIFY * HTTP/1.1 ","","","","","NOTIFY"
"223","635.793845","127.0.0.1","239.255.255.250","SSDP","539","NOTIFY * HTTP/1.1 ","","","","","NOTIFY"
"224","635.793845","127.0.0.1","239.255.255.250","SSDP","539","NOTIFY * HTTP/1.1 ","","","","","NOTIFY"
"225","635.793845","127.0.0.1","239.255.255.250","SSDP","468","NOTIFY * HTTP/1.1 ","","","","","NOTIFY"
"226","635.793845","127.0.0.1","239.255.255.250","SSDP","468","NOTIFY * HTTP/1.1 ","","","","","NOTIFY"
"227","659.591096","127.0.0.1","127.0.0.1","TCP","52","50764  >  3306 [SYN] Seq=0 Win=8192 Len=0 MSS=65495 WS=256 SACK_PERM=1","0","50764","3306","0x002",""
"228","659.591096","127.0.0.1","127.0.0.1","TCP","52","3306  >  50764 [SYN, ACK] Seq=0 Ack=1 Win=8192 Len=0 MSS=65495 WS=256 SACK_PERM=1","0","3306","50764","0x012",""
"229","659.591096","127.0.0.1","127.0.0.1","TCP","40","50764  >  3306 [ACK] Seq=1 Ack=1 Win=8192 Len=0","0","50764","3306","0x010",""
"230","659.622096","127.0.0.1","127.0.0.1","MySQL","118","Server Greeting proto=10 version=5.6.20","78","3306","50764","0x018",""
"231","659.622096","127.0.0.1","127.0.0.1","TCP","40","50764  >  3306 [ACK] Seq=1 Ack=79 Win=7936 Len=0","0","50764","3306","0x010",""
"232","659.622096","127.0.0.1","127.0.0.1","MySQL","127","Login Request user=root","87","50764","3306","0x018",""
"233","659.622096","127.0.0.1","127.0.0.1","TCP","40","3306  >  50764 [ACK] Seq=79 Ack=88 Win=7936 Len=0","0","3306","50764","0x010",""
"234","659.622096","127.0.0.1","127.0.0.1","MySQL","88","Auth Switch Request","48","3306","50764","0x018",""
"235","659.622096","127.0.0.1","127.0.0.1","TCP","40","50764  >  3306 [ACK] Seq=88 Ack=127 Win=7936 Len=0","0","50764","3306","0x010",""
"236","659.622096","127.0.0.1","127.0.0.1","MySQL","44","Auth Switch Response","4","50764","3306","0x018",""
"237","659.622096","127.0.0.1","127.0.0.1","TCP","40","3306  >  50764 [ACK] Seq=127 Ack=92 Win=7936 Len=0","0","3306","50764","0x010",""
"238","659.623096","127.0.0.1","127.0.0.1","MySQL","51","Response OK","11","3306","50764","0x018",""
"239","659.623096","127.0.0.1","127.0.0.1","TCP","40","50764  >  3306 [ACK] Seq=92 Ack=138 Win=7936 Len=0","0","50764","3306","0x010",""
"240","659.623096","127.0.0.1","127.0.0.1","MySQL","47","Request Set Option","7","50764","3306","0x018",""
"241","659.623096","127.0.0.1","127.0.0.1","TCP","40","3306  >  50764 [ACK] Seq=138 Ack=99 Win=7936 Len=0","0","3306","50764","0x010",""
"242","659.623096","127.0.0.1","127.0.0.1","MySQL","49","Response","9","3306","50764","0x018",""
"243","659.623096","127.0.0.1","127.0.0.1","TCP","40","50764  >  3306 [ACK] Seq=99 Ack=147 Win=7936 Len=0","0","50764","3306","0x010",""
"244","659.623096","127.0.0.1","127.0.0.1","MySQL","87","Request Query","47","50764","3306","0x018",""
"245","659.623096","127.0.0.1","127.0.0.1","TCP","40","3306  >  50764 [ACK] Seq=147 Ack=146 Win=7936 Len=0","0","3306","50764","0x010",""
"246","659.624096","127.0.0.1","127.0.0.1","MySQL","51","Response OK","11","3306","50764","0x018",""
"247","659.624096","127.0.0.1","127.0.0.1","TCP","40","50764  >  3306 [ACK] Seq=146 Ack=158 Win=7936 Len=0","0","50764","3306","0x010",""
"248","659.624096","127.0.0.1","127.0.0.1","MySQL","49","Request Use Database","9","50764","3306","0x018",""
"249","659.624096","127.0.0.1","127.0.0.1","TCP","40","3306  >  50764 [ACK] Seq=158 Ack=155 Win=7936 Len=0","0","3306","50764","0x010",""
"250","659.625096","127.0.0.1","127.0.0.1","MySQL","51","Response OK","11","3306","50764","0x018",""
"251","659.625096","127.0.0.1","127.0.0.1","TCP","40","50764  >  3306 [ACK] Seq=155 Ack=169 Win=7936 Len=0","0","50764","3306","0x010",""
"252","659.625096","127.0.0.1","127.0.0.1","MySQL","106","Request Query","66","50764","3306","0x018",""
"253","659.625096","127.0.0.1","127.0.0.1","TCP","40","3306  >  50764 [ACK] Seq=169 Ack=221 Win=7936 Len=0","0","3306","50764","0x010",""
"254","659.665099","127.0.0.1","127.0.0.1","MySQL","109","Response","69","3306","50764","0x018",""
"255","659.665099","127.0.0.1","127.0.0.1","TCP","40","50764  >  3306 [ACK] Seq=221 Ack=238 Win=7936 Len=0","0","50764","3306","0x010",""
"256","659.665099","127.0.0.1","127.0.0.1","TCP","1500","50764  >  3306 [ACK] Seq=221 Ack=238 Win=7936 Len=1460 [TCP segment of a reassembled PDU]","1460","50764","3306","0x010",""
"257","659.665099","127.0.0.1","127.0.0.1","TCP","1500","50764  >  3306 [ACK] Seq=1681 Ack=238 Win=7936 Len=1460 [TCP segment of a reassembled PDU]","1460","50764","3306","0x010",""
"258","659.665099","127.0.0.1","127.0.0.1","TCP","40","3306  >  50764 [ACK] Seq=238 Ack=3141 Win=8192 Len=0","0","3306","50764","0x010",""
"259","659.665099","127.0.0.1","127.0.0.1","MySQL","435","Request Query","395","50764","3306","0x018",""
"260","659.665099","127.0.0.1","127.0.0.1","TCP","40","3306  >  50764 [ACK] Seq=238 Ack=3536 Win=7680 Len=0","0","3306","50764","0x010",""
"261","659.665099","127.0.0.1","127.0.0.1","MySQL","51","Response OK","11","3306","50764","0x018",""
"262","659.665099","127.0.0.1","127.0.0.1","TCP","40","50764  >  3306 [ACK] Seq=3536 Ack=249 Win=7936 Len=0","0","50764","3306","0x010",""
"263","659.668099","127.0.0.1","127.0.0.1","MySQL","45","Request Quit","5","50764","3306","0x018",""
"264","659.668099","127.0.0.1","127.0.0.1","TCP","40","3306  >  50764 [ACK] Seq=249 Ack=3541 Win=7680 Len=0","0","3306","50764","0x010",""
"265","659.668099","127.0.0.1","127.0.0.1","TCP","40","3306  >  50764 [FIN, ACK] Seq=249 Ack=3541 Win=7680 Len=0","0","3306","50764","0x011",""
"266","659.668099","127.0.0.1","127.0.0.1","TCP","40","50764  >  3306 [FIN, ACK] Seq=3541 Ack=250 Win=7936 Len=0","0","50764","3306","0x011",""
"267","659.668099","127.0.0.1","127.0.0.1","TCP","40","3306  >  50764 [ACK] Seq=250 Ack=3542 Win=7680 Len=0","0","3306","50764","0x010",""
"268","659.713099","127.0.0.1","127.0.0.1","TCP","52","50765  >  3306 [SYN] Seq=0 Win=8192 Len=0 MSS=65495 WS=256 SACK_PERM=1","0","50765","3306","0x002",""
"269","659.713099","127.0.0.1","127.0.0.1","TCP","52","3306  >  50765 [SYN, ACK] Seq=0 Ack=1 Win=8192 Len=0 MSS=65495 WS=256 SACK_PERM=1","0","3306","50765","0x012",""
"270","659.713099","127.0.0.1","127.0.0.1","TCP","40","50765  >  3306 [ACK] Seq=1 Ack=1 Win=8192 Len=0","0","50765","3306","0x010",""
"271","659.723099","127.0.0.1","127.0.0.1","MySQL","118","Server Greeting proto=10 version=5.6.20","78","3306","50765","0x018",""
"272","659.723099","127.0.0.1","127.0.0.1","TCP","40","50765  >  3306 [ACK] Seq=1 Ack=79 Win=7936 Len=0","0","50765","3306","0x010",""
"273","659.723099","127.0.0.1","127.0.0.1","MySQL","127","Login Request user=root","87","50765","3306","0x018",""
"274","659.723099","127.0.0.1","127.0.0.1","TCP","40","3306  >  50765 [ACK] Seq=79 Ack=88 Win=7936 Len=0","0","3306","50765","0x010",""
"275","659.723099","127.0.0.1","127.0.0.1","MySQL","88","Auth Switch Request","48","3306","50765","0x018",""
"276","659.723099","127.0.0.1","127.0.0.1","TCP","40","50765  >  3306 [ACK] Seq=88 Ack=127 Win=7936 Len=0","0","50765","3306","0x010",""
"277","659.723099","127.0.0.1","127.0.0.1","MySQL","44","Auth Switch Response","4","50765","3306","0x018",""
"278","659.723099","127.0.0.1","127.0.0.1","TCP","40","3306  >  50765 [ACK] Seq=127 Ack=92 Win=7936 Len=0","0","3306","50765","0x010",""
"279","659.723099","127.0.0.1","127.0.0.1","MySQL","51","Response OK","11","3306","50765","0x018",""
"280","659.723099","127.0.0.1","127.0.0.1","TCP","40","50765  >  3306 [ACK] Seq=92 Ack=138 Win=7936 Len=0","0","50765","3306","0x010",""
"281","659.723099","127.0.0.1","127.0.0.1","MySQL","47","Request Set Option","7","50765","3306","0x018",""
"282","659.723099","127.0.0.1","127.0.0.1","TCP","40","3306  >  50765 [ACK] Seq=138 Ack=99 Win=7936 Len=0","0","3306","50765","0x010",""
"283","659.723099","127.0.0.1","127.0.0.1","MySQL","49","Response","9","3306","50765","0x018",""
"284","659.723099","127.0.0.1","127.0.0.1","TCP","40","50765  >  3306 [ACK] Seq=99 Ack=147 Win=7936 Len=0","0","50765","3306","0x010",""
"285","659.723099","127.0.0.1","127.0.0.1","MySQL","87","Request Query","47","50765","3306","0x018",""
"286","659.723099","127.0.0.1","127.0.0.1","TCP","40","3306  >  50765 [ACK] Seq=147 Ack=146 Win=7936 Len=0","0","3306","50765","0x010",""
"287","659.723099","127.0.0.1","127.0.0.1","MySQL","51","Response OK","11","3306","50765","0x018",""
"288","659.723099","127.0.0.1","127.0.0.1","TCP","40","50765  >  3306 [ACK] Seq=146 Ack=158 Win=7936 Len=0","0","50765","3306","0x010",""
"289","659.723099","127.0.0.1","127.0.0.1","MySQL","49","Request Use Database","9","50765","3306","0x018",""
"290","659.723099","127.0.0.1","127.0.0.1","TCP","40","3306  >  50765 [ACK] Seq=158 Ack=155 Win=7936 Len=0","0","3306","50765","0x010",""
"291","659.723099","127.0.0.1","127.0.0.1","MySQL","51","Response OK","11","3306","50765","0x018",""
"292","659.723099","127.0.0.1","127.0.0.1","TCP","40","50765  >  3306 [ACK] Seq=155 Ack=169 Win=7936 Len=0","0","50765","3306","0x010",""
"293","659.723099","127.0.0.1","127.0.0.1","MySQL","106","Request Query","66","50765","3306","0x018",""
"294","659.723099","127.0.0.1","127.0.0.1","TCP","40","3306  >  50765 [ACK] Seq=169 Ack=221 Win=7936 Len=0","0","3306","50765","0x010",""
"295","659.763099","127.0.0.1","127.0.0.1","MySQL","109","Response","69","3306","50765","0x018",""
"296","659.763099","127.0.0.1","127.0.0.1","TCP","40","50765  >  3306 [ACK] Seq=221 Ack=238 Win=7936 Len=0","0","50765","3306","0x010",""
"297","659.763099","127.0.0.1","127.0.0.1","TCP","1500","50765  >  3306 [ACK] Seq=221 Ack=238 Win=7936 Len=1460 [TCP segment of a reassembled PDU]","1460","50765","3306","0x010",""
"298","659.763099","127.0.0.1","127.0.0.1","TCP","1500","50765  >  3306 [ACK] Seq=1681 Ack=238 Win=7936 Len=1460 [TCP segment of a reassembled PDU]","1460","50765","3306","0x010",""
"299","659.763099","127.0.0.1","127.0.0.1","TCP","40","3306  >  50765 [ACK] Seq=238 Ack=3141 Win=8192 Len=0","0","3306","50765","0x010",""
"300","659.763099","127.0.0.1","127.0.0.1","MySQL","573","Request Query","533","50765","3306","0x018",""
"301","659.763099","127.0.0.1","127.0.0.1","TCP","40","3306  >  50765 [ACK] Seq=238 Ack=3674 Win=7424 Len=0","0","3306","50765","0x010",""
"302","659.763099","127.0.0.1","127.0.0.1","MySQL","51","Response OK","11","3306","50765","0x018",""
"303","659.763099","127.0.0.1","127.0.0.1","TCP","40","50765  >  3306 [ACK] Seq=3674 Ack=249 Win=7936 Len=0","0","50765","3306","0x010",""
"304","659.763099","127.0.0.1","127.0.0.1","MySQL","45","Request Quit","5","50765","3306","0x018",""
"305","659.763099","127.0.0.1","127.0.0.1","TCP","40","3306  >  50765 [ACK] Seq=249 Ack=3679 Win=7424 Len=0","0","3306","50765","0x010",""
"306","659.763099","127.0.0.1","127.0.0.1","TCP","40","3306  >  50765 [FIN, ACK] Seq=249 Ack=3679 Win=7424 Len=0","0","3306","50765","0x011",""
"307","659.763099","127.0.0.1","127.0.0.1","TCP","40","50765  >  3306 [FIN, ACK] Seq=3679 Ack=250 Win=7936 Len=0","0","50765","3306","0x011",""
"308","659.763099","127.0.0.1","127.0.0.1","TCP","40","3306  >  50765 [ACK] Seq=250 Ack=3680 Win=7424 Len=0","0","3306","50765","0x010",""
"309","659.813099","127.0.0.1","127.0.0.1","TCP","52","50766  >  3306 [SYN] Seq=0 Win=8192 Len=0 MSS=65495 WS=256 SACK_PERM=1","0","50766","3306","0x002",""
"310","659.813099","127.0.0.1","127.0.0.1","TCP","52","3306  >  50766 [SYN, ACK] Seq=0 Ack=1 Win=8192 Len=0 MSS=65495 WS=256 SACK_PERM=1","0","3306","50766","0x012",""
"311","659.813099","127.0.0.1","127.0.0.1","TCP","40","50766  >  3306 [ACK] Seq=1 Ack=1 Win=8192 Len=0","0","50766","3306","0x010",""
"312","659.813099","127.0.0.1","127.0.0.1","MySQL","118","Server Greeting proto=10 version=5.6.20","78","3306","50766","0x018",""
"313","659.813099","127.0.0.1","127.0.0.1","TCP","40","50766  >  3306 [ACK] Seq=1 Ack=79 Win=7936 Len=0","0","50766","3306","0x010",""
"314","659.813099","127.0.0.1","127.0.0.1","MySQL","127","Login Request user=root","87","50766","3306","0x018",""
"315","659.813099","127.0.0.1","127.0.0.1","TCP","40","3306  >  50766 [ACK] Seq=79 Ack=88 Win=7936 Len=0","0","3306","50766","0x010",""
"316","659.813099","127.0.0.1","127.0.0.1","MySQL","88","Auth Switch Request","48","3306","50766","0x018",""
"317","659.813099","127.0.0.1","127.0.0.1","TCP","40","50766  >  3306 [ACK] Seq=88 Ack=127 Win=7936 Len=0","0","50766","3306","0x010",""
"318","659.813099","127.0.0.1","127.0.0.1","MySQL","44","Auth Switch Response","4","50766","3306","0x018",""
"319","659.813099","127.0.0.1","127.0.0.1","TCP","40","3306  >  50766 [ACK] Seq=127 Ack=92 Win=7936 Len=0","0","3306","50766","0x010",""
"320","659.813099","127.0.0.1","127.0.0.1","MySQL","51","Response OK","11","3306","50766","0x018",""
"321","659.813099","127.0.0.1","127.0.0.1","TCP","40","50766  >  3306 [ACK] Seq=92 Ack=138 Win=7936 Len=0","0","50766","3306","0x010",""
"322","659.813099","127.0.0.1","127.0.0.1","MySQL","47","Request Set Option","7","50766","3306","0x018",""
"323","659.813099","127.0.0.1","127.0.0.1","TCP","40","3306  >  50766 [ACK] Seq=138 Ack=99 Win=7936 Len=0","0","3306","50766","0x010",""
"324","659.813099","127.0.0.1","127.0.0.1","MySQL","49","Response","9","3306","50766","0x018",""
"325","659.813099","127.0.0.1","127.0.0.1","TCP","40","50766  >  3306 [ACK] Seq=99 Ack=147 Win=7936 Len=0","0","50766","3306","0x010",""
"326","659.813099","127.0.0.1","127.0.0.1","MySQL","87","Request Query","47","50766","3306","0x018",""
