"No.","Time","Source","Destination","Protocol","Length","Info","Packet payload length","TCP source port","TCP destination port","TCP flags","HTTP request"
"1","0.000000","127.0.0.1","127.0.0.1","TCP","52","49266  >  3306 [SYN] Seq=0 Win=8192 Len=0 MSS=65495 WS=256 SACK_PERM=1","0","49266","3306","0x002",""
"2","0.087502","127.0.0.1","127.0.0.1","TCP","52","3306  >  49266 [SYN, ACK] Seq=0 Ack=1 Win=8192 Len=0 MSS=65495 WS=256 SACK_PERM=1","0","3306","49266","0x012",""
"3","0.087502","127.0.0.1","127.0.0.1","TCP","40","49266  >  3306 [ACK] Seq=1 Ack=1 Win=8192 Len=0","0","49266","3306","0x010",""
"4","0.087502","127.0.0.1","127.0.0.1","MySQL","118","Server Greeting proto=10 version=5.6.20","78","3306","49266","0x018",""
"5","0.087502","127.0.0.1","127.0.0.1","TCP","40","49266  >  3306 [ACK] Seq=1 Ack=79 Win=7936 Len=0","0","49266","3306","0x010",""
"6","0.087502","127.0.0.1","127.0.0.1","MySQL","127","Login Request user=root","87","49266","3306","0x018",""
"7","0.087502","127.0.0.1","127.0.0.1","TCP","40","3306  >  49266 [ACK] Seq=79 Ack=88 Win=7936 Len=0","0","3306","49266","0x010",""
"8","0.087502","127.0.0.1","127.0.0.1","MySQL","88","Auth Switch Request","48","3306","49266","0x018",""
"9","0.087502","127.0.0.1","127.0.0.1","TCP","40","49266  >  3306 [ACK] Seq=88 Ack=127 Win=7936 Len=0","0","49266","3306","0x010",""
"10","0.087502","127.0.0.1","127.0.0.1","MySQL","44","Auth Switch Response","4","49266","3306","0x018",""
"11","0.087502","127.0.0.1","127.0.0.1","TCP","40","3306  >  49266 [ACK] Seq=127 Ack=92 Win=7936 Len=0","0","3306","49266","0x010",""
"12","0.087502","127.0.0.1","127.0.0.1","MySQL","51","Response OK","11","3306","49266","0x018",""
"13","0.087502","127.0.0.1","127.0.0.1","TCP","40","49266  >  3306 [ACK] Seq=92 Ack=138 Win=7936 Len=0","0","49266","3306","0x010",""
"14","0.087502","127.0.0.1","127.0.0.1","MySQL","47","Request Set Option","7","49266","3306","0x018",""
"15","0.087502","127.0.0.1","127.0.0.1","TCP","40","3306  >  49266 [ACK] Seq=138 Ack=99 Win=7936 Len=0","0","3306","49266","0x010",""
"16","0.087502","127.0.0.1","127.0.0.1","MySQL","49","Response","9","3306","49266","0x018",""
"17","0.087502","127.0.0.1","127.0.0.1","TCP","40","49266  >  3306 [ACK] Seq=99 Ack=147 Win=7936 Len=0","0","49266","3306","0x010",""
"18","0.087502","127.0.0.1","127.0.0.1","MySQL","87","Request Query","47","49266","3306","0x018",""
"19","0.087502","127.0.0.1","127.0.0.1","TCP","40","3306  >  49266 [ACK] Seq=147 Ack=146 Win=7936 Len=0","0","3306","49266","0x010",""
"20","0.087502","127.0.0.1","127.0.0.1","MySQL","51","Response OK","11","3306","49266","0x018",""
"21","0.087502","127.0.0.1","127.0.0.1","TCP","40","49266  >  3306 [ACK] Seq=146 Ack=158 Win=7936 Len=0","0","49266","3306","0x010",""
"22","0.087502","127.0.0.1","127.0.0.1","MySQL","49","Request Use Database","9","49266","3306","0x018",""
"23","0.087502","127.0.0.1","127.0.0.1","TCP","40","3306  >  49266 [ACK] Seq=158 Ack=155 Win=7936 Len=0","0","3306","49266","0x010",""
"24","0.087502","127.0.0.1","127.0.0.1","MySQL","51","Response OK","11","3306","49266","0x018",""
"25","0.087502","127.0.0.1","127.0.0.1","TCP","40","49266  >  3306 [ACK] Seq=155 Ack=169 Win=7936 Len=0","0","49266","3306","0x010",""
"26","0.087502","127.0.0.1","127.0.0.1","MySQL","106","Request Query","66","49266","3306","0x018",""
"27","0.087502","127.0.0.1","127.0.0.1","TCP","40","3306  >  49266 [ACK] Seq=169 Ack=221 Win=7936 Len=0","0","3306","49266","0x010",""
"28","0.117502","127.0.0.1","127.0.0.1","MySQL","109","Response","69","3306","49266","0x018",""
"29","0.117502","127.0.0.1","127.0.0.1","TCP","40","49266  >  3306 [ACK] Seq=221 Ack=238 Win=7936 Len=0","0","49266","3306","0x010",""
"30","0.130002","127.0.0.1","127.0.0.1","MySQL","620","Request Query","580","49266","3306","0x018",""
"31","0.130002","127.0.0.1","127.0.0.1","TCP","40","3306  >  49266 [ACK] Seq=238 Ack=801 Win=7168 Len=0","0","3306","49266","0x010",""
"32","0.155003","127.0.0.1","127.0.0.1","MySQL","101","Response Error 1146","61","3306","49266","0x018",""
"33","0.155003","127.0.0.1","127.0.0.1","TCP","40","49266  >  3306 [ACK] Seq=801 Ack=299 Win=7680 Len=0","0","49266","3306","0x010",""
"34","0.155003","127.0.0.1","127.0.0.1","MySQL","117","Request Query","77","49266","3306","0x018",""
"35","0.155003","127.0.0.1","127.0.0.1","TCP","40","3306  >  49266 [ACK] Seq=299 Ack=878 Win=7168 Len=0","0","3306","49266","0x010",""
"36","0.295005","127.0.0.1","127.0.0.1","MySQL","51","Response OK","11","3306","49266","0x018",""
"37","0.295005","127.0.0.1","127.0.0.1","TCP","40","49266  >  3306 [ACK] Seq=878 Ack=310 Win=7680 Len=0","0","49266","3306","0x010",""
"38","0.295005","127.0.0.1","127.0.0.1","MySQL","620","Request Query","580","49266","3306","0x018",""
"39","0.295005","127.0.0.1","127.0.0.1","TCP","40","3306  >  49266 [ACK] Seq=310 Ack=1458 Win=6656 Len=0","0","3306","49266","0x010",""
"40","0.297505","127.0.0.1","127.0.0.1","MySQL","51","Response OK","11","3306","49266","0x018",""
"41","0.297505","127.0.0.1","127.0.0.1","TCP","40","49266  >  3306 [ACK] Seq=1458 Ack=321 Win=7680 Len=0","0","49266","3306","0x010",""
"42","0.457507","127.0.0.1","127.0.0.1","MySQL","45","Request Quit","5","49266","3306","0x018",""
"43","0.457507","127.0.0.1","127.0.0.1","TCP","40","3306  >  49266 [ACK] Seq=321 Ack=1463 Win=8192 Len=0","0","3306","49266","0x010",""
"44","0.457507","127.0.0.1","127.0.0.1","TCP","40","3306  >  49266 [FIN, ACK] Seq=321 Ack=1463 Win=8192 Len=0","0","3306","49266","0x011",""
"45","0.457507","127.0.0.1","127.0.0.1","TCP","40","49266  >  3306 [ACK] Seq=1463 Ack=322 Win=7680 Len=0","0","49266","3306","0x010",""
"46","0.457507","127.0.0.1","127.0.0.1","TCP","40","49266  >  3306 [FIN, ACK] Seq=1463 Ack=322 Win=7680 Len=0","0","49266","3306","0x011",""
"47","0.457507","127.0.0.1","127.0.0.1","TCP","40","3306  >  49266 [ACK] Seq=322 Ack=1464 Win=8192 Len=0","0","3306","49266","0x010",""
"48","38.836062","127.0.0.1","127.0.0.1","TCP","40","49238  >  2869 [RST, ACK] Seq=1 Ack=1 Win=0 Len=0","0","49238","2869","0x014",""
"49","46.542083","192.168.1.7","255.255.255.255","DHCP","328","DHCP Inform   - Transaction ID 0x192ac451","","","","",""
"50","49.552888","192.168.1.7","255.255.255.255","DHCP","328","DHCP Inform   - Transaction ID 0x192ac451","","","","",""
"51","60.519708","127.0.0.1","127.0.0.1","TCP","52","49475  >  3306 [SYN] Seq=0 Win=8192 Len=0 MSS=65495 WS=256 SACK_PERM=1","0","49475","3306","0x002",""
"52","60.519708","127.0.0.1","127.0.0.1","TCP","52","3306  >  49475 [SYN, ACK] Seq=0 Ack=1 Win=8192 Len=0 MSS=65495 WS=256 SACK_PERM=1","0","3306","49475","0x012",""
"53","60.519708","127.0.0.1","127.0.0.1","TCP","40","49475  >  3306 [ACK] Seq=1 Ack=1 Win=8192 Len=0","0","49475","3306","0x010",""
"54","60.519708","127.0.0.1","127.0.0.1","MySQL","118","Server Greeting proto=10 version=5.6.20","78","3306","49475","0x018",""
"55","60.519708","127.0.0.1","127.0.0.1","TCP","40","49475  >  3306 [ACK] Seq=1 Ack=79 Win=7936 Len=0","0","49475","3306","0x010",""
"56","60.519708","127.0.0.1","127.0.0.1","MySQL","127","Login Request user=root","87","49475","3306","0x018",""
"57","60.519708","127.0.0.1","127.0.0.1","TCP","40","3306  >  49475 [ACK] Seq=79 Ack=88 Win=7936 Len=0","0","3306","49475","0x010",""
"58","60.519708","127.0.0.1","127.0.0.1","MySQL","88","Auth Switch Request","48","3306","49475","0x018",""
"59","60.519708","127.0.0.1","127.0.0.1","TCP","40","49475  >  3306 [ACK] Seq=88 Ack=127 Win=7936 Len=0","0","49475","3306","0x010",""
"60","60.519708","127.0.0.1","127.0.0.1","MySQL","44","Auth Switch Response","4","49475","3306","0x018",""
"61","60.519708","127.0.0.1","127.0.0.1","TCP","40","3306  >  49475 [ACK] Seq=127 Ack=92 Win=7936 Len=0","0","3306","49475","0x010",""
"62","60.519708","127.0.0.1","127.0.0.1","MySQL","51","Response OK","11","3306","49475","0x018",""
"63","60.519708","127.0.0.1","127.0.0.1","TCP","40","49475  >  3306 [ACK] Seq=92 Ack=138 Win=7936 Len=0","0","49475","3306","0x010",""
"64","60.519708","127.0.0.1","127.0.0.1","MySQL","47","Request Set Option","7","49475","3306","0x018",""
"65","60.519708","127.0.0.1","127.0.0.1","TCP","40","3306  >  49475 [ACK] Seq=138 Ack=99 Win=7936 Len=0","0","3306","49475","0x010",""
"66","60.519708","127.0.0.1","127.0.0.1","MySQL","49","Response","9","3306","49475","0x018",""
"67","60.519708","127.0.0.1","127.0.0.1","TCP","40","49475  >  3306 [ACK] Seq=99 Ack=147 Win=7936 Len=0","0","49475","3306","0x010",""
"68","60.519708","127.0.0.1","127.0.0.1","MySQL","87","Request Query","47","49475","3306","0x018",""
"69","60.519708","127.0.0.1","127.0.0.1","TCP","40","3306  >  49475 [ACK] Seq=147 Ack=146 Win=7936 Len=0","0","3306","49475","0x010",""
"70","60.519708","127.0.0.1","127.0.0.1","MySQL","51","Response OK","11","3306","49475","0x018",""
"71","60.519708","127.0.0.1","127.0.0.1","TCP","40","49475  >  3306 [ACK] Seq=146 Ack=158 Win=7936 Len=0","0","49475","3306","0x010",""
"72","60.519708","127.0.0.1","127.0.0.1","MySQL","49","Request Use Database","9","49475","3306","0x018",""
"73","60.519708","127.0.0.1","127.0.0.1","TCP","40","3306  >  49475 [ACK] Seq=158 Ack=155 Win=7936 Len=0","0","3306","49475","0x010",""
"74","60.519708","127.0.0.1","127.0.0.1","MySQL","51","Response OK","11","3306","49475","0x018",""
"75","60.519708","127.0.0.1","127.0.0.1","TCP","40","49475  >  3306 [ACK] Seq=155 Ack=169 Win=7936 Len=0","0","49475","3306","0x010",""
"76","60.519708","127.0.0.1","127.0.0.1","MySQL","106","Request Query","66","49475","3306","0x018",""
"77","60.519708","127.0.0.1","127.0.0.1","TCP","40","3306  >  49475 [ACK] Seq=169 Ack=221 Win=7936 Len=0","0","3306","49475","0x010",""
"78","60.550908","127.0.0.1","127.0.0.1","MySQL","109","Response","69","3306","49475","0x018",""
"79","60.550908","127.0.0.1","127.0.0.1","TCP","40","49475  >  3306 [ACK] Seq=221 Ack=238 Win=7936 Len=0","0","49475","3306","0x010",""
"80","60.550908","127.0.0.1","127.0.0.1","MySQL","682","Request Query","642","49475","3306","0x018",""
"81","60.550908","127.0.0.1","127.0.0.1","TCP","40","3306  >  49475 [ACK] Seq=238 Ack=863 Win=7168 Len=0","0","3306","49475","0x010",""
"82","60.550908","127.0.0.1","127.0.0.1","MySQL","51","Response OK","11","3306","49475","0x018",""
"83","60.550908","127.0.0.1","127.0.0.1","TCP","40","49475  >  3306 [ACK] Seq=863 Ack=249 Win=7936 Len=0","0","49475","3306","0x010",""
"84","60.550908","127.0.0.1","127.0.0.1","MySQL","45","Request Quit","5","49475","3306","0x018",""
"85","60.550908","127.0.0.1","127.0.0.1","TCP","40","3306  >  49475 [ACK] Seq=249 Ack=868 Win=7168 Len=0","0","3306","49475","0x010",""
"86","60.550908","127.0.0.1","127.0.0.1","TCP","40","49475  >  3306 [FIN, ACK] Seq=868 Ack=249 Win=7936 Len=0","0","49475","3306","0x011",""
"87","60.550908","127.0.0.1","127.0.0.1","TCP","40","3306  >  49475 [ACK] Seq=249 Ack=869 Win=7168 Len=0","0","3306","49475","0x010",""
"88","60.550908","127.0.0.1","127.0.0.1","TCP","40","3306  >  49475 [FIN, ACK] Seq=249 Ack=869 Win=7168 Len=0","0","3306","49475","0x011",""
"89","60.550908","127.0.0.1","127.0.0.1","TCP","40","49475  >  3306 [ACK] Seq=869 Ack=250 Win=7936 Len=0","0","49475","3306","0x010",""
"90","60.582108","127.0.0.1","127.0.0.1","TCP","52","49476  >  3306 [SYN] Seq=0 Win=8192 Len=0 MSS=65495 WS=256 SACK_PERM=1","0","49476","3306","0x002",""
"91","60.582108","127.0.0.1","127.0.0.1","TCP","52","3306  >  49476 [SYN, ACK] Seq=0 Ack=1 Win=8192 Len=0 MSS=65495 WS=256 SACK_PERM=1","0","3306","49476","0x012",""
"92","60.582108","127.0.0.1","127.0.0.1","TCP","40","49476  >  3306 [ACK] Seq=1 Ack=1 Win=8192 Len=0","0","49476","3306","0x010",""
"93","60.582108","127.0.0.1","127.0.0.1","MySQL","118","Server Greeting proto=10 version=5.6.20","78","3306","49476","0x018",""
"94","60.582108","127.0.0.1","127.0.0.1","TCP","40","49476  >  3306 [ACK] Seq=1 Ack=79 Win=7936 Len=0","0","49476","3306","0x010",""
"95","60.582108","127.0.0.1","127.0.0.1","MySQL","127","Login Request user=root","87","49476","3306","0x018",""
"96","60.582108","127.0.0.1","127.0.0.1","TCP","40","3306  >  49476 [ACK] Seq=79 Ack=88 Win=7936 Len=0","0","3306","49476","0x010",""
"97","60.582108","127.0.0.1","127.0.0.1","MySQL","88","Auth Switch Request","48","3306","49476","0x018",""
"98","60.582108","127.0.0.1","127.0.0.1","TCP","40","49476  >  3306 [ACK] Seq=88 Ack=127 Win=7936 Len=0","0","49476","3306","0x010",""
"99","60.582108","127.0.0.1","127.0.0.1","MySQL","44","Auth Switch Response","4","49476","3306","0x018",""
"100","60.582108","127.0.0.1","127.0.0.1","TCP","40","3306  >  49476 [ACK] Seq=127 Ack=92 Win=7936 Len=0","0","3306","49476","0x010",""
"101","60.582108","127.0.0.1","127.0.0.1","MySQL","51","Response OK","11","3306","49476","0x018",""
"102","60.582108","127.0.0.1","127.0.0.1","TCP","40","49476  >  3306 [ACK] Seq=92 Ack=138 Win=7936 Len=0","0","49476","3306","0x010",""
"103","60.582108","127.0.0.1","127.0.0.1","MySQL","47","Request Set Option","7","49476","3306","0x018",""
"104","60.582108","127.0.0.1","127.0.0.1","TCP","40","3306  >  49476 [ACK] Seq=138 Ack=99 Win=7936 Len=0","0","3306","49476","0x010",""
"105","60.582108","127.0.0.1","127.0.0.1","MySQL","49","Response","9","3306","49476","0x018",""
"106","60.582108","127.0.0.1","127.0.0.1","TCP","40","49476  >  3306 [ACK] Seq=99 Ack=147 Win=7936 Len=0","0","49476","3306","0x010",""
"107","60.597708","127.0.0.1","127.0.0.1","MySQL","87","Request Query","47","49476","3306","0x018",""
"108","60.597708","127.0.0.1","127.0.0.1","TCP","40","3306  >  49476 [ACK] Seq=147 Ack=146 Win=7936 Len=0","0","3306","49476","0x010",""
"109","60.597708","127.0.0.1","127.0.0.1","MySQL","51","Response OK","11","3306","49476","0x018",""
"110","60.597708","127.0.0.1","127.0.0.1","TCP","40","49476  >  3306 [ACK] Seq=146 Ack=158 Win=7936 Len=0","0","49476","3306","0x010",""
"111","60.597708","127.0.0.1","127.0.0.1","MySQL","49","Request Use Database","9","49476","3306","0x018",""
"112","60.597708","127.0.0.1","127.0.0.1","TCP","40","3306  >  49476 [ACK] Seq=158 Ack=155 Win=7936 Len=0","0","3306","49476","0x010",""
"113","60.597708","127.0.0.1","127.0.0.1","MySQL","51","Response OK","11","3306","49476","0x018",""
"114","60.597708","127.0.0.1","127.0.0.1","TCP","40","49476  >  3306 [ACK] Seq=155 Ack=169 Win=7936 Len=0","0","49476","3306","0x010",""
"115","60.597708","127.0.0.1","127.0.0.1","MySQL","106","Request Query","66","49476","3306","0x018",""
"116","60.597708","127.0.0.1","127.0.0.1","TCP","40","3306  >  49476 [ACK] Seq=169 Ack=221 Win=7936 Len=0","0","3306","49476","0x010",""
"117","60.628908","127.0.0.1","127.0.0.1","MySQL","109","Response","69","3306","49476","0x018",""
"118","60.628908","127.0.0.1","127.0.0.1","TCP","40","49476  >  3306 [ACK] Seq=221 Ack=238 Win=7936 Len=0","0","49476","3306","0x010",""
"119","60.628908","127.0.0.1","127.0.0.1","MySQL","666","Request Query","626","49476","3306","0x018",""
"120","60.628908","127.0.0.1","127.0.0.1","TCP","40","3306  >  49476 [ACK] Seq=238 Ack=847 Win=7168 Len=0","0","3306","49476","0x010",""
"121","60.628908","127.0.0.1","127.0.0.1","MySQL","51","Response OK","11","3306","49476","0x018",""
"122","60.628908","127.0.0.1","127.0.0.1","TCP","40","49476  >  3306 [ACK] Seq=847 Ack=249 Win=7936 Len=0","0","49476","3306","0x010",""
"123","60.628908","127.0.0.1","127.0.0.1","MySQL","45","Request Quit","5","49476","3306","0x018",""
"124","60.628908","127.0.0.1","127.0.0.1","TCP","40","3306  >  49476 [ACK] Seq=249 Ack=852 Win=7168 Len=0","0","3306","49476","0x010",""
"125","60.628908","127.0.0.1","127.0.0.1","TCP","40","49476  >  3306 [FIN, ACK] Seq=852 Ack=249 Win=7936 Len=0","0","49476","3306","0x011",""
"126","60.628908","127.0.0.1","127.0.0.1","TCP","40","3306  >  49476 [FIN, ACK] Seq=249 Ack=852 Win=7168 Len=0","0","3306","49476","0x011",""
"127","60.628908","127.0.0.1","127.0.0.1","TCP","40","3306  >  49476 [ACK] Seq=250 Ack=853 Win=7168 Len=0","0","3306","49476","0x010",""
"128","60.628908","127.0.0.1","127.0.0.1","TCP","40","[TCP Dup ACK 127#1] 3306  >  49476 [ACK] Seq=250 Ack=853 Win=7168 Len=0","0","3306","49476","0x010",""
"129","60.628908","127.0.0.1","127.0.0.1","TCP","40","49476  >  3306 [ACK] Seq=853 Ack=250 Win=7936 Len=0","0","49476","3306","0x010",""
"130","60.660108","127.0.0.1","127.0.0.1","TCP","52","49477  >  3306 [SYN] Seq=0 Win=8192 Len=0 MSS=65495 WS=256 SACK_PERM=1","0","49477","3306","0x002",""
"131","60.660108","127.0.0.1","127.0.0.1","TCP","52","3306  >  49477 [SYN, ACK] Seq=0 Ack=1 Win=8192 Len=0 MSS=65495 WS=256 SACK_PERM=1","0","3306","49477","0x012",""
"132","60.660108","127.0.0.1","127.0.0.1","TCP","40","49477  >  3306 [ACK] Seq=1 Ack=1 Win=8192 Len=0","0","49477","3306","0x010",""
"133","60.660108","127.0.0.1","127.0.0.1","MySQL","118","Server Greeting proto=10 version=5.6.20","78","3306","49477","0x018",""
"134","60.660108","127.0.0.1","127.0.0.1","TCP","40","49477  >  3306 [ACK] Seq=1 Ack=79 Win=7936 Len=0","0","49477","3306","0x010",""
"135","60.660108","127.0.0.1","127.0.0.1","MySQL","127","Login Request user=root","87","49477","3306","0x018",""
"136","60.660108","127.0.0.1","127.0.0.1","TCP","40","3306  >  49477 [ACK] Seq=79 Ack=88 Win=7936 Len=0","0","3306","49477","0x010",""
"137","60.660108","127.0.0.1","127.0.0.1","MySQL","88","Auth Switch Request","48","3306","49477","0x018",""
"138","60.660108","127.0.0.1","127.0.0.1","TCP","40","49477  >  3306 [ACK] Seq=88 Ack=127 Win=7936 Len=0","0","49477","3306","0x010",""
"139","60.660108","127.0.0.1","127.0.0.1","MySQL","44","Auth Switch Response","4","49477","3306","0x018",""
"140","60.660108","127.0.0.1","127.0.0.1","TCP","40","3306  >  49477 [ACK] Seq=127 Ack=92 Win=7936 Len=0","0","3306","49477","0x010",""
"141","60.660108","127.0.0.1","127.0.0.1","MySQL","51","Response OK","11","3306","49477","0x018",""
"142","60.660108","127.0.0.1","127.0.0.1","TCP","40","49477  >  3306 [ACK] Seq=92 Ack=138 Win=7936 Len=0","0","49477","3306","0x010",""
"143","60.660108","127.0.0.1","127.0.0.1","MySQL","47","Request Set Option","7","49477","3306","0x018",""
"144","60.660108","127.0.0.1","127.0.0.1","TCP","40","3306  >  49477 [ACK] Seq=138 Ack=99 Win=7936 Len=0","0","3306","49477","0x010",""
"145","60.660108","127.0.0.1","127.0.0.1","MySQL","49","Response","9","3306","49477","0x018",""
"146","60.660108","127.0.0.1","127.0.0.1","TCP","40","49477  >  3306 [ACK] Seq=99 Ack=147 Win=7936 Len=0","0","49477","3306","0x010",""
"147","60.660108","127.0.0.1","127.0.0.1","MySQL","87","Request Query","47","49477","3306","0x018",""
"148","60.660108","127.0.0.1","127.0.0.1","TCP","40","3306  >  49477 [ACK] Seq=147 Ack=146 Win=7936 Len=0","0","3306","49477","0x010",""
"149","60.660108","127.0.0.1","127.0.0.1","MySQL","51","Response OK","11","3306","49477","0x018",""
"150","60.660108","127.0.0.1","127.0.0.1","TCP","40","49477  >  3306 [ACK] Seq=146 Ack=158 Win=7936 Len=0","0","49477","3306","0x010",""
"151","60.660108","127.0.0.1","127.0.0.1","MySQL","49","Request Use Database","9","49477","3306","0x018",""
"152","60.660108","127.0.0.1","127.0.0.1","TCP","40","3306  >  49477 [ACK] Seq=158 Ack=155 Win=7936 Len=0","0","3306","49477","0x010",""
"153","60.660108","127.0.0.1","127.0.0.1","MySQL","51","Response OK","11","3306","49477","0x018",""
"154","60.660108","127.0.0.1","127.0.0.1","TCP","40","49477  >  3306 [ACK] Seq=155 Ack=169 Win=7936 Len=0","0","49477","3306","0x010",""
"155","60.660108","127.0.0.1","127.0.0.1","MySQL","106","Request Query","66","49477","3306","0x018",""
"156","60.660108","127.0.0.1","127.0.0.1","TCP","40","3306  >  49477 [ACK] Seq=169 Ack=221 Win=7936 Len=0","0","3306","49477","0x010",""
"157","60.691308","127.0.0.1","127.0.0.1","MySQL","109","Response","69","3306","49477","0x018",""
"158","60.691308","127.0.0.1","127.0.0.1","TCP","40","49477  >  3306 [ACK] Seq=221 Ack=238 Win=7936 Len=0","0","49477","3306","0x010",""
"159","60.691308","127.0.0.1","127.0.0.1","MySQL","686","Request Query","646","49477","3306","0x018",""
"160","60.691308","127.0.0.1","127.0.0.1","TCP","40","3306  >  49477 [ACK] Seq=238 Ack=867 Win=7168 Len=0","0","3306","49477","0x010",""
"161","60.691308","127.0.0.1","127.0.0.1","MySQL","51","Response OK","11","3306","49477","0x018",""
"162","60.691308","127.0.0.1","127.0.0.1","TCP","40","49477  >  3306 [ACK] Seq=867 Ack=249 Win=7936 Len=0","0","49477","3306","0x010",""
"163","60.691308","127.0.0.1","127.0.0.1","MySQL","45","Request Quit","5","49477","3306","0x018",""
"164","60.691308","127.0.0.1","127.0.0.1","TCP","40","3306  >  49477 [ACK] Seq=249 Ack=872 Win=7168 Len=0","0","3306","49477","0x010",""
"165","60.691308","127.0.0.1","127.0.0.1","TCP","40","49477  >  3306 [FIN, ACK] Seq=872 Ack=249 Win=7936 Len=0","0","49477","3306","0x011",""
"166","60.691308","127.0.0.1","127.0.0.1","TCP","40","3306  >  49477 [FIN, ACK] Seq=249 Ack=872 Win=7168 Len=0","0","3306","49477","0x011",""
"167","60.691308","127.0.0.1","127.0.0.1","TCP","40","3306  >  49477 [ACK] Seq=250 Ack=873 Win=7168 Len=0","0","3306","49477","0x010",""
"168","60.691308","127.0.0.1","127.0.0.1","TCP","40","[TCP Dup ACK 167#1] 3306  >  49477 [ACK] Seq=250 Ack=873 Win=7168 Len=0","0","3306","49477","0x010",""
"169","60.691308","127.0.0.1","127.0.0.1","TCP","40","49477  >  3306 [ACK] Seq=873 Ack=250 Win=7936 Len=0","0","49477","3306","0x010",""
"170","60.722508","127.0.0.1","127.0.0.1","TCP","52","49478  >  3306 [SYN] Seq=0 Win=8192 Len=0 MSS=65495 WS=256 SACK_PERM=1","0","49478","3306","0x002",""
"171","60.722508","127.0.0.1","127.0.0.1","TCP","52","3306  >  49478 [SYN, ACK] Seq=0 Ack=1 Win=8192 Len=0 MSS=65495 WS=256 SACK_PERM=1","0","3306","49478","0x012",""
"172","60.722508","127.0.0.1","127.0.0.1","TCP","40","49478  >  3306 [ACK] Seq=1 Ack=1 Win=8192 Len=0","0","49478","3306","0x010",""
"173","60.738108","127.0.0.1","127.0.0.1","MySQL","118","Server Greeting proto=10 version=5.6.20","78","3306","49478","0x018",""
"174","60.738108","127.0.0.1","127.0.0.1","TCP","40","49478  >  3306 [ACK] Seq=1 Ack=79 Win=7936 Len=0","0","49478","3306","0x010",""
"175","60.738108","127.0.0.1","127.0.0.1","MySQL","127","Login Request user=root","87","49478","3306","0x018",""
"176","60.738108","127.0.0.1","127.0.0.1","TCP","40","3306  >  49478 [ACK] Seq=79 Ack=88 Win=7936 Len=0","0","3306","49478","0x010",""
"177","60.738108","127.0.0.1","127.0.0.1","MySQL","88","Auth Switch Request","48","3306","49478","0x018",""
"178","60.738108","127.0.0.1","127.0.0.1","TCP","40","49478  >  3306 [ACK] Seq=88 Ack=127 Win=7936 Len=0","0","49478","3306","0x010",""
"179","60.738108","127.0.0.1","127.0.0.1","MySQL","44","Auth Switch Response","4","49478","3306","0x018",""
"180","60.738108","127.0.0.1","127.0.0.1","TCP","40","3306  >  49478 [ACK] Seq=127 Ack=92 Win=7936 Len=0","0","3306","49478","0x010",""
"181","60.738108","127.0.0.1","127.0.0.1","MySQL","51","Response OK","11","3306","49478","0x018",""
"182","60.738108","127.0.0.1","127.0.0.1","TCP","40","49478  >  3306 [ACK] Seq=92 Ack=138 Win=7936 Len=0","0","49478","3306","0x010",""
"183","60.738108","127.0.0.1","127.0.0.1","MySQL","47","Request Set Option","7","49478","3306","0x018",""
"184","60.738108","127.0.0.1","127.0.0.1","TCP","40","3306  >  49478 [ACK] Seq=138 Ack=99 Win=7936 Len=0","0","3306","49478","0x010",""
"185","60.738108","127.0.0.1","127.0.0.1","MySQL","49","Response","9","3306","49478","0x018",""
"186","60.738108","127.0.0.1","127.0.0.1","TCP","40","49478  >  3306 [ACK] Seq=99 Ack=147 Win=7936 Len=0","0","49478","3306","0x010",""
"187","60.738108","127.0.0.1","127.0.0.1","MySQL","87","Request Query","47","49478","3306","0x018",""
"188","60.738108","127.0.0.1","127.0.0.1","TCP","40","3306  >  49478 [ACK] Seq=147 Ack=146 Win=7936 Len=0","0","3306","49478","0x010",""
"189","60.738108","127.0.0.1","127.0.0.1","MySQL","51","Response OK","11","3306","49478","0x018",""
"190","60.738108","127.0.0.1","127.0.0.1","TCP","40","49478  >  3306 [ACK] Seq=146 Ack=158 Win=7936 Len=0","0","49478","3306","0x010",""
"191","60.738108","127.0.0.1","127.0.0.1","MySQL","49","Request Use Database","9","49478","3306","0x018",""
"192","60.738108","127.0.0.1","127.0.0.1","TCP","40","3306  >  49478 [ACK] Seq=158 Ack=155 Win=7936 Len=0","0","3306","49478","0x010",""
"193","60.738108","127.0.0.1","127.0.0.1","MySQL","51","Response OK","11","3306","49478","0x018",""
"194","60.738108","127.0.0.1","127.0.0.1","TCP","40","49478  >  3306 [ACK] Seq=155 Ack=169 Win=7936 Len=0","0","49478","3306","0x010",""
"195","60.738108","127.0.0.1","127.0.0.1","MySQL","106","Request Query","66","49478","3306","0x018",""
"196","60.738108","127.0.0.1","127.0.0.1","TCP","40","3306  >  49478 [ACK] Seq=169 Ack=221 Win=7936 Len=0","0","3306","49478","0x010",""
"197","60.769308","127.0.0.1","127.0.0.1","MySQL","109","Response","69","3306","49478","0x018",""
"198","60.769308","127.0.0.1","127.0.0.1","TCP","40","49478  >  3306 [ACK] Seq=221 Ack=238 Win=7936 Len=0","0","49478","3306","0x010",""
"199","60.769308","127.0.0.1","127.0.0.1","TCP","1500","49478  >  3306 [ACK] Seq=221 Ack=238 Win=7936 Len=1460 [TCP segment of a reassembled PDU]","1460","49478","3306","0x010",""
"200","60.769308","127.0.0.1","127.0.0.1","TCP","1500","49478  >  3306 [ACK] Seq=1681 Ack=238 Win=7936 Len=1460 [TCP segment of a reassembled PDU]","1460","49478","3306","0x010",""
"201","60.769308","127.0.0.1","127.0.0.1","TCP","40","3306  >  49478 [ACK] Seq=238 Ack=3141 Win=8192 Len=0","0","3306","49478","0x010",""
"202","60.769308","127.0.0.1","127.0.0.1","MySQL","311","Request Query","271","49478","3306","0x018",""
"203","60.769308","127.0.0.1","127.0.0.1","TCP","40","3306  >  49478 [ACK] Seq=238 Ack=3412 Win=7680 Len=0","0","3306","49478","0x010",""
"204","60.769308","127.0.0.1","127.0.0.1","MySQL","51","Response OK","11","3306","49478","0x018",""
"205","60.769308","127.0.0.1","127.0.0.1","TCP","40","49478  >  3306 [ACK] Seq=3412 Ack=249 Win=7936 Len=0","0","49478","3306","0x010",""
"206","60.784908","127.0.0.1","127.0.0.1","MySQL","45","Request Quit","5","49478","3306","0x018",""
"207","60.784908","127.0.0.1","127.0.0.1","TCP","40","3306  >  49478 [ACK] Seq=249 Ack=3417 Win=7680 Len=0","0","3306","49478","0x010",""
"208","60.784908","127.0.0.1","127.0.0.1","TCP","40","49478  >  3306 [FIN, ACK] Seq=3417 Ack=249 Win=7936 Len=0","0","49478","3306","0x011",""
"209","60.784908","127.0.0.1","127.0.0.1","TCP","40","3306  >  49478 [ACK] Seq=249 Ack=3418 Win=7680 Len=0","0","3306","49478","0x010",""
"210","60.784908","127.0.0.1","127.0.0.1","TCP","40","3306  >  49478 [FIN, ACK] Seq=249 Ack=3418 Win=7680 Len=0","0","3306","49478","0x011",""
"211","60.784908","127.0.0.1","127.0.0.1","TCP","40","49478  >  3306 [ACK] Seq=3418 Ack=250 Win=7936 Len=0","0","49478","3306","0x010",""
"212","60.831708","127.0.0.1","127.0.0.1","TCP","52","49479  >  3306 [SYN] Seq=0 Win=8192 Len=0 MSS=65495 WS=256 SACK_PERM=1","0","49479","3306","0x002",""
"213","60.831708","127.0.0.1","127.0.0.1","TCP","52","3306  >  49479 [SYN, ACK] Seq=0 Ack=1 Win=8192 Len=0 MSS=65495 WS=256 SACK_PERM=1","0","3306","49479","0x012",""
"214","60.831708","127.0.0.1","127.0.0.1","TCP","40","49479  >  3306 [ACK] Seq=1 Ack=1 Win=8192 Len=0","0","49479","3306","0x010",""
"215","60.847308","127.0.0.1","127.0.0.1","MySQL","118","Server Greeting proto=10 version=5.6.20","78","3306","49479","0x018",""
"216","60.847308","127.0.0.1","127.0.0.1","TCP","40","49479  >  3306 [ACK] Seq=1 Ack=79 Win=7936 Len=0","0","49479","3306","0x010",""
"217","60.847308","127.0.0.1","127.0.0.1","MySQL","127","Login Request user=root","87","49479","3306","0x018",""
"218","60.847308","127.0.0.1","127.0.0.1","TCP","40","3306  >  49479 [ACK] Seq=79 Ack=88 Win=7936 Len=0","0","3306","49479","0x010",""
"219","60.847308","127.0.0.1","127.0.0.1","MySQL","88","Auth Switch Request","48","3306","49479","0x018",""
"220","60.847308","127.0.0.1","127.0.0.1","TCP","40","49479  >  3306 [ACK] Seq=88 Ack=127 Win=7936 Len=0","0","49479","3306","0x010",""
"221","60.847308","127.0.0.1","127.0.0.1","MySQL","44","Auth Switch Response","4","49479","3306","0x018",""
"222","60.847308","127.0.0.1","127.0.0.1","TCP","40","3306  >  49479 [ACK] Seq=127 Ack=92 Win=7936 Len=0","0","3306","49479","0x010",""
"223","60.847308","127.0.0.1","127.0.0.1","MySQL","51","Response OK","11","3306","49479","0x018",""
"224","60.847308","127.0.0.1","127.0.0.1","TCP","40","49479  >  3306 [ACK] Seq=92 Ack=138 Win=7936 Len=0","0","49479","3306","0x010",""
"225","60.847308","127.0.0.1","127.0.0.1","MySQL","47","Request Set Option","7","49479","3306","0x018",""
"226","60.847308","127.0.0.1","127.0.0.1","TCP","40","3306  >  49479 [ACK] Seq=138 Ack=99 Win=7936 Len=0","0","3306","49479","0x010",""
"227","60.847308","127.0.0.1","127.0.0.1","MySQL","49","Response","9","3306","49479","0x018",""
"228","60.847308","127.0.0.1","127.0.0.1","TCP","40","49479  >  3306 [ACK] Seq=99 Ack=147 Win=7936 Len=0","0","49479","3306","0x010",""
"229","60.847308","127.0.0.1","127.0.0.1","MySQL","87","Request Query","47","49479","3306","0x018",""
"230","60.847308","127.0.0.1","127.0.0.1","TCP","40","3306  >  49479 [ACK] Seq=147 Ack=146 Win=7936 Len=0","0","3306","49479","0x010",""
"231","60.847308","127.0.0.1","127.0.0.1","MySQL","51","Response OK","11","3306","49479","0x018",""
"232","60.847308","127.0.0.1","127.0.0.1","TCP","40","49479  >  3306 [ACK] Seq=146 Ack=158 Win=7936 Len=0","0","49479","3306","0x010",""
"233","60.847308","127.0.0.1","127.0.0.1","MySQL","49","Request Use Database","9","49479","3306","0x018",""
"234","60.847308","127.0.0.1","127.0.0.1","TCP","40","3306  >  49479 [ACK] Seq=158 Ack=155 Win=7936 Len=0","0","3306","49479","0x010",""
"235","60.847308","127.0.0.1","127.0.0.1","MySQL","51","Response OK","11","3306","49479","0x018",""
"236","60.847308","127.0.0.1","127.0.0.1","TCP","40","49479  >  3306 [ACK] Seq=155 Ack=169 Win=7936 Len=0","0","49479","3306","0x010",""
"237","60.847308","127.0.0.1","127.0.0.1","MySQL","106","Request Query","66","49479","3306","0x018",""
"238","60.847308","127.0.0.1","127.0.0.1","TCP","40","3306  >  49479 [ACK] Seq=169 Ack=221 Win=7936 Len=0","0","3306","49479","0x010",""
"239","60.878508","127.0.0.1","127.0.0.1","MySQL","109","Response","69","3306","49479","0x018",""
"240","60.878508","127.0.0.1","127.0.0.1","TCP","40","49479  >  3306 [ACK] Seq=221 Ack=238 Win=7936 Len=0","0","49479","3306","0x010",""
"241","60.878508","127.0.0.1","127.0.0.1","TCP","1500","49479  >  3306 [ACK] Seq=221 Ack=238 Win=7936 Len=1460 [TCP segment of a reassembled PDU]","1460","49479","3306","0x010",""
"242","60.878508","127.0.0.1","127.0.0.1","TCP","1500","49479  >  3306 [ACK] Seq=1681 Ack=238 Win=7936 Len=1460 [TCP segment of a reassembled PDU]","1460","49479","3306","0x010",""
"243","60.878508","127.0.0.1","127.0.0.1","TCP","40","3306  >  49479 [ACK] Seq=238 Ack=3141 Win=8192 Len=0","0","3306","49479","0x010",""
"244","60.878508","127.0.0.1","127.0.0.1","MySQL","751","Request Query","711","49479","3306","0x018",""
"245","60.878508","127.0.0.1","127.0.0.1","TCP","40","3306  >  49479 [ACK] Seq=238 Ack=3852 Win=7424 Len=0","0","3306","49479","0x010",""
"246","60.878508","127.0.0.1","127.0.0.1","MySQL","51","Response OK","11","3306","49479","0x018",""
"247","60.878508","127.0.0.1","127.0.0.1","TCP","40","49479  >  3306 [ACK] Seq=3852 Ack=249 Win=7936 Len=0","0","49479","3306","0x010",""
"248","60.878508","127.0.0.1","127.0.0.1","MySQL","45","Request Quit","5","49479","3306","0x018",""
"249","60.878508","127.0.0.1","127.0.0.1","TCP","40","3306  >  49479 [ACK] Seq=249 Ack=3857 Win=7424 Len=0","0","3306","49479","0x010",""
"250","60.878508","127.0.0.1","127.0.0.1","TCP","40","3306  >  49479 [FIN, ACK] Seq=249 Ack=3857 Win=7424 Len=0","0","3306","49479","0x011",""
"251","60.878508","127.0.0.1","127.0.0.1","TCP","40","49479  >  3306 [ACK] Seq=3857 Ack=250 Win=7936 Len=0","0","49479","3306","0x010",""
"252","60.878508","127.0.0.1","127.0.0.1","TCP","40","49479  >  3306 [FIN, ACK] Seq=3857 Ack=250 Win=7936 Len=0","0","49479","3306","0x011",""
"253","60.878508","127.0.0.1","127.0.0.1","TCP","40","3306  >  49479 [ACK] Seq=250 Ack=3858 Win=7424 Len=0","0","3306","49479","0x010",""
"254","107.010400","127.0.0.1","127.0.0.1","TCP","40","2869  >  49236 [RST, ACK] Seq=1 Ack=1 Win=0 Len=0","0","2869","49236","0x014",""
"255","121.151100","127.0.0.1","127.0.0.1","TCP","52","49775  >  3306 [SYN] Seq=0 Win=8192 Len=0 MSS=65495 WS=256 SACK_PERM=1","0","49775","3306","0x002",""
"256","121.151100","127.0.0.1","127.0.0.1","TCP","52","3306  >  49775 [SYN, ACK] Seq=0 Ack=1 Win=8192 Len=0 MSS=65495 WS=256 SACK_PERM=1","0","3306","49775","0x012",""
"257","121.151100","127.0.0.1","127.0.0.1","TCP","40","49775  >  3306 [ACK] Seq=1 Ack=1 Win=8192 Len=0","0","49775","3306","0x010",""
"258","121.265300","127.0.0.1","127.0.0.1","MySQL","118","Server Greeting proto=10 version=5.6.20","78","3306","49775","0x018",""
"259","121.265300","127.0.0.1","127.0.0.1","TCP","40","49775  >  3306 [ACK] Seq=1 Ack=79 Win=7936 Len=0","0","49775","3306","0x010",""
"260","121.265300","127.0.0.1","127.0.0.1","MySQL","127","Login Request user=root","87","49775","3306","0x018",""
"261","121.265300","127.0.0.1","127.0.0.1","TCP","40","3306  >  49775 [ACK] Seq=79 Ack=88 Win=7936 Len=0","0","3306","49775","0x010",""
"262","121.265300","127.0.0.1","127.0.0.1","MySQL","88","Auth Switch Request","48","3306","49775","0x018",""
"263","121.265300","127.0.0.1","127.0.0.1","TCP","40","49775  >  3306 [ACK] Seq=88 Ack=127 Win=7936 Len=0","0","49775","3306","0x010",""
"264","121.265300","127.0.0.1","127.0.0.1","MySQL","44","Auth Switch Response","4","49775","3306","0x018",""
"265","121.265300","127.0.0.1","127.0.0.1","TCP","40","3306  >  49775 [ACK] Seq=127 Ack=92 Win=7936 Len=0","0","3306","49775","0x010",""
"266","121.265300","127.0.0.1","127.0.0.1","MySQL","51","Response OK","11","3306","49775","0x018",""
"267","121.265300","127.0.0.1","127.0.0.1","TCP","40","49775  >  3306 [ACK] Seq=92 Ack=138 Win=7936 Len=0","0","49775","3306","0x010",""
"268","121.265300","127.0.0.1","127.0.0.1","MySQL","47","Request Set Option","7","49775","3306","0x018",""
"269","121.265300","127.0.0.1","127.0.0.1","TCP","40","3306  >  49775 [ACK] Seq=138 Ack=99 Win=7936 Len=0","0","3306","49775","0x010",""
"270","121.265300","127.0.0.1","127.0.0.1","MySQL","49","Response","9","3306","49775","0x018",""
"271","121.265300","127.0.0.1","127.0.0.1","TCP","40","49775  >  3306 [ACK] Seq=99 Ack=147 Win=7936 Len=0","0","49775","3306","0x010",""
"272","121.265300","127.0.0.1","127.0.0.1","MySQL","87","Request Query","47","49775","3306","0x018",""
"273","121.265300","127.0.0.1","127.0.0.1","TCP","40","3306  >  49775 [ACK] Seq=147 Ack=146 Win=7936 Len=0","0","3306","49775","0x010",""
"274","121.265300","127.0.0.1","127.0.0.1","MySQL","51","Response OK","11","3306","49775","0x018",""
"275","121.265300","127.0.0.1","127.0.0.1","TCP","40","49775  >  3306 [ACK] Seq=146 Ack=158 Win=7936 Len=0","0","49775","3306","0x010",""
"276","121.265300","127.0.0.1","127.0.0.1","MySQL","49","Request Use Database","9","49775","3306","0x018",""
"277","121.265300","127.0.0.1","127.0.0.1","TCP","40","3306  >  49775 [ACK] Seq=158 Ack=155 Win=7936 Len=0","0","3306","49775","0x010",""
"278","121.265300","127.0.0.1","127.0.0.1","MySQL","51","Response OK","11","3306","49775","0x018",""
"279","121.265300","127.0.0.1","127.0.0.1","TCP","40","49775  >  3306 [ACK] Seq=155 Ack=169 Win=7936 Len=0","0","49775","3306","0x010",""
"280","121.265300","127.0.0.1","127.0.0.1","MySQL","106","Request Query","66","49775","3306","0x018",""
"281","121.265300","127.0.0.1","127.0.0.1","TCP","40","3306  >  49775 [ACK] Seq=169 Ack=221 Win=7936 Len=0","0","3306","49775","0x010",""
"282","121.332700","127.0.0.1","127.0.0.1","MySQL","109","Response","69","3306","49775","0x018",""
"283","121.332700","127.0.0.1","127.0.0.1","TCP","40","49775  >  3306 [ACK] Seq=221 Ack=238 Win=7936 Len=0","0","49775","3306","0x010",""
"284","121.332700","127.0.0.1","127.0.0.1","TCP","1500","49775  >  3306 [ACK] Seq=221 Ack=238 Win=7936 Len=1460 [TCP segment of a reassembled PDU]","1460","49775","3306","0x010",""
"285","121.332700","127.0.0.1","127.0.0.1","TCP","1500","49775  >  3306 [ACK] Seq=1681 Ack=238 Win=7936 Len=1460 [TCP segment of a reassembled PDU]","1460","49775","3306","0x010",""
"286","121.332700","127.0.0.1","127.0.0.1","TCP","40","3306  >  49775 [ACK] Seq=238 Ack=3141 Win=8192 Len=0","0","3306","49775","0x010",""
"287","121.332700","127.0.0.1","127.0.0.1","TCP","1500","49775  >  3306 [ACK] Seq=3141 Ack=238 Win=7936 Len=1460 [TCP segment of a reassembled PDU]","1460","49775","3306","0x010",""
"288","121.332700","127.0.0.1","127.0.0.1","TCP","1500","49775  >  3306 [ACK] Seq=4601 Ack=238 Win=7936 Len=1460 [TCP segment of a reassembled PDU]","1460","49775","3306","0x010",""
"289","121.332700","127.0.0.1","127.0.0.1","TCP","1500","49775  >  3306 [ACK] Seq=6061 Ack=238 Win=7936 Len=1460 [TCP segment of a reassembled PDU]","1460","49775","3306","0x010",""
"290","121.332700","127.0.0.1","127.0.0.1","TCP","932","49775  >  3306 [PSH, ACK] Seq=7521 Ack=238 Win=7936 Len=892 [TCP segment of a reassembled PDU]","892","49775","3306","0x018",""
"291","121.332700","127.0.0.1","127.0.0.1","TCP","40","3306  >  49775 [ACK] Seq=238 Ack=8413 Win=8192 Len=0","0","3306","49775","0x010",""
"292","121.332700","127.0.0.1","127.0.0.1","MySQL","932","Request Query","892","49775","3306","0x018",""
"293","121.332700","127.0.0.1","127.0.0.1","TCP","40","3306  >  49775 [ACK] Seq=238 Ack=9305 Win=7168 Len=0","0","3306","49775","0x010",""
"294","121.363900","127.0.0.1","127.0.0.1","MySQL","51","Response OK","11","3306","49775","0x018",""
"295","121.363900","127.0.0.1","127.0.0.1","TCP","40","49775  >  3306 [ACK] Seq=9305 Ack=249 Win=7936 Len=0","0","49775","3306","0x010",""
"296","121.379500","127.0.0.1","127.0.0.1","MySQL","45","Request Quit","5","49775","3306","0x018",""
"297","121.379500","127.0.0.1","127.0.0.1","TCP","40","3306  >  49775 [ACK] Seq=249 Ack=9310 Win=7168 Len=0","0","3306","49775","0x010",""
"298","121.379500","127.0.0.1","127.0.0.1","TCP","40","49775  >  3306 [FIN, ACK] Seq=9310 Ack=249 Win=7936 Len=0","0","49775","3306","0x011",""
"299","121.379500","127.0.0.1","127.0.0.1","TCP","40","3306  >  49775 [ACK] Seq=249 Ack=9311 Win=7168 Len=0","0","3306","49775","0x010",""
"300","121.379500","127.0.0.1","127.0.0.1","TCP","40","3306  >  49775 [FIN, ACK] Seq=249 Ack=9311 Win=7168 Len=0","0","3306","49775","0x011",""
"301","121.379500","127.0.0.1","127.0.0.1","TCP","40","49775  >  3306 [ACK] Seq=9311 Ack=250 Win=7936 Len=0","0","49775","3306","0x010",""
"302","121.460001","127.0.0.1","127.0.0.1","TCP","52","49776  >  3306 [SYN] Seq=0 Win=8192 Len=0 MSS=65495 WS=256 SACK_PERM=1","0","49776","3306","0x002",""
"303","121.460001","127.0.0.1","127.0.0.1","TCP","52","3306  >  49776 [SYN, ACK] Seq=0 Ack=1 Win=8192 Len=0 MSS=65495 WS=256 SACK_PERM=1","0","3306","49776","0x012",""
"304","121.460001","127.0.0.1","127.0.0.1","TCP","40","49776  >  3306 [ACK] Seq=1 Ack=1 Win=8192 Len=0","0","49776","3306","0x010",""
"305","121.475601","127.0.0.1","127.0.0.1","MySQL","118","Server Greeting proto=10 version=5.6.20","78","3306","49776","0x018",""
"306","121.475601","127.0.0.1","127.0.0.1","TCP","40","49776  >  3306 [ACK] Seq=1 Ack=79 Win=7936 Len=0","0","49776","3306","0x010",""
"307","121.475601","127.0.0.1","127.0.0.1","MySQL","127","Login Request user=root","87","49776","3306","0x018",""
"308","121.475601","127.0.0.1","127.0.0.1","TCP","40","3306  >  49776 [ACK] Seq=79 Ack=88 Win=7936 Len=0","0","3306","49776","0x010",""
"309","121.475601","127.0.0.1","127.0.0.1","MySQL","88","Auth Switch Request","48","3306","49776","0x018",""
"310","121.475601","127.0.0.1","127.0.0.1","TCP","40","49776  >  3306 [ACK] Seq=88 Ack=127 Win=7936 Len=0","0","49776","3306","0x010",""
"311","121.475601","127.0.0.1","127.0.0.1","MySQL","44","Auth Switch Response","4","49776","3306","0x018",""
