"No.","Time","Source","Destination","Protocol","Length","Info","Packet payload length","TCP source port","TCP destination port","TCP flags","HTTP request"
"1","0.000000","127.0.0.1","127.0.0.1","TCP","40","49447  >  2869 [RST, ACK] Seq=1 Ack=1 Win=0 Len=0","0","49447","2869","0x014",""
"2","9.577239","127.0.0.1","127.0.0.1","TCP","52","49895  >  3306 [SYN] Seq=0 Win=8192 Len=0 MSS=65495 WS=256 SACK_PERM=1","0","49895","3306","0x002",""
"3","9.607239","127.0.0.1","127.0.0.1","TCP","52","3306  >  49895 [SYN, ACK] Seq=0 Ack=1 Win=8192 Len=0 MSS=65495 WS=256 SACK_PERM=1","0","3306","49895","0x012",""
"4","9.607239","127.0.0.1","127.0.0.1","TCP","40","49895  >  3306 [ACK] Seq=1 Ack=1 Win=8192 Len=0","0","49895","3306","0x010",""
"5","9.627239","127.0.0.1","127.0.0.1","MySQL","118","Server Greeting proto=10 version=5.6.20","78","3306","49895","0x018",""
"6","9.627239","127.0.0.1","127.0.0.1","TCP","40","49895  >  3306 [ACK] Seq=1 Ack=79 Win=7936 Len=0","0","49895","3306","0x010",""
"7","9.627239","127.0.0.1","127.0.0.1","MySQL","127","Login Request user=root","87","49895","3306","0x018",""
"8","9.627239","127.0.0.1","127.0.0.1","TCP","40","3306  >  49895 [ACK] Seq=79 Ack=88 Win=7936 Len=0","0","3306","49895","0x010",""
"9","9.627239","127.0.0.1","127.0.0.1","MySQL","88","Auth Switch Request","48","3306","49895","0x018",""
"10","9.677240","127.0.0.1","127.0.0.1","TCP","40","49895  >  3306 [ACK] Seq=88 Ack=127 Win=7936 Len=0","0","49895","3306","0x010",""
"11","9.677240","127.0.0.1","127.0.0.1","MySQL","44","Auth Switch Response","4","49895","3306","0x018",""
"12","9.687240","127.0.0.1","127.0.0.1","TCP","40","3306  >  49895 [ACK] Seq=127 Ack=92 Win=7936 Len=0","0","3306","49895","0x010",""
"13","9.689740","127.0.0.1","127.0.0.1","MySQL","51","Response OK","11","3306","49895","0x018",""
"14","9.694741","127.0.0.1","127.0.0.1","TCP","40","49895  >  3306 [ACK] Seq=92 Ack=138 Win=7936 Len=0","0","49895","3306","0x010",""
"15","9.694741","127.0.0.1","127.0.0.1","MySQL","47","Request Set Option","7","49895","3306","0x018",""
"16","9.697241","127.0.0.1","127.0.0.1","TCP","40","3306  >  49895 [ACK] Seq=138 Ack=99 Win=7936 Len=0","0","3306","49895","0x010",""
"17","9.699741","127.0.0.1","127.0.0.1","MySQL","49","Response","9","3306","49895","0x018",""
"18","9.699741","127.0.0.1","127.0.0.1","TCP","40","49895  >  3306 [ACK] Seq=99 Ack=147 Win=7936 Len=0","0","49895","3306","0x010",""
"19","9.699741","127.0.0.1","127.0.0.1","MySQL","87","Request Query","47","49895","3306","0x018",""
"20","9.699741","127.0.0.1","127.0.0.1","TCP","40","3306  >  49895 [ACK] Seq=147 Ack=146 Win=7936 Len=0","0","3306","49895","0x010",""
"21","9.699741","127.0.0.1","127.0.0.1","MySQL","51","Response OK","11","3306","49895","0x018",""
"22","9.699741","127.0.0.1","127.0.0.1","TCP","40","49895  >  3306 [ACK] Seq=146 Ack=158 Win=7936 Len=0","0","49895","3306","0x010",""
"23","9.699741","127.0.0.1","127.0.0.1","MySQL","49","Request Use Database","9","49895","3306","0x018",""
"24","9.702241","127.0.0.1","127.0.0.1","TCP","40","3306  >  49895 [ACK] Seq=158 Ack=155 Win=7936 Len=0","0","3306","49895","0x010",""
"25","9.702241","127.0.0.1","127.0.0.1","MySQL","51","Response OK","11","3306","49895","0x018",""
"26","9.702241","127.0.0.1","127.0.0.1","TCP","40","49895  >  3306 [ACK] Seq=155 Ack=169 Win=7936 Len=0","0","49895","3306","0x010",""
"27","9.702241","127.0.0.1","127.0.0.1","MySQL","106","Request Query","66","49895","3306","0x018",""
"28","9.702241","127.0.0.1","127.0.0.1","TCP","40","3306  >  49895 [ACK] Seq=169 Ack=221 Win=7936 Len=0","0","3306","49895","0x010",""
"29","9.702241","127.0.0.1","127.0.0.1","MySQL","109","Response","69","3306","49895","0x018",""
"30","9.702241","127.0.0.1","127.0.0.1","TCP","40","49895  >  3306 [ACK] Seq=221 Ack=238 Win=7936 Len=0","0","49895","3306","0x010",""
"31","9.702241","127.0.0.1","127.0.0.1","TCP","1500","49895  >  3306 [ACK] Seq=221 Ack=238 Win=7936 Len=1460 [TCP segment of a reassembled PDU]","1460","49895","3306","0x010",""
"32","9.702241","127.0.0.1","127.0.0.1","TCP","1500","49895  >  3306 [ACK] Seq=1681 Ack=238 Win=7936 Len=1460 [TCP segment of a reassembled PDU]","1460","49895","3306","0x010",""
"33","9.702241","127.0.0.1","127.0.0.1","TCP","40","3306  >  49895 [ACK] Seq=238 Ack=3141 Win=8192 Len=0","0","3306","49895","0x010",""
"34","9.702241","127.0.0.1","127.0.0.1","MySQL","311","Request Query","271","49895","3306","0x018",""
"35","9.702241","127.0.0.1","127.0.0.1","TCP","40","3306  >  49895 [ACK] Seq=238 Ack=3412 Win=7680 Len=0","0","3306","49895","0x010",""
"36","9.702241","127.0.0.1","127.0.0.1","MySQL","51","Response OK","11","3306","49895","0x018",""
"37","9.702241","127.0.0.1","127.0.0.1","TCP","40","49895  >  3306 [ACK] Seq=3412 Ack=249 Win=7936 Len=0","0","49895","3306","0x010",""
"38","9.702241","127.0.0.1","127.0.0.1","MySQL","45","Request Quit","5","49895","3306","0x018",""
"39","9.704741","127.0.0.1","127.0.0.1","TCP","40","3306  >  49895 [ACK] Seq=249 Ack=3417 Win=7680 Len=0","0","3306","49895","0x010",""
"40","9.704741","127.0.0.1","127.0.0.1","TCP","40","3306  >  49895 [FIN, ACK] Seq=249 Ack=3417 Win=7680 Len=0","0","3306","49895","0x011",""
"41","9.704741","127.0.0.1","127.0.0.1","TCP","40","49895  >  3306 [FIN, ACK] Seq=3417 Ack=249 Win=7936 Len=0","0","49895","3306","0x011",""
"42","9.704741","127.0.0.1","127.0.0.1","TCP","40","49895  >  3306 [ACK] Seq=3418 Ack=250 Win=7936 Len=0","0","49895","3306","0x010",""
"43","9.704741","127.0.0.1","127.0.0.1","TCP","40","3306  >  49895 [ACK] Seq=250 Ack=3418 Win=7680 Len=0","0","3306","49895","0x010",""
"44","9.732241","127.0.0.1","127.0.0.1","TCP","52","49896  >  3306 [SYN] Seq=0 Win=8192 Len=0 MSS=65495 WS=256 SACK_PERM=1","0","49896","3306","0x002",""
"45","9.732241","127.0.0.1","127.0.0.1","TCP","52","3306  >  49896 [SYN, ACK] Seq=0 Ack=1 Win=8192 Len=0 MSS=65495 WS=256 SACK_PERM=1","0","3306","49896","0x012",""
"46","9.732241","127.0.0.1","127.0.0.1","TCP","40","49896  >  3306 [ACK] Seq=1 Ack=1 Win=8192 Len=0","0","49896","3306","0x010",""
"47","9.739741","127.0.0.1","127.0.0.1","MySQL","118","Server Greeting proto=10 version=5.6.20","78","3306","49896","0x018",""
"48","9.779742","127.0.0.1","127.0.0.1","TCP","40","49896  >  3306 [ACK] Seq=1 Ack=79 Win=7936 Len=0","0","49896","3306","0x010",""
"49","9.782242","127.0.0.1","127.0.0.1","MySQL","127","Login Request user=root","87","49896","3306","0x018",""
"50","9.782242","127.0.0.1","127.0.0.1","TCP","40","3306  >  49896 [ACK] Seq=79 Ack=88 Win=7936 Len=0","0","3306","49896","0x010",""
"51","9.787242","127.0.0.1","127.0.0.1","MySQL","88","Auth Switch Request","48","3306","49896","0x018",""
"52","9.787242","127.0.0.1","127.0.0.1","TCP","40","49896  >  3306 [ACK] Seq=88 Ack=127 Win=7936 Len=0","0","49896","3306","0x010",""
"53","9.789742","127.0.0.1","127.0.0.1","MySQL","44","Auth Switch Response","4","49896","3306","0x018",""
"54","9.789742","127.0.0.1","127.0.0.1","TCP","40","3306  >  49896 [ACK] Seq=127 Ack=92 Win=7936 Len=0","0","3306","49896","0x010",""
"55","9.789742","127.0.0.1","127.0.0.1","MySQL","51","Response OK","11","3306","49896","0x018",""
"56","9.789742","127.0.0.1","127.0.0.1","TCP","40","49896  >  3306 [ACK] Seq=92 Ack=138 Win=7936 Len=0","0","49896","3306","0x010",""
"57","9.789742","127.0.0.1","127.0.0.1","MySQL","47","Request Set Option","7","49896","3306","0x018",""
"58","9.789742","127.0.0.1","127.0.0.1","TCP","40","3306  >  49896 [ACK] Seq=138 Ack=99 Win=7936 Len=0","0","3306","49896","0x010",""
"59","9.789742","127.0.0.1","127.0.0.1","MySQL","49","Response","9","3306","49896","0x018",""
"60","9.789742","127.0.0.1","127.0.0.1","TCP","40","49896  >  3306 [ACK] Seq=99 Ack=147 Win=7936 Len=0","0","49896","3306","0x010",""
"61","9.789742","127.0.0.1","127.0.0.1","MySQL","87","Request Query","47","49896","3306","0x018",""
"62","9.789742","127.0.0.1","127.0.0.1","TCP","40","3306  >  49896 [ACK] Seq=147 Ack=146 Win=7936 Len=0","0","3306","49896","0x010",""
"63","9.789742","127.0.0.1","127.0.0.1","MySQL","51","Response OK","11","3306","49896","0x018",""
"64","9.789742","127.0.0.1","127.0.0.1","TCP","40","49896  >  3306 [ACK] Seq=146 Ack=158 Win=7936 Len=0","0","49896","3306","0x010",""
"65","9.789742","127.0.0.1","127.0.0.1","MySQL","49","Request Use Database","9","49896","3306","0x018",""
"66","9.789742","127.0.0.1","127.0.0.1","TCP","40","3306  >  49896 [ACK] Seq=158 Ack=155 Win=7936 Len=0","0","3306","49896","0x010",""
"67","9.789742","127.0.0.1","127.0.0.1","MySQL","51","Response OK","11","3306","49896","0x018",""
"68","9.789742","127.0.0.1","127.0.0.1","TCP","40","49896  >  3306 [ACK] Seq=155 Ack=169 Win=7936 Len=0","0","49896","3306","0x010",""
"69","9.789742","127.0.0.1","127.0.0.1","MySQL","106","Request Query","66","49896","3306","0x018",""
"70","9.789742","127.0.0.1","127.0.0.1","TCP","40","3306  >  49896 [ACK] Seq=169 Ack=221 Win=7936 Len=0","0","3306","49896","0x010",""
"71","9.789742","127.0.0.1","127.0.0.1","MySQL","109","Response","69","3306","49896","0x018",""
"72","9.789742","127.0.0.1","127.0.0.1","TCP","40","49896  >  3306 [ACK] Seq=221 Ack=238 Win=7936 Len=0","0","49896","3306","0x010",""
"73","9.789742","127.0.0.1","127.0.0.1","TCP","1500","49896  >  3306 [ACK] Seq=221 Ack=238 Win=7936 Len=1460 [TCP segment of a reassembled PDU]","1460","49896","3306","0x010",""
"74","9.789742","127.0.0.1","127.0.0.1","TCP","1500","49896  >  3306 [ACK] Seq=1681 Ack=238 Win=7936 Len=1460 [TCP segment of a reassembled PDU]","1460","49896","3306","0x010",""
"75","9.789742","127.0.0.1","127.0.0.1","TCP","40","3306  >  49896 [ACK] Seq=238 Ack=3141 Win=8192 Len=0","0","3306","49896","0x010",""
"76","9.789742","127.0.0.1","127.0.0.1","TCP","1500","49896  >  3306 [ACK] Seq=3141 Ack=238 Win=7936 Len=1460 [TCP segment of a reassembled PDU]","1460","49896","3306","0x010",""
"77","9.789742","127.0.0.1","127.0.0.1","TCP","1500","49896  >  3306 [ACK] Seq=4601 Ack=238 Win=7936 Len=1460 [TCP segment of a reassembled PDU]","1460","49896","3306","0x010",""
"78","9.789742","127.0.0.1","127.0.0.1","TCP","1500","49896  >  3306 [ACK] Seq=6061 Ack=238 Win=7936 Len=1460 [TCP segment of a reassembled PDU]","1460","49896","3306","0x010",""
"79","58.301227","192.168.1.25","255.255.255.255","DHCP","328","DHCP Inform   - Transaction ID 0x6cac2df8","","","","",""
"80","61.359376","192.168.1.25","255.255.255.255","DHCP","328","DHCP Inform   - Transaction ID 0x6cac2df8","","","","",""
"81","70.296726","127.0.0.1","127.0.0.1","TCP","52","50183  >  3306 [SYN] Seq=0 Win=8192 Len=0 MSS=65495 WS=256 SACK_PERM=1","0","50183","3306","0x002",""
"82","70.296726","127.0.0.1","127.0.0.1","TCP","52","3306  >  50183 [SYN, ACK] Seq=0 Ack=1 Win=8192 Len=0 MSS=65495 WS=256 SACK_PERM=1","0","3306","50183","0x012",""
"83","70.296726","127.0.0.1","127.0.0.1","TCP","40","50183  >  3306 [ACK] Seq=1 Ack=1 Win=8192 Len=0","0","50183","3306","0x010",""
"84","70.385731","127.0.0.1","127.0.0.1","MySQL","118","Server Greeting proto=10 version=5.6.20","78","3306","50183","0x018",""
"85","70.385731","127.0.0.1","127.0.0.1","TCP","40","50183  >  3306 [ACK] Seq=1 Ack=79 Win=7936 Len=0","0","50183","3306","0x010",""
"86","70.385731","127.0.0.1","127.0.0.1","MySQL","127","Login Request user=root","87","50183","3306","0x018",""
"87","70.385731","127.0.0.1","127.0.0.1","TCP","40","3306  >  50183 [ACK] Seq=79 Ack=88 Win=7936 Len=0","0","3306","50183","0x010",""
"88","70.385731","127.0.0.1","127.0.0.1","MySQL","88","Auth Switch Request","48","3306","50183","0x018",""
"89","70.385731","127.0.0.1","127.0.0.1","TCP","40","50183  >  3306 [ACK] Seq=88 Ack=127 Win=7936 Len=0","0","50183","3306","0x010",""
"90","70.385731","127.0.0.1","127.0.0.1","MySQL","44","Auth Switch Response","4","50183","3306","0x018",""
"91","70.385731","127.0.0.1","127.0.0.1","TCP","40","3306  >  50183 [ACK] Seq=127 Ack=92 Win=7936 Len=0","0","3306","50183","0x010",""
"92","70.385731","127.0.0.1","127.0.0.1","MySQL","51","Response OK","11","3306","50183","0x018",""
"93","70.385731","127.0.0.1","127.0.0.1","TCP","40","50183  >  3306 [ACK] Seq=92 Ack=138 Win=7936 Len=0","0","50183","3306","0x010",""
"94","70.385731","127.0.0.1","127.0.0.1","MySQL","47","Request Set Option","7","50183","3306","0x018",""
"95","70.385731","127.0.0.1","127.0.0.1","TCP","40","3306  >  50183 [ACK] Seq=138 Ack=99 Win=7936 Len=0","0","3306","50183","0x010",""
"96","70.386731","127.0.0.1","127.0.0.1","MySQL","49","Response","9","3306","50183","0x018",""
"97","70.386731","127.0.0.1","127.0.0.1","TCP","40","50183  >  3306 [ACK] Seq=99 Ack=147 Win=7936 Len=0","0","50183","3306","0x010",""
"98","70.387732","127.0.0.1","127.0.0.1","MySQL","87","Request Query","47","50183","3306","0x018",""
"99","70.387732","127.0.0.1","127.0.0.1","TCP","40","3306  >  50183 [ACK] Seq=147 Ack=146 Win=7936 Len=0","0","3306","50183","0x010",""
"100","70.387732","127.0.0.1","127.0.0.1","MySQL","51","Response OK","11","3306","50183","0x018",""
"101","70.387732","127.0.0.1","127.0.0.1","TCP","40","50183  >  3306 [ACK] Seq=146 Ack=158 Win=7936 Len=0","0","50183","3306","0x010",""
"102","70.387732","127.0.0.1","127.0.0.1","MySQL","49","Request Use Database","9","50183","3306","0x018",""
"103","70.387732","127.0.0.1","127.0.0.1","TCP","40","3306  >  50183 [ACK] Seq=158 Ack=155 Win=7936 Len=0","0","3306","50183","0x010",""
"104","70.433734","127.0.0.1","127.0.0.1","MySQL","51","Response OK","11","3306","50183","0x018",""
"105","70.433734","127.0.0.1","127.0.0.1","TCP","40","50183  >  3306 [ACK] Seq=155 Ack=169 Win=7936 Len=0","0","50183","3306","0x010",""
"106","70.433734","127.0.0.1","127.0.0.1","MySQL","106","Request Query","66","50183","3306","0x018",""
"107","70.433734","127.0.0.1","127.0.0.1","TCP","40","3306  >  50183 [ACK] Seq=169 Ack=221 Win=7936 Len=0","0","3306","50183","0x010",""
"108","70.586743","127.0.0.1","127.0.0.1","MySQL","109","Response","69","3306","50183","0x018",""
"109","70.586743","127.0.0.1","127.0.0.1","TCP","40","50183  >  3306 [ACK] Seq=221 Ack=238 Win=7936 Len=0","0","50183","3306","0x010",""
"110","70.586743","127.0.0.1","127.0.0.1","TCP","1500","50183  >  3306 [ACK] Seq=221 Ack=238 Win=7936 Len=1460 [TCP segment of a reassembled PDU]","1460","50183","3306","0x010",""
"111","70.586743","127.0.0.1","127.0.0.1","TCP","1500","50183  >  3306 [ACK] Seq=1681 Ack=238 Win=7936 Len=1460 [TCP segment of a reassembled PDU]","1460","50183","3306","0x010",""
"112","70.586743","127.0.0.1","127.0.0.1","TCP","40","3306  >  50183 [ACK] Seq=238 Ack=3141 Win=8192 Len=0","0","3306","50183","0x010",""
"113","70.586743","127.0.0.1","127.0.0.1","TCP","1500","50183  >  3306 [ACK] Seq=3141 Ack=238 Win=7936 Len=1460 [TCP segment of a reassembled PDU]","1460","50183","3306","0x010",""
"114","70.586743","127.0.0.1","127.0.0.1","TCP","1500","50183  >  3306 [ACK] Seq=4601 Ack=238 Win=7936 Len=1460 [TCP segment of a reassembled PDU]","1460","50183","3306","0x010",""
"115","70.586743","127.0.0.1","127.0.0.1","TCP","1500","50183  >  3306 [ACK] Seq=6061 Ack=238 Win=7936 Len=1460 [TCP segment of a reassembled PDU]","1460","50183","3306","0x010",""
"116","70.586743","127.0.0.1","127.0.0.1","TCP","932","50183  >  3306 [PSH, ACK] Seq=7521 Ack=238 Win=7936 Len=892 [TCP segment of a reassembled PDU]","892","50183","3306","0x018",""
"117","70.586743","127.0.0.1","127.0.0.1","TCP","40","3306  >  50183 [ACK] Seq=238 Ack=8413 Win=8192 Len=0","0","3306","50183","0x010",""
"118","70.586743","127.0.0.1","127.0.0.1","TCP","1500","50183  >  3306 [ACK] Seq=8413 Ack=238 Win=7936 Len=1460 [TCP segment of a reassembled PDU]","1460","50183","3306","0x010",""
"119","70.586743","127.0.0.1","127.0.0.1","MySQL","801","Request Query","761","50183","3306","0x018",""
"120","70.586743","127.0.0.1","127.0.0.1","TCP","40","3306  >  50183 [ACK] Seq=238 Ack=10634 Win=8192 Len=0","0","3306","50183","0x010",""
"121","70.610744","127.0.0.1","127.0.0.1","MySQL","51","Response OK","11","3306","50183","0x018",""
"122","70.610744","127.0.0.1","127.0.0.1","TCP","40","50183  >  3306 [ACK] Seq=10634 Ack=249 Win=7936 Len=0","0","50183","3306","0x010",""
"123","70.792755","127.0.0.1","127.0.0.1","MySQL","45","Request Quit","5","50183","3306","0x018",""
"124","70.792755","127.0.0.1","127.0.0.1","TCP","40","3306  >  50183 [ACK] Seq=249 Ack=10639 Win=7936 Len=0","0","3306","50183","0x010",""
"125","70.792755","127.0.0.1","127.0.0.1","TCP","40","3306  >  50183 [FIN, ACK] Seq=249 Ack=10639 Win=7936 Len=0","0","3306","50183","0x011",""
"126","70.792755","127.0.0.1","127.0.0.1","TCP","40","50183  >  3306 [FIN, ACK] Seq=10639 Ack=250 Win=7936 Len=0","0","50183","3306","0x011",""
"127","70.792755","127.0.0.1","127.0.0.1","TCP","40","3306  >  50183 [ACK] Seq=250 Ack=10640 Win=7936 Len=0","0","3306","50183","0x010",""
"128","71.267777","127.0.0.1","127.0.0.1","TCP","52","50192  >  3306 [SYN] Seq=0 Win=8192 Len=0 MSS=65495 WS=256 SACK_PERM=1","0","50192","3306","0x002",""
"129","71.267777","127.0.0.1","127.0.0.1","TCP","52","3306  >  50192 [SYN, ACK] Seq=0 Ack=1 Win=8192 Len=0 MSS=65495 WS=256 SACK_PERM=1","0","3306","50192","0x012",""
"130","71.267777","127.0.0.1","127.0.0.1","TCP","40","50192  >  3306 [ACK] Seq=1 Ack=1 Win=8192 Len=0","0","50192","3306","0x010",""
"131","71.267777","127.0.0.1","127.0.0.1","MySQL","118","Server Greeting proto=10 version=5.6.20","78","3306","50192","0x018",""
"132","71.267777","127.0.0.1","127.0.0.1","TCP","40","50192  >  3306 [ACK] Seq=1 Ack=79 Win=7936 Len=0","0","50192","3306","0x010",""
"133","71.268777","127.0.0.1","127.0.0.1","MySQL","127","Login Request user=root","87","50192","3306","0x018",""
"134","71.268777","127.0.0.1","127.0.0.1","TCP","40","3306  >  50192 [ACK] Seq=79 Ack=88 Win=7936 Len=0","0","3306","50192","0x010",""
"135","71.268777","127.0.0.1","127.0.0.1","MySQL","88","Auth Switch Request","48","3306","50192","0x018",""
"136","71.268777","127.0.0.1","127.0.0.1","TCP","40","50192  >  3306 [ACK] Seq=88 Ack=127 Win=7936 Len=0","0","50192","3306","0x010",""
"137","71.270777","127.0.0.1","127.0.0.1","MySQL","44","Auth Switch Response","4","50192","3306","0x018",""
"138","71.270777","127.0.0.1","127.0.0.1","TCP","40","3306  >  50192 [ACK] Seq=127 Ack=92 Win=7936 Len=0","0","3306","50192","0x010",""
"139","71.270777","127.0.0.1","127.0.0.1","MySQL","51","Response OK","11","3306","50192","0x018",""
"140","71.270777","127.0.0.1","127.0.0.1","TCP","40","50192  >  3306 [ACK] Seq=92 Ack=138 Win=7936 Len=0","0","50192","3306","0x010",""
"141","71.270777","127.0.0.1","127.0.0.1","MySQL","47","Request Set Option","7","50192","3306","0x018",""
"142","71.270777","127.0.0.1","127.0.0.1","TCP","40","3306  >  50192 [ACK] Seq=138 Ack=99 Win=7936 Len=0","0","3306","50192","0x010",""
"143","71.270777","127.0.0.1","127.0.0.1","MySQL","49","Response","9","3306","50192","0x018",""
"144","71.270777","127.0.0.1","127.0.0.1","TCP","40","50192  >  3306 [ACK] Seq=99 Ack=147 Win=7936 Len=0","0","50192","3306","0x010",""
"145","71.270777","127.0.0.1","127.0.0.1","MySQL","87","Request Query","47","50192","3306","0x018",""
"146","71.270777","127.0.0.1","127.0.0.1","TCP","40","3306  >  50192 [ACK] Seq=147 Ack=146 Win=7936 Len=0","0","3306","50192","0x010",""
"147","71.271777","127.0.0.1","127.0.0.1","MySQL","51","Response OK","11","3306","50192","0x018",""
"148","71.271777","127.0.0.1","127.0.0.1","TCP","40","50192  >  3306 [ACK] Seq=146 Ack=158 Win=7936 Len=0","0","50192","3306","0x010",""
"149","71.272777","127.0.0.1","127.0.0.1","MySQL","49","Request Use Database","9","50192","3306","0x018",""
"150","71.272777","127.0.0.1","127.0.0.1","TCP","40","3306  >  50192 [ACK] Seq=158 Ack=155 Win=7936 Len=0","0","3306","50192","0x010",""
"151","71.273777","127.0.0.1","127.0.0.1","MySQL","51","Response OK","11","3306","50192","0x018",""
"152","71.273777","127.0.0.1","127.0.0.1","TCP","40","50192  >  3306 [ACK] Seq=155 Ack=169 Win=7936 Len=0","0","50192","3306","0x010",""
"153","71.322780","127.0.0.1","127.0.0.1","MySQL","106","Request Query","66","50192","3306","0x018",""
"154","71.322780","127.0.0.1","127.0.0.1","TCP","40","3306  >  50192 [ACK] Seq=169 Ack=221 Win=7936 Len=0","0","3306","50192","0x010",""
"155","71.433787","127.0.0.1","127.0.0.1","MySQL","109","Response","69","3306","50192","0x018",""
"156","71.433787","127.0.0.1","127.0.0.1","TCP","40","50192  >  3306 [ACK] Seq=221 Ack=238 Win=7936 Len=0","0","50192","3306","0x010",""
"157","71.433787","127.0.0.1","127.0.0.1","TCP","1500","50192  >  3306 [ACK] Seq=221 Ack=238 Win=7936 Len=1460 [TCP segment of a reassembled PDU]","1460","50192","3306","0x010",""
"158","71.433787","127.0.0.1","127.0.0.1","TCP","1500","50192  >  3306 [ACK] Seq=1681 Ack=238 Win=7936 Len=1460 [TCP segment of a reassembled PDU]","1460","50192","3306","0x010",""
"159","71.433787","127.0.0.1","127.0.0.1","TCP","40","3306  >  50192 [ACK] Seq=238 Ack=3141 Win=8192 Len=0","0","3306","50192","0x010",""
"160","71.433787","127.0.0.1","127.0.0.1","MySQL","760","Request Query","720","50192","3306","0x018",""
"161","71.433787","127.0.0.1","127.0.0.1","TCP","40","3306  >  50192 [ACK] Seq=238 Ack=3861 Win=7424 Len=0","0","3306","50192","0x010",""
"162","71.434787","127.0.0.1","127.0.0.1","MySQL","51","Response OK","11","3306","50192","0x018",""
"163","71.434787","127.0.0.1","127.0.0.1","TCP","40","50192  >  3306 [ACK] Seq=3861 Ack=249 Win=7936 Len=0","0","50192","3306","0x010",""
"164","71.435787","127.0.0.1","127.0.0.1","MySQL","45","Request Quit","5","50192","3306","0x018",""
"165","71.435787","127.0.0.1","127.0.0.1","TCP","40","3306  >  50192 [ACK] Seq=249 Ack=3866 Win=7424 Len=0","0","3306","50192","0x010",""
"166","71.435787","127.0.0.1","127.0.0.1","TCP","40","3306  >  50192 [FIN, ACK] Seq=249 Ack=3866 Win=7424 Len=0","0","3306","50192","0x011",""
"167","71.435787","127.0.0.1","127.0.0.1","TCP","40","50192  >  3306 [FIN, ACK] Seq=3866 Ack=250 Win=7936 Len=0","0","50192","3306","0x011",""
"168","71.435787","127.0.0.1","127.0.0.1","TCP","40","3306  >  50192 [ACK] Seq=250 Ack=3867 Win=7424 Len=0","0","3306","50192","0x010",""
"169","71.564794","127.0.0.1","127.0.0.1","TCP","52","50193  >  3306 [SYN] Seq=0 Win=8192 Len=0 MSS=65495 WS=256 SACK_PERM=1","0","50193","3306","0x002",""
"170","71.564794","127.0.0.1","127.0.0.1","TCP","52","3306  >  50193 [SYN, ACK] Seq=0 Ack=1 Win=8192 Len=0 MSS=65495 WS=256 SACK_PERM=1","0","3306","50193","0x012",""
"171","71.564794","127.0.0.1","127.0.0.1","TCP","40","50193  >  3306 [ACK] Seq=1 Ack=1 Win=8192 Len=0","0","50193","3306","0x010",""
"172","71.569794","127.0.0.1","127.0.0.1","MySQL","118","Server Greeting proto=10 version=5.6.20","78","3306","50193","0x018",""
"173","71.569794","127.0.0.1","127.0.0.1","TCP","40","50193  >  3306 [ACK] Seq=1 Ack=79 Win=7936 Len=0","0","50193","3306","0x010",""
"174","71.569794","127.0.0.1","127.0.0.1","MySQL","127","Login Request user=root","87","50193","3306","0x018",""
"175","71.569794","127.0.0.1","127.0.0.1","TCP","40","3306  >  50193 [ACK] Seq=79 Ack=88 Win=7936 Len=0","0","3306","50193","0x010",""
"176","71.570794","127.0.0.1","127.0.0.1","MySQL","88","Auth Switch Request","48","3306","50193","0x018",""
"177","71.570794","127.0.0.1","127.0.0.1","TCP","40","50193  >  3306 [ACK] Seq=88 Ack=127 Win=7936 Len=0","0","50193","3306","0x010",""
"178","71.570794","127.0.0.1","127.0.0.1","MySQL","44","Auth Switch Response","4","50193","3306","0x018",""
"179","71.570794","127.0.0.1","127.0.0.1","TCP","40","3306  >  50193 [ACK] Seq=127 Ack=92 Win=7936 Len=0","0","3306","50193","0x010",""
"180","71.570794","127.0.0.1","127.0.0.1","MySQL","51","Response OK","11","3306","50193","0x018",""
"181","71.570794","127.0.0.1","127.0.0.1","TCP","40","50193  >  3306 [ACK] Seq=92 Ack=138 Win=7936 Len=0","0","50193","3306","0x010",""
"182","71.570794","127.0.0.1","127.0.0.1","MySQL","47","Request Set Option","7","50193","3306","0x018",""
"183","71.570794","127.0.0.1","127.0.0.1","TCP","40","3306  >  50193 [ACK] Seq=138 Ack=99 Win=7936 Len=0","0","3306","50193","0x010",""
"184","71.570794","127.0.0.1","127.0.0.1","MySQL","49","Response","9","3306","50193","0x018",""
"185","71.570794","127.0.0.1","127.0.0.1","TCP","40","50193  >  3306 [ACK] Seq=99 Ack=147 Win=7936 Len=0","0","50193","3306","0x010",""
"186","71.570794","127.0.0.1","127.0.0.1","MySQL","87","Request Query","47","50193","3306","0x018",""
"187","71.570794","127.0.0.1","127.0.0.1","TCP","40","3306  >  50193 [ACK] Seq=147 Ack=146 Win=7936 Len=0","0","3306","50193","0x010",""
"188","71.570794","127.0.0.1","127.0.0.1","MySQL","51","Response OK","11","3306","50193","0x018",""
"189","71.570794","127.0.0.1","127.0.0.1","TCP","40","50193  >  3306 [ACK] Seq=146 Ack=158 Win=7936 Len=0","0","50193","3306","0x010",""
"190","71.570794","127.0.0.1","127.0.0.1","MySQL","49","Request Use Database","9","50193","3306","0x018",""
"191","71.570794","127.0.0.1","127.0.0.1","TCP","40","3306  >  50193 [ACK] Seq=158 Ack=155 Win=7936 Len=0","0","3306","50193","0x010",""
"192","71.571794","127.0.0.1","127.0.0.1","MySQL","51","Response OK","11","3306","50193","0x018",""
"193","71.571794","127.0.0.1","127.0.0.1","TCP","40","50193  >  3306 [ACK] Seq=155 Ack=169 Win=7936 Len=0","0","50193","3306","0x010",""
"194","71.571794","127.0.0.1","127.0.0.1","MySQL","106","Request Query","66","50193","3306","0x018",""
"195","71.571794","127.0.0.1","127.0.0.1","TCP","40","3306  >  50193 [ACK] Seq=169 Ack=221 Win=7936 Len=0","0","3306","50193","0x010",""
"196","71.630798","127.0.0.1","127.0.0.1","MySQL","109","Response","69","3306","50193","0x018",""
"197","71.630798","127.0.0.1","127.0.0.1","TCP","40","50193  >  3306 [ACK] Seq=221 Ack=238 Win=7936 Len=0","0","50193","3306","0x010",""
"198","71.631798","127.0.0.1","127.0.0.1","TCP","1500","50193  >  3306 [ACK] Seq=221 Ack=238 Win=7936 Len=1460 [TCP segment of a reassembled PDU]","1460","50193","3306","0x010",""
"199","71.631798","127.0.0.1","127.0.0.1","TCP","1500","50193  >  3306 [ACK] Seq=1681 Ack=238 Win=7936 Len=1460 [TCP segment of a reassembled PDU]","1460","50193","3306","0x010",""
"200","71.631798","127.0.0.1","127.0.0.1","TCP","40","3306  >  50193 [ACK] Seq=238 Ack=3141 Win=8192 Len=0","0","3306","50193","0x010",""
"201","71.631798","127.0.0.1","127.0.0.1","TCP","1500","50193  >  3306 [ACK] Seq=3141 Ack=238 Win=7936 Len=1460 [TCP segment of a reassembled PDU]","1460","50193","3306","0x010",""
"202","71.631798","127.0.0.1","127.0.0.1","TCP","1500","50193  >  3306 [ACK] Seq=4601 Ack=238 Win=7936 Len=1460 [TCP segment of a reassembled PDU]","1460","50193","3306","0x010",""
"203","71.631798","127.0.0.1","127.0.0.1","TCP","1500","50193  >  3306 [ACK] Seq=6061 Ack=238 Win=7936 Len=1460 [TCP segment of a reassembled PDU]","1460","50193","3306","0x010",""
"204","71.631798","127.0.0.1","127.0.0.1","TCP","932","50193  >  3306 [PSH, ACK] Seq=7521 Ack=238 Win=7936 Len=892 [TCP segment of a reassembled PDU]","892","50193","3306","0x018",""
"205","71.631798","127.0.0.1","127.0.0.1","TCP","40","3306  >  50193 [ACK] Seq=238 Ack=8413 Win=8192 Len=0","0","3306","50193","0x010",""
"206","71.631798","127.0.0.1","127.0.0.1","MySQL","1391","Request Query","1351","50193","3306","0x018",""
"207","71.631798","127.0.0.1","127.0.0.1","TCP","40","3306  >  50193 [ACK] Seq=238 Ack=9764 Win=6656 Len=0","0","3306","50193","0x010",""
"208","71.636798","127.0.0.1","127.0.0.1","MySQL","51","Response OK","11","3306","50193","0x018",""
"209","71.636798","127.0.0.1","127.0.0.1","TCP","40","50193  >  3306 [ACK] Seq=9764 Ack=249 Win=7936 Len=0","0","50193","3306","0x010",""
"210","71.638798","127.0.0.1","127.0.0.1","MySQL","45","Request Quit","5","50193","3306","0x018",""
"211","71.638798","127.0.0.1","127.0.0.1","TCP","40","3306  >  50193 [ACK] Seq=249 Ack=9769 Win=6656 Len=0","0","3306","50193","0x010",""
"212","71.638798","127.0.0.1","127.0.0.1","TCP","40","50193  >  3306 [FIN, ACK] Seq=9769 Ack=249 Win=7936 Len=0","0","50193","3306","0x011",""
"213","71.638798","127.0.0.1","127.0.0.1","TCP","40","3306  >  50193 [FIN, ACK] Seq=249 Ack=9769 Win=6656 Len=0","0","3306","50193","0x011",""
"214","71.638798","127.0.0.1","127.0.0.1","TCP","40","3306  >  50193 [ACK] Seq=250 Ack=9770 Win=6656 Len=0","0","3306","50193","0x010",""
"215","71.638798","127.0.0.1","127.0.0.1","TCP","40","[TCP Dup ACK 214#1] 3306  >  50193 [ACK] Seq=250 Ack=9770 Win=6656 Len=0","0","3306","50193","0x010",""
"216","71.638798","127.0.0.1","127.0.0.1","TCP","40","50193  >  3306 [ACK] Seq=9770 Ack=250 Win=7936 Len=0","0","50193","3306","0x010",""
"217","132.033483","127.0.0.1","127.0.0.1","TCP","52","50211  >  3306 [SYN] Seq=0 Win=8192 Len=0 MSS=65495 WS=256 SACK_PERM=1","0","50211","3306","0x002",""
"218","132.033483","127.0.0.1","127.0.0.1","TCP","52","3306  >  50211 [SYN, ACK] Seq=0 Ack=1 Win=8192 Len=0 MSS=65495 WS=256 SACK_PERM=1","0","3306","50211","0x012",""
"219","132.033483","127.0.0.1","127.0.0.1","TCP","40","50211  >  3306 [ACK] Seq=1 Ack=1 Win=8192 Len=0","0","50211","3306","0x010",""
"220","132.102985","127.0.0.1","127.0.0.1","MySQL","118","Server Greeting proto=10 version=5.6.20","78","3306","50211","0x018",""
"221","132.102985","127.0.0.1","127.0.0.1","TCP","40","50211  >  3306 [ACK] Seq=1 Ack=79 Win=7936 Len=0","0","50211","3306","0x010",""
"222","132.102985","127.0.0.1","127.0.0.1","MySQL","127","Login Request user=root","87","50211","3306","0x018",""
"223","132.102985","127.0.0.1","127.0.0.1","TCP","40","3306  >  50211 [ACK] Seq=79 Ack=88 Win=7936 Len=0","0","3306","50211","0x010",""
"224","132.102985","127.0.0.1","127.0.0.1","MySQL","88","Auth Switch Request","48","3306","50211","0x018",""
"225","132.102985","127.0.0.1","127.0.0.1","TCP","40","50211  >  3306 [ACK] Seq=88 Ack=127 Win=7936 Len=0","0","50211","3306","0x010",""
"226","132.102985","127.0.0.1","127.0.0.1","MySQL","44","Auth Switch Response","4","50211","3306","0x018",""
"227","132.102985","127.0.0.1","127.0.0.1","TCP","40","3306  >  50211 [ACK] Seq=127 Ack=92 Win=7936 Len=0","0","3306","50211","0x010",""
"228","132.102985","127.0.0.1","127.0.0.1","MySQL","51","Response OK","11","3306","50211","0x018",""
"229","132.102985","127.0.0.1","127.0.0.1","TCP","40","50211  >  3306 [ACK] Seq=92 Ack=138 Win=7936 Len=0","0","50211","3306","0x010",""
"230","132.102985","127.0.0.1","127.0.0.1","MySQL","47","Request Set Option","7","50211","3306","0x018",""
"231","132.102985","127.0.0.1","127.0.0.1","TCP","40","3306  >  50211 [ACK] Seq=138 Ack=99 Win=7936 Len=0","0","3306","50211","0x010",""
"232","132.102985","127.0.0.1","127.0.0.1","MySQL","49","Response","9","3306","50211","0x018",""
"233","132.102985","127.0.0.1","127.0.0.1","TCP","40","50211  >  3306 [ACK] Seq=99 Ack=147 Win=7936 Len=0","0","50211","3306","0x010",""
"234","132.102985","127.0.0.1","127.0.0.1","MySQL","87","Request Query","47","50211","3306","0x018",""
"235","132.102985","127.0.0.1","127.0.0.1","TCP","40","3306  >  50211 [ACK] Seq=147 Ack=146 Win=7936 Len=0","0","3306","50211","0x010",""
"236","132.102985","127.0.0.1","127.0.0.1","MySQL","51","Response OK","11","3306","50211","0x018",""
"237","132.102985","127.0.0.1","127.0.0.1","TCP","40","50211  >  3306 [ACK] Seq=146 Ack=158 Win=7936 Len=0","0","50211","3306","0x010",""
"238","132.102985","127.0.0.1","127.0.0.1","MySQL","49","Request Use Database","9","50211","3306","0x018",""
"239","132.102985","127.0.0.1","127.0.0.1","TCP","40","3306  >  50211 [ACK] Seq=158 Ack=155 Win=7936 Len=0","0","3306","50211","0x010",""
"240","132.102985","127.0.0.1","127.0.0.1","MySQL","51","Response OK","11","3306","50211","0x018",""
"241","132.102985","127.0.0.1","127.0.0.1","TCP","40","50211  >  3306 [ACK] Seq=155 Ack=169 Win=7936 Len=0","0","50211","3306","0x010",""
"242","132.102985","127.0.0.1","127.0.0.1","MySQL","106","Request Query","66","50211","3306","0x018",""
"243","132.102985","127.0.0.1","127.0.0.1","TCP","40","3306  >  50211 [ACK] Seq=169 Ack=221 Win=7936 Len=0","0","3306","50211","0x010",""
"244","132.195485","127.0.0.1","127.0.0.1","MySQL","109","Response","69","3306","50211","0x018",""
"245","132.195485","127.0.0.1","127.0.0.1","TCP","40","50211  >  3306 [ACK] Seq=221 Ack=238 Win=7936 Len=0","0","50211","3306","0x010",""
"246","132.197985","127.0.0.1","127.0.0.1","TCP","1500","50211  >  3306 [ACK] Seq=221 Ack=238 Win=7936 Len=1460 [TCP segment of a reassembled PDU]","1460","50211","3306","0x010",""
"247","132.197985","127.0.0.1","127.0.0.1","TCP","1500","50211  >  3306 [ACK] Seq=1681 Ack=238 Win=7936 Len=1460 [TCP segment of a reassembled PDU]","1460","50211","3306","0x010",""
"248","132.197985","127.0.0.1","127.0.0.1","TCP","40","3306  >  50211 [ACK] Seq=238 Ack=3141 Win=8192 Len=0","0","3306","50211","0x010",""
"249","132.197985","127.0.0.1","127.0.0.1","MySQL","688","Request Query","648","50211","3306","0x018",""
"250","132.197985","127.0.0.1","127.0.0.1","TCP","40","3306  >  50211 [ACK] Seq=238 Ack=3789 Win=7424 Len=0","0","3306","50211","0x010",""
"251","132.197985","127.0.0.1","127.0.0.1","MySQL","51","Response OK","11","3306","50211","0x018",""
"252","132.197985","127.0.0.1","127.0.0.1","TCP","40","50211  >  3306 [ACK] Seq=3789 Ack=249 Win=7936 Len=0","0","50211","3306","0x010",""
"253","132.233987","127.0.0.1","127.0.0.1","MySQL","45","Request Quit","5","50211","3306","0x018",""
"254","132.233987","127.0.0.1","127.0.0.1","TCP","40","3306  >  50211 [ACK] Seq=249 Ack=3794 Win=7424 Len=0","0","3306","50211","0x010",""
"255","132.233987","127.0.0.1","127.0.0.1","TCP","40","50211  >  3306 [FIN, ACK] Seq=3794 Ack=249 Win=7936 Len=0","0","50211","3306","0x011",""
"256","132.233987","127.0.0.1","127.0.0.1","TCP","40","3306  >  50211 [ACK] Seq=249 Ack=3795 Win=7424 Len=0","0","3306","50211","0x010",""
"257","132.233987","127.0.0.1","127.0.0.1","TCP","40","3306  >  50211 [FIN, ACK] Seq=249 Ack=3795 Win=7424 Len=0","0","3306","50211","0x011",""
"258","132.233987","127.0.0.1","127.0.0.1","TCP","40","50211  >  3306 [ACK] Seq=3795 Ack=250 Win=7936 Len=0","0","50211","3306","0x010",""
"259","150.247262","192.168.1.25","255.255.255.255","DHCP","328","DHCP Inform   - Transaction ID 0x9113739b","","","","",""
"260","153.258872","192.168.1.25","255.255.255.255","DHCP","328","DHCP Inform   - Transaction ID 0x9113739b","","","","",""
"261","223.862434","192.168.1.25","255.255.255.255","DHCP","328","DHCP Inform   - Transaction ID 0xe1678909","","","","",""
"262","227.999670","192.168.1.25","255.255.255.255","DHCP","328","DHCP Inform   - Transaction ID 0xe1678909","","","","",""
"263","323.857226","127.0.0.1","239.255.255.250","SSDP","468","NOTIFY * HTTP/1.1 ","","","","","NOTIFY"
"264","323.857226","127.0.0.1","239.255.255.250","SSDP","468","NOTIFY * HTTP/1.1 ","","","","","NOTIFY"
"265","323.857226","127.0.0.1","239.255.255.250","SSDP","459","NOTIFY * HTTP/1.1 ","","","","","NOTIFY"
"266","323.857226","127.0.0.1","239.255.255.250","SSDP","459","NOTIFY * HTTP/1.1 ","","","","","NOTIFY"
"267","323.857226","127.0.0.1","239.255.255.250","SSDP","511","NOTIFY * HTTP/1.1 ","","","","","NOTIFY"
"268","323.857226","127.0.0.1","239.255.255.250","SSDP","511","NOTIFY * HTTP/1.1 ","","","","","NOTIFY"
"269","323.857226","127.0.0.1","239.255.255.250","SSDP","523","NOTIFY * HTTP/1.1 ","","","","","NOTIFY"
"270","323.857226","127.0.0.1","239.255.255.250","SSDP","523","NOTIFY * HTTP/1.1 ","","","","","NOTIFY"
"271","323.859726","127.0.0.1","239.255.255.250","SSDP","539","NOTIFY * HTTP/1.1 ","","","","","NOTIFY"
"272","323.859726","127.0.0.1","239.255.255.250","SSDP","539","NOTIFY * HTTP/1.1 ","","","","","NOTIFY"
"273","323.859726","127.0.0.1","239.255.255.250","SSDP","525","NOTIFY * HTTP/1.1 ","","","","","NOTIFY"
"274","323.859726","127.0.0.1","239.255.255.250","SSDP","525","NOTIFY * HTTP/1.1 ","","","","","NOTIFY"
"275","326.891646","127.0.0.1","239.255.255.250","SSDP","468","NOTIFY * HTTP/1.1 ","","","","","NOTIFY"
"276","326.891646","127.0.0.1","239.255.255.250","SSDP","468","NOTIFY * HTTP/1.1 ","","","","","NOTIFY"
"277","326.891646","127.0.0.1","239.255.255.250","SSDP","459","NOTIFY * HTTP/1.1 ","","","","","NOTIFY"
"278","326.891646","127.0.0.1","239.255.255.250","SSDP","459","NOTIFY * HTTP/1.1 ","","","","","NOTIFY"
"279","326.891646","127.0.0.1","239.255.255.250","SSDP","511","NOTIFY * HTTP/1.1 ","","","","","NOTIFY"
"280","326.891646","127.0.0.1","239.255.255.250","SSDP","511","NOTIFY * HTTP/1.1 ","","","","","NOTIFY"
"281","326.891646","127.0.0.1","239.255.255.250","SSDP","539","NOTIFY * HTTP/1.1 ","","","","","NOTIFY"
"282","326.891646","127.0.0.1","239.255.255.250","SSDP","539","NOTIFY * HTTP/1.1 ","","","","","NOTIFY"
"283","326.891646","127.0.0.1","239.255.255.250","SSDP","523","NOTIFY * HTTP/1.1 ","","","","","NOTIFY"
"284","326.891646","127.0.0.1","239.255.255.250","SSDP","523","NOTIFY * HTTP/1.1 ","","","","","NOTIFY"
"285","326.891646","127.0.0.1","239.255.255.250","SSDP","525","NOTIFY * HTTP/1.1 ","","","","","NOTIFY"
"286","326.891646","127.0.0.1","239.255.255.250","SSDP","525","NOTIFY * HTTP/1.1 ","","","","","NOTIFY"
"287","329.892074","127.0.0.1","239.255.255.250","SSDP","523","NOTIFY * HTTP/1.1 ","","","","","NOTIFY"
"288","329.892074","127.0.0.1","239.255.255.250","SSDP","523","NOTIFY * HTTP/1.1 ","","","","","NOTIFY"
"289","329.892074","127.0.0.1","239.255.255.250","SSDP","525","NOTIFY * HTTP/1.1 ","","","","","NOTIFY"
"290","329.892074","127.0.0.1","239.255.255.250","SSDP","525","NOTIFY * HTTP/1.1 ","","","","","NOTIFY"
"291","329.892074","127.0.0.1","239.255.255.250","SSDP","511","NOTIFY * HTTP/1.1 ","","","","","NOTIFY"
"292","329.892074","127.0.0.1","239.255.255.250","SSDP","511","NOTIFY * HTTP/1.1 ","","","","","NOTIFY"
"293","329.892074","127.0.0.1","239.255.255.250","SSDP","459","NOTIFY * HTTP/1.1 ","","","","","NOTIFY"
"294","329.892074","127.0.0.1","239.255.255.250","SSDP","459","NOTIFY * HTTP/1.1 ","","","","","NOTIFY"
"295","329.894574","127.0.0.1","239.255.255.250","SSDP","468","NOTIFY * HTTP/1.1 ","","","","","NOTIFY"
"296","329.894574","127.0.0.1","239.255.255.250","SSDP","468","NOTIFY * HTTP/1.1 ","","","","","NOTIFY"
"297","329.897074","127.0.0.1","239.255.255.250","SSDP","539","NOTIFY * HTTP/1.1 ","","","","","NOTIFY"
"298","329.897074","127.0.0.1","239.255.255.250","SSDP","539","NOTIFY * HTTP/1.1 ","","","","","NOTIFY"
"299","455.266515","192.168.1.25","255.255.255.255","DHCP","328","DHCP Inform   - Transaction ID 0x1b4618b7","","","","",""
"300","458.267143","192.168.1.25","255.255.255.255","DHCP","328","DHCP Inform   - Transaction ID 0x1b4618b7","","","","",""
"301","673.113340","192.168.1.25","255.255.255.255","DHCP","328","DHCP Inform   - Transaction ID 0x2c5ea4c1","","","","",""
"302","676.118871","192.168.1.25","255.255.255.255","DHCP","328","DHCP Inform   - Transaction ID 0x2c5ea4c1","","","","",""
"303","767.893099","127.0.0.1","239.255.255.250","SSDP","523","NOTIFY * HTTP/1.1 ","","","","","NOTIFY"
"304","767.893099","127.0.0.1","239.255.255.250","SSDP","523","NOTIFY * HTTP/1.1 ","","","","","NOTIFY"
"305","767.893099","127.0.0.1","239.255.255.250","SSDP","459","NOTIFY * HTTP/1.1 ","","","","","NOTIFY"
"306","767.893099","127.0.0.1","239.255.255.250","SSDP","459","NOTIFY * HTTP/1.1 ","","","","","NOTIFY"
"307","767.893099","127.0.0.1","239.255.255.250","SSDP","511","NOTIFY * HTTP/1.1 ","","","","","NOTIFY"
"308","767.893099","127.0.0.1","239.255.255.250","SSDP","511","NOTIFY * HTTP/1.1 ","","","","","NOTIFY"
"309","767.893099","127.0.0.1","239.255.255.250","SSDP","525","NOTIFY * HTTP/1.1 ","","","","","NOTIFY"
"310","767.893099","127.0.0.1","239.255.255.250","SSDP","525","NOTIFY * HTTP/1.1 ","","","","","NOTIFY"
"311","767.903099","127.0.0.1","239.255.255.250","SSDP","468","NOTIFY * HTTP/1.1 ","","","","","NOTIFY"
"312","767.903099","127.0.0.1","239.255.255.250","SSDP","468","NOTIFY * HTTP/1.1 ","","","","","NOTIFY"
"313","767.903099","127.0.0.1","239.255.255.250","SSDP","539","NOTIFY * HTTP/1.1 ","","","","","NOTIFY"
